video_id,title,published_at,channel_id,view_count,like_count,comment_count,job,id
XSC8dfl1K3A,Travel Assist nicht verfügbar,2022-01-14T14:46:05Z,UCAd8VCpiKI9t29bSs1xyraw,18,0,1,0,0
2JXWgK9IhYs,"PROJECT NEWS - SKODA ENYAQ COUPE, E-FUELS DOCH NICHT UMWELTFREUNDLICH?, u.v.m...",2022-01-14T14:26:00Z,UCOmyWleEFm8SZti-YW26t7w,367,34,3,0,0
DcahxKiyL3Y,#Roadtrip Lillehammer - Unsere erste Reise mit dem Tesla Model Y im winterlichen Norwegen,2022-01-14T10:00:16Z,UCu8t639-H5sPczPp4O_1RPA,1902,62,13,0,0
EguAcPdbzCA,#4 Smart Home im Eigenheim 🏡 | für Einsteiger | Wie baust du es sinnvoll auf?,2022-01-14T15:52:57Z,UCmFmdM1ZMo0xJW-A4vMrcfw,926,27,6,0,0
75FbzGnCdlc,Kia Sportage: Fünfte Generation in der Euro-Edition | ADAC,2022-01-14T16:45:00Z,UCJTQxEGVqCFsBuHUyxgaVqQ,24195,390,32,0,0
h-I6Gklr_Ag,"Denk nicht Schwarz-Weiss, sondern in Wahrscheinlichkeiten - So triffst du bessere Entscheidungen",2022-01-14T18:00:16Z,UC_lJhxDP3hh-Njx6U6ltdzg,955,46,35,0,0
xce2O01Kz0c,Winterverbrauch des e-Golf,2022-01-14T05:18:33Z,UCRRxzdKlHLR0rsnfPP-RZHQ,440,9,6,0,0
HNtlyDX6yA4,Meine TESLA News aus KW 02 2022,2022-01-14T20:00:10Z,UCua87-Wr29nGhVLzZrN2e_g,3555,237,34,0,0
b0iKFvTk6cs,📚 Die 10 erfolgreichsten Autos 2021 in 🇩🇪 | #autowissen #ranking,2022-01-14T18:27:59Z,UCOlgITVVhJf_E8oMtMWW0Ow,27362,3584,29,0,0
w0Iio7luFDc,Ein unmoralisches Angebot!,2022-01-14T17:55:01Z,UCSmH2fdr86LXpn_ZikVW8Wg,426,39,11,0,0
YrushqS4al4,Mercedes-Benz VISION EQXX - UI/UX im VISION EQXX - der unvoreingenommene Reisebegleiter,2022-01-14T10:00:16Z,UCy_wfdc0rV7fi_YLhmKQ9gw,91,1,1,0,0
XW6ty0DWTOI,🔥BREAKING NEWS🔥 Tesla Model Y Performance weiss aus GF4 Berlin Grünheide? Model 3 Neue Reichweite!,2022-01-14T12:18:17Z,UCch0rVLkV6JcjWCsVgj7zSQ,2260,134,18,0,0
YYAteZFjqik,📚 Handy-Akku bei Kälte schneller leer: Daran liegt's! | WWWT | #Shorts,2022-01-14T12:17:59Z,UCTdG69FrzLvvo-VLI9C8vww,369753,36624,202,0,0
OXHetD_YlCU,Mercedes S Klasse,2022-01-14T20:59:06Z,UCT7bxkTuX-0BMNhheIbcKYQ,827,35,1,0,0
oIT5XQ1zDBM,Schlechte Bezahlung und Überlastung: Studie sieht akute Gefahr in Pflege!,2022-01-14T17:00:45Z,UCwtBLZ8VGfchDTJ_cYZ5S1A,4359,134,40,0,0
zgljbtLJ6hU,8 Faktoren für Wirtschaftlichkeit von Stromspeichern: 2 Photovoltaik-Anlagen - krasse Unterschiede,2022-01-14T16:07:17Z,UC-k-5F2j4CUzuwkx1QLRlpA,23321,793,263,0,0
ctDVqP_bpDQ,Die schrägenNEWS KW02/2022,2022-01-14T18:55:39Z,UCHeWtVw_wNCUZkzc5wif2FQ,2748,164,41,0,0
JjbkrW0GJ6w,Gilets Jaunes Internationale - Was wollen eigentlich die Gelbwesten? - Sind das etwa alles »Rechte«?,2022-01-14T21:13:51Z,UCtetxOGbXXz8Qe27g7Fs8fQ,196,22,6,0,0
6LC_qgSpktk,Zeig mir dein PV Angebot #17 - ausgeförderte PV + neue PV: Rudi macht es einfach:-),2022-01-14T07:00:01Z,UC4t0KuLYBiXqXF27UtjLxPw,1835,147,60,0,0
Zs_4J4U_9Vw,WEG Novelle 2022: Welche Auskunftspflicht hat eine Hausverwaltung? | Hausverwaltung & Immo Jaklitsch,2022-01-14T16:00:30Z,UCtPRryfqfAvkYmOdw6f4ocw,384,10,3,0,0
KvMw1wEOyNI,Verbesserungsvorschlag Bakelit,2022-01-14T11:09:26Z,UCBDrySIhLtAHFywlq5BNgag,1833,46,39,0,0
4AoYvv8GQ2E,WIRD DIE NEUE KRYPTO STEUER ALLES VERÄNDERN?,2022-01-14T19:00:13Z,UCeekAvPeoU9n0t52yr3deyA,1772,101,50,0,0
S4IsoDKBSd0,Volkswagen ID.4 POV Test Drive,2022-01-14T12:15:01Z,UC8DMgqjJ7zdlEBLC3U-CSTQ,625,14,2,0,0
fvuDPhqfcCI,Ist B.E.N.D.I.T Hidalgo tot? Ford Mustang Mach-E regt sich nicht! 12V Batterie?,2022-01-14T12:09:48Z,UCsNdsFTTBj5jcRJSWeJ8-Xg,6366,259,158,0,0
wmZZzodstRo,Testing 0 - 100 km/h Vinfast VF e34,2022-01-14T08:02:43Z,UCibWWm-CmjwIFqp25VNmuqg,2652,56,3,0,0
Z_dgXvrRgeY,Wo ist die Mische?,2022-01-14T12:09:09Z,UCFtYqqD5WFQLcEO0ZxBZzFA,5020,200,11,0,0
lSAViB15jH0,CUPRA Formentor eHybrid | Vor- und Nachteile des Plug-in-Hybrid im Test,2022-01-14T17:30:08Z,UCY6-ahhvT6YHuhnq8CEgHVw,15831,108,28,0,0
moQlnOA2qC0,Zwei Dumme | Codenames,2022-01-14T17:05:00Z,UCqwGaUvq_l0RKszeHhZ5leA,165602,11511,543,0,0
5abXk18C7ZI,FiveM wird AUSEINANDER genommen Teil 87!!!,2022-01-14T11:00:03Z,UCU1JWaWJJeLRoNuO2bohFIg,25095,1462,84,0,0
ecbH8o2leCo,Spielen beim Tesla fahren möglich?,2022-01-14T16:59:03Z,UCSmH2fdr86LXpn_ZikVW8Wg,1656,54,1,0,0
VJ9xtn2rG2s,Warum du auf eine Model Y Bestellung warten solltest! #Podcast,2022-01-14T15:31:49Z,UCl589xNEqGyZs2QkrDbBzDA,2261,140,8,0,0
gU5zfgtjjyI,Jan zeigt euch den Mercedes AMG EQS Innenraum! 👀 #shorts | Electric Cars | interior | Hyperscreen,2022-01-14T11:00:32Z,UCy9Y4en2y1eR1zwcmFkRMzg,2132,62,2,0,0
JTBE96vX3Zw,TOGG'DA BÜYÜK GELİŞME! HAYRAN KALDILAR!,2022-01-14T11:00:11Z,UCht9PvRVtovXZq_mNtVmWHg,20610,519,66,0,0
F6EPZY30mLE,Lisa´s Ladesäulencheck - SuperCharger Dettelbach,2022-01-14T17:00:10Z,UCh_Xg4Ff_mWHKqLHCHwFsNQ,397,68,10,0,0
-NrFY7dFpj8,Erzwungene Nachhaltigkeit: Mangel bei Neu- und Gebrauchtwagen | quer vom BR,2022-01-14T23:00:00Z,UCAeXKE-3J-6u68tO5Oafyag,32257,552,236,0,0
NYgMK6FnWe4,VOLVO S60 APSKATS,2022-01-14T09:19:24Z,UCbdwnsZdvzcRVfhba-LYOMw,10939,336,248,0,0
A-0PpGYf5qI,Wir testen den neuen Fiat 500e! / Unser erster Elektroauto-Test!!,2022-01-15T08:00:09Z,UCogxncKkU0pRcp9grpx17Qw,1497,30,1,0,0
M0dFMmHVjkg,Diese fünf Sachen machen den Renault Twingo Electric so gut | Elektroauto Kleinwagen Check,2022-01-15T17:30:11Z,UCLl58-a6yGI5V_jiYVWZm9g,4240,127,56,0,0
iVMzXNm7KDY,Dacia Spring Elektro: günstiger Verkaufspreis - Verbrauch/Reichweite bei max. 80 km/h,2022-01-15T16:22:01Z,UCev8ERhEE652NjUgGlPEOlQ,11950,320,180,0,0
PUoCc6gY3KY,Elektroautos einfach in Hamburg mieten.,2022-01-15T11:59:00Z,UC4JPiRyyjuLWdcjtMdhE7rA,26,3,1,0,0
TaKmv_WWLoA,Ford MUSTANG MACH-E rien ne va plus - nichts geht mehr! Das Pony verweigert den DIENST!,2022-01-15T06:00:06Z,UCsNdsFTTBj5jcRJSWeJ8-Xg,18964,1335,283,0,0
jK_PaiizzT8,7 Tage E-Auto ohne Lademöglichkeit zu Hause - Kia e-Niro 64 kWh (204 PS) - Test Bericht VLOG deutsch,2022-01-15T15:51:09Z,UCEBlNJ6B9LV-CRrJXoKqFfA,22513,1138,189,0,0
5IKC_5djV1s,Top Ten 2021 | Die 10 meist zugelassenen Autos des Jahres | Ranking mit Untertitel,2022-01-15T23:00:03Z,UCJrXOOtvmGn4CF7aYaJwuHA,28749,584,76,0,0
1MaWuUL_oI4,E-Fuel-Today und Walter Röhrl - So viel Mist auf einmal ist kaum zu ertragen,2022-01-15T08:00:01Z,UC7FoJVkvzBr5Rp0YCB5tvuA,18050,1545,973,0,0
qp5lw44_YkU,1.000 Kilometer im Elektro-BMW iX3 - Sommer 2021 -inkl. RANT! E-Auto HASSER,2022-01-15T10:30:08Z,UCVKe3-5kQRddaOHTdn-_Qbw,13165,680,183,0,0
9TYpOTTbV0I,"Rekorde, e-Pick-up, Sony-Auto & Co - Die 7 wichtigsten Autos der CES 2022",2022-01-15T08:00:06Z,UCLINPbYQ9sy6qc-TqtBeVnw,38190,985,108,0,0
vh-yZ0WVJX8,Autonomer Dacia Spring Eletric? Fazit nach zwei Monaten,2022-01-15T21:12:28Z,UC7twZxr2mZEIVqsco9qzMzg,8713,,35,0,0
NGEHCLUu164,Deutsche Regierung sieht Elektroautos als Zukunft & nicht E-Fuels!  #Podcast,2022-01-15T14:45:00Z,UCl589xNEqGyZs2QkrDbBzDA,833,95,4,0,0
By_K53dmDlE,DHL bestellt 12 Elektroflugzeuge,2022-01-15T18:23:24Z,UCCdmiHL_SeXkAZlWNC1KvWA,694,22,9,0,0
sQzdetW1J3s,"Neuer Kanal 4K - ""Elektroauto, Geocaching, Essen & Trinken"" Elektromobilität - Trittbrettfahrer VLOG",2022-01-15T13:03:38Z,UCQJj65gOTHg1dGnG9Q-rpmg,44,4,2,0,0
r72IToWDfoU,NIO OS Aspen3.1.0 mit englischer Sprache Teil 1,2022-01-15T07:11:57Z,UC4UtVUqLYn8K-z-G5-eWBhA,225,13,4,0,0
uJv90wMuFzg,⚡️Sony Vision-S 02 🔋 sieht so das Elektro SUV der Zukunft aus❓,2022-01-15T09:01:15Z,UCuPH6ouleIo8IhmZy65m4pA,750,64,24,0,0
2LFN9gvtD_k,KIA EV 6 - Probefahrteindrücke - sportliche Optik - klapperfrei - gute Reichweite.,2022-01-15T13:49:31Z,UC0hW-2H5wgNwQf9Vc6i4BFA,3448,39,11,0,0
WFAIv6cblrg,Führerscheinfrei!!! Alle Fahrzeuge im großen Vergleich Canta Agora Ligier,2022-01-15T15:00:14Z,UCJXnkzTCG4MR0zYpzgQZ0Sw,3638,200,48,0,0
p1aNmy7EUqs,Tesla Model Y LR 2021 345 PS | Test Drive | Review | Probefahrt,2022-01-15T22:28:31Z,UC6Y6a-x4DfTxxh4X9Y4NF2g,7052,139,49,0,0
AtXbICMDHO0,"2022 Peugeot 208 1.2 PureTech 130 GT EAT8 - Kaufberatung, Test deutsch, Review, Fahrbericht",2022-01-15T07:18:35Z,UCAXLYcPBW3AJ52ZAhinOyFQ,36191,614,174,0,0
Q805IKa3bag,Tesla Model 3 SR+ Winter Batterie Degradation! | Morsch,2022-01-15T17:48:03Z,UCZn89OCFw1OSFBdGcXEFdWw,1706,60,6,0,0
SjldJjkonHk,Tesla ModelS und X mit CCS und mehr Reichweite für das ModelY Tagesthema Elektromobilität Nr.436,2022-01-15T15:40:50Z,UCHuXYLIv70fPKK9c60TwLQw,149,17,1,0,0
_YyUKfSxAVU,"1 Jahr Model 3 LR - Alle Details zu Kosten, Verbrauch, Reichweite, Verlusten, Reku etc. in 2021",2022-01-15T20:07:42Z,UCPcDt-Td-gfYHqrfao0HpWg,453,19,10,0,0
yJq4nT2oPvY,Verbrauch Tesla Model 3 SR+ mit Dach Fahrradträger bei 130 km/h,2022-01-15T10:00:36Z,UCQOnq7u47LRBgWXr1Xc-XWQ,1087,89,21,0,0
weBq6fhNDjc,Abonnent Bekommt Kot | Renault Twizy | Ich Kaufe Mir Ein Mikrofon| Drive In 🍔👑,2022-01-15T17:50:19Z,UCV-AovyF7Ku5Ksh2aO8yfiA,76,8,8,0,0
iK-MBzgy8q4,WeCharge App im VW ID.4 GTX und wie VW das Auto jederzeit mit Apps versorgen kann in Zukunft,2022-01-15T17:30:04Z,UCtJVEkzgdY-8IuABkQbylEA,1304,62,7,0,0
gFEc9dzoY9Q,Tesla Model S nach 145.000 KM defekt? Roadtrip zum Ladepark Hilden 2022 I Ladestation I Interview,2022-01-15T10:00:16Z,UCB1u0zrnzISHhTKR8PobdJA,345,25,8,0,0
KMqw6B55VLo,Erste Langstreckenfahrt im Hyundai Kona Ultimate EV - I95 to Sandwich Massachusetts,2022-01-15T11:23:52Z,UCZp4-WU_SpokD0WHnJFFEYA,450,65,35,0,0
mOiXGj2tRF4,Cupra Born im Winter Check (2022) ❄️ Wie weit kommt man wirklich?! Fahrbericht | Review | Test,2022-01-15T16:00:32Z,UCy9Y4en2y1eR1zwcmFkRMzg,30421,543,160,0,0
bBK16H3jHtc,⚡Beim ID.3 mit Sprachbefehlen Hauptmenüs aufrufen,2022-01-15T13:28:18Z,UCMZbix9CwEuL6l9SJIb2Zxw,638,62,9,0,0
fMWnL1Mz3Jo,Über 30 kWh Verbrauch durch Akkuheizung? 🤨 Macht das Vorkonditionieren Sinn? Tesla Model Y LR,2022-01-15T23:00:30Z,UCDJ45QyDA0gS3ZaX3p6skBQ,6161,287,110,0,0
pQPAyjCRet0,Tesla Model 3 SR+ Verbrauch bei Kälte 🧐 Wie weit kommt man 🤯und was ist möglich? Autobahnfahrt bei 🥶,2022-01-15T07:00:13Z,UCpcjT919sABNeeMsHfiD9Dg,3588,121,35,0,0
xxrEiIOfv-E,Live Stream:  der neue Opel Rocks-e am 14.01.2022 | ab 18 Uhr | Hoppmann Autowelt,2022-01-15T05:20:44Z,UCpoalFzCr5KoJphIfPs5-Cg,438,9,3,0,0
NkkvHDUfcbs,EUROPATOUR || Die vergessene Stadt SREBRENICA…,2022-01-15T17:00:12Z,UCRg5hjP_PTktl7jn5XuKs-g,207,28,9,0,0
AyyMhBBydWI,Wie lang ist mein Führerscheinantrag gültig? Fristen für den Führerschein/Fahrschule 💳🚗,2022-01-15T18:00:04Z,UCmu4XSqANh-pqFCYpwZ9y3w,1412,72,24,0,0
kLbfK58qpNg,"Die Top 20 Dinge, die Tesla falsch macht",2022-01-15T09:00:32Z,UC4EujwlrtuwSLV_iHO64o-w,2753,65,111,0,0
PlhFlinsJp0,ICH SPIELE MIT JEMANDEN VOM DARKWEB GTA RP! (GTA RP TROLLING),2022-01-15T15:49:51Z,UCI4QtJ0_FYDIRN-WbY8aLew,30692,2439,137,0,0
zrxFwVoXIjg,Tesla Cybertruck Segnung (Supercharger Hilden) Premiere!,2022-01-15T17:09:22Z,UCnO3VZ_KQpBcUq6h5oJ1b6A,302,12,7,0,0
tU1scAtZbyw,Lehrer VLOG // komplett überfordert,2022-01-15T18:27:14Z,UCPkqHrggSbziprjKJCre_ZQ,1097,25,11,0,0
8RP3dB-CLlg,Wasserstoff Flammen Temperatur Wasserstoff Heizwert und Brennwert.,2022-01-15T09:51:52Z,UCoTOo0pjfSoBFTP3uXPi8jA,427,13,5,0,0
uxVahO1nHbc,Polizeihubschrauber mit Laserpointer geblendet | Abendschau | BR24,2022-01-15T10:59:47Z,UCcweJsCV2TUP_kzMX25U-oQ,123122,2377,558,0,0
8jxubSiz-As,„Ich habe viel nachgedacht“: WAS führt SÖDER im Schilde?,2022-01-15T16:55:00Z,UCqZSdUJqd2T0oqr6BEA3ONw,42809,4705,638,0,0
ukHRhE-KeV8,WDR verharmlost Blackout des Stromnetzes!,2022-01-15T07:08:30Z,UCC02xOJrIiMU1FVgzMrnsew,90,7,2,0,0
jJn45M7wQhg,Taxonomie oder die teure Kugel Eis der Energiewende,2022-01-15T23:00:32Z,UCwWywgs5YJsI0gMgjdecpYA,119,16,18,0,0
2D-UY7Y4Vwk,TESLA am Limit: Logistik in Shanghai kommt nicht hinterher,2022-01-15T15:58:31Z,UCpPbcfwq0wOpWrC0gBs73tQ,17348,897,63,0,0
02lL17ZM1d0,Elektroauto Lexikon #1 - Laden wirklich einfacher als tanken?,2022-01-16T08:29:20Z,UCiZnK4X73okItJqaCs2YDOQ,89354,5236,914,0,0
xeyh82XgHV0,Prof Dr Fritz Indra ueber Elektroautos,2022-01-16T02:36:07Z,UC27OBtfh8oIJMKmX8lj2mjQ,186,1,4,0,0
EF7pEr144UE,"Maingau erhöht die Preise, Tesla Model S Facelift, Batterie statt E-Fuels, 300 Euro THG-Quote",2022-01-16T08:00:03Z,UCBc0Mghy-6jhMXs3T7DluMg,9464,670,111,0,0
c--NPpQRve0,E-Auto E33: Vorklimatisierung des Peugeot e208. Funktioniert das wirklich zufriedenstellend?,2022-01-16T22:03:43Z,UC9a6FuDmvlQaInPO-1357Sg,1057,52,29,0,0
XTD6jcrCxbw,Peugeot e-208 GT Pack (2022) Besser als Renault Zoe & Opel Corsa-e? 🦁 Fahrbericht | Review | Test,2022-01-16T16:00:14Z,UCy9Y4en2y1eR1zwcmFkRMzg,30364,589,112,0,0
QEK2HBbDIf8,"Live B.E.N Spätschoppen: Lucid trödelt, Shell-Ladehub statt Tankstelle, eAuto für Außendienstler",2022-01-16T23:50:25Z,UCsNdsFTTBj5jcRJSWeJ8-Xg,6460,532,24,0,0
OpaC6UPdpks,VW E-Up! kommt zurück! Aber wie lange? | Wissing warnt vor Verbrennern | Das Aus für Verbrenner?,2022-01-16T19:42:40Z,UCaCaZ-vKtnMG2_FKmEePChQ,9838,607,108,0,0
EpWzrKI_AY8,Audi Q4 40 E-Tron Sportback REVIEW -- Besser als ID und ENYAQ?,2022-01-16T16:30:03Z,UCjZYXOUdCZ_ELmOvBr2deQg,4844,51,46,0,0
2UuGQjxH--g,⚡️2022 VW e-up Style Plus🔋in Kürze wieder bestellbar❗️aber ist das Comeback noch zeitgemäß❓,2022-01-16T08:32:39Z,UCuPH6ouleIo8IhmZy65m4pA,10970,253,119,0,0
JhAMRGQvA6g,BMW iX Review - Eines der besten E-Autos?,2022-01-16T15:00:09Z,UC-mOrNq0afBUBJlu9qFy-Ww,8924,101,7,0,0
X2hT_gNV7c4,Was ist da los? - Interview mit unglücklichem Ioniq 5 Fahrer - Teil 1,2022-01-16T15:30:08Z,UCJW1S6BOOHD1dyzA2V8rxnw,78101,1371,461,0,0
9GRqjfswXQo,ID3 - Langzeitverbrauch und Neuigkeiten bei JUCR,2022-01-16T14:00:07Z,UCRXTKScMyhaaQ6pvy4WdICQ,2735,119,42,0,0
qlP-KPlpElw,"BMW i3s unique forever Roadtrip to Frankfurt - Mit einem i3 hin, mit 2 i3 zurück inkl. Ladeabenteuer",2022-01-16T17:43:54Z,UCj9bUAQnfngLrdzOKlVtiqg,1490,13,10,0,0
LXabNy172CI,ZOE | Laden und Heizen - Das Finale,2022-01-16T17:00:58Z,UCbPq7xtjc_nnOQxoMTvKcqA,1073,102,20,0,0
GSmAgz3Tu68,Ist das die Zukunft von BMW? iX Exterieur | Teil 1 Produktvorstellung,2022-01-16T11:00:06Z,UCPWyU3Sb-_OyIpr3xpwMO9Q,711,18,1,0,0
gUfWlNQB4aY,GTA Online: Vollidioten im Jahre 2022,2022-01-16T17:09:41Z,UCQfDz2nfoJKstZzBOpu0TXg,64263,4406,788,0,0
Yem2HGia-8A,Solarbeschleunigungspaket / Unsere Photovoltaik-Statistiken 2021 - 18:30 LIVE - Die Gesprächsrunde,2022-01-16T19:16:43Z,UC-k-5F2j4CUzuwkx1QLRlpA,6091,301,34,0,0
rmpp09115Fs,"#xbus, Das musst du bis jetzt wissen! Teil 2, INTERVIEW mit Elektro Camping",2022-01-16T16:00:34Z,UCtjTTWEgZOqIQH4Zf8ltS2w,2107,47,32,0,0
Owt73us0rb4,"Tesla Autopilot Fahrt, Wien, A23, SW 2021.44.30.7",2022-01-16T14:49:07Z,UCEBVLmbktG5c5_FK3BSJrkg,1636,131,50,0,0
QR922spOj6Y,Tesla Model 3 Langzeit-Review auf Langstrecken-Roadtrip nach Lissabon,2022-01-16T19:35:07Z,UC-FC8EKpFK5DSMJjMgxsEdQ,1147,28,11,0,0
oYMsvouCqEc,6.000€ Tesla Erlebnisse,2022-01-16T09:53:36Z,UC_aOreefEh0YC7y5gZToRhw,2146,105,12,0,0
C_OrTAV3aR4,(2022) Cupra Born mit E-Motor 150 kW - Der VW ID.3 im Trainingsanzug - Review I Fahrbericht (4K),2022-01-16T20:52:18Z,UCEIpQSFT56hXhH2SEwuqX4Q,7530,184,15,0,0
5RW-ykqvcOY,Ex Tesla Fahrer Bericht - Lohnt sich der Mach E GT? Erste Eindrücke nach 2000 Meilen in USA.,2022-01-16T17:20:35Z,UCeyJOHxBNN-VlaZDUH-GUbQ,4966,86,17,0,0
2j17qDcHng8,Kilometerstundenwatt und andere lustige Cyndie Versprecher😆,2022-01-16T17:00:02Z,UCVrVBoMZr6paFB4iIl5rSiQ,1198,84,8,0,0
c7xlUK-l_Go,BMW iX xDrive40 - Reichweitentest (130 km/h) | autofilou [2160p],2022-01-16T07:00:13Z,UC2F46HelYVaOBqATF0-TE9Q,2271,62,9,0,0
iFmQhoYAdio,"Was passiert mit deinem Zubehör, bei der Rückgabe?",2022-01-16T16:30:13Z,UCBE4KHslSSQegsWJHU8-2yQ,1797,169,5,0,0
cS6kF1J4Bik,"Kia EV6 GT-line: Geplatzter Urlaub, Carlinkit, Impressionen Norwegen",2022-01-16T16:32:55Z,UCJcM7Rc8MmZehDbaqYWSjBw,1727,27,30,0,0
zVzSsfGcPUk,Tesla wird 2022 wertvollstes Unternehmen der Welt! 5 Billionen $,2022-01-16T06:28:53Z,UC5N7y-3cPaM0JCknYV9bWJA,3492,196,56,0,0
Ad_kPBVuabI,Wilkommen in der Familie. Der Neue Citan ist da :-),2022-01-16T13:00:14Z,UCYDUkIvs9Zt804mThUqLJpw,383,33,15,0,0
He74v_nWqn4,Serbien: Lithium-Abbau? Nein danke! | ARTE Reportage,2022-01-16T14:00:10Z,UCLLibJTCy3sXjHLVaDimnpQ,48231,963,413,0,0
dTr5AQscbcg,2 Jahre Gewährleistung | steht der Automobilhandel vor dem Aus!? | was ist zu beachten? Team Anwalt,2022-01-16T09:00:14Z,UCGZLruV9OMz7JnmXz86ELdg,47044,1945,237,0,0
nAIhCiicf0Q,TESLA bringt Update für Heizungsverlust bei -40 Grad Celsius | Softwareversion 2021.44.30.7,2022-01-16T20:40:54Z,UCsbhQ0l_oRy68zoPpbEYqww,8186,450,52,0,0
SC1eHBFPUrY,NURO R3 der autonome rein elektrisch angetriebene Lieferdienst | Electric Drive News,2022-01-16T07:00:06Z,UCxmohYAjhc2qD5pYIOwQ3bA,921,71,11,0,0
WGFGG473XIY,T&Etalk: Photovoltaik-Strom jetzt auch selbst vermarkten!,2022-01-16T21:02:42Z,UCqQGYPEU7DiNA6bUUmehb8g,2348,124,4,0,0
y7vu0CjeIFo,"CES Nachlese, Remote Sony Vision 2, VW & BMW verdoppeln BEV & Plugin Sales, Autopilot illegal? uvm.",2022-01-16T11:07:37Z,UCAhqXf93x97k2VB1OH_8Spw,467,72,13,0,0
0UNaF8X8sHc,Wasserstoff vs. Elektro - Was setzt sich durch? | HOW TO #SWITCH 6 | Renault Trucks,2022-01-16T09:00:00Z,UCZgrDVOqqoIdu389X9J9RSg,51113,151,14,0,0
zTpXCLRYHUs,Schwachstellen beim smart fortwo | Kaufberatung vom Auto-Insider,2022-01-16T09:15:04Z,UCnBlu8D8a7CIy5c4IsQTPmA,2438,57,16,0,0
lTbzhZvDqZE,AUDI Q4 50 eTron Sportback Test Winterreichweite & Ladezeit 10-80 % Elektroauto #audi #elektroauto,2022-01-17T15:00:24Z,UCVUBc0WF5X-w3T8s6Wyx-jw,18731,691,214,0,0
xHdiHDX-MBc,e-up wieder bestellbar - Kaufberatung - schnell sein lohnt sich!,2022-01-17T18:46:56Z,UCRRxzdKlHLR0rsnfPP-RZHQ,9723,146,54,0,0
z7pLuBcHgqs,"eMobility update: Renault 100% elektrisch bis 2030, Verkehrsminister wackelt, Batteriefabrik Lausitz",2022-01-17T11:01:57Z,UC_vO01sSD25a73DhoaxtZTw,10033,583,50,0,0
jgYkr9wsL80,Technischer Rückblick der eNordkappChallenge2021,2022-01-17T17:00:37Z,UCOrDuaURMo4fB04HMECG0cA,519,59,14,0,0
yedvO92wkTg,AUTARKE Stromversorgung für kleinere Gebäude | kostenlos mit Solarstrom laden,2022-01-17T17:00:46Z,UCewU7vV-uVSVCO8Ai1vr6Kw,88016,2663,315,0,0
C78bUKKPH1g,Falschmeldungen erkennen | Steffen Kutzner - CORRECTIV | Medienforum Mittweida 2021,2022-01-17T09:00:05Z,UC8vKAi5JuaWvI7R2X80M2ow,144,7,1,0,0
N4tng-MvLXs,2022 Cupra Born (204 PS) POV Testdrive AUTOBAHN Beschleunigung & Topspeed,2022-01-17T19:00:14Z,UCpbQsTN36P-1Y_1plPZGntg,11404,67,11,0,0
4pX4DcHFSig,2022 Fiat 500 RED Edition Ausstattung Preis Leistung | Electric Drive News,2022-01-17T14:15:21Z,UCxmohYAjhc2qD5pYIOwQ3bA,6077,181,27,0,0
QRPF41SnavI,Kommt ein MINI RC CRAWLER 1/18 im SCHNEE zurecht?! (Unboxing und Test),2022-01-17T15:15:00Z,UCO7fQ5iAH4XHiXifqM-yWGQ,25379,2087,79,0,0
LN7vbrIocv0,RC Boat | 🥳😉 Super Fast Drone...! 3 in One,2022-01-17T04:58:38Z,UCLh2Gik-OMcsFZBsuZL6A2w,2381,23,1,0,0
71Et0Poiiew,Porsche Taycan Turbo S & Taycan Turbo S Cross Turismo-Nils & Artur präsentieren den Elektro Porsche,2022-01-17T09:37:16Z,UCw-6QlBgdckJ0okq5ZFEwFA,1353,13,1,0,0
nwVEqklLDZI,Fahrt ihr mit einem normalen Auto oder mit einem Elektroauto?,2022-01-17T11:00:32Z,UCuXCs-kLLjshK2_0za3Djhg,65,5,1,0,0
y85AIFTfdCk,e-up vorklimatisieren und vorheizen - Kosten und Anleitung,2022-01-17T14:10:42Z,UCRRxzdKlHLR0rsnfPP-RZHQ,1782,46,10,0,0
r06tM-4K0wI,Der neue Kia Sportage - 2022 - Walkaround und Probefahrt,2022-01-17T16:28:05Z,UCVvYqpzb0nxhklWAloDiDsA,1953,12,2,0,0
yRXpQYAQcMk,Letzter Test-Stream - nächste Woche geht es wieder los...,2022-01-17T04:15:37Z,UCdZ9F6bap1b7JQZ1pZiFJ_w,516,37,2,0,0
TVIbncqDs-A,Photovoltaik: Erweiterung oder Neuanlage - Unterschiede,2022-01-17T06:45:00Z,UC4t0KuLYBiXqXF27UtjLxPw,2055,161,99,0,0
bw81ndMk5Nk,Lohnt sich der Speicher bei PV Anlagen? Detaillierte Berechnung der Amortisation,2022-01-17T19:30:12Z,UCezlRS3CzLXqmTIqqpVdhTw,2529,64,25,0,0
xf8o5-cN8Ao,Der Renault Master E-Tech 100% Electric. Bis zu 195 km Reichweite.*,2022-01-17T13:00:35Z,UCbDG914p1pzNHiXughxCZGg,325,9,3,0,0
wCmbctbYC-g,"Podiumsdiskussion zum Thema ""Bundesverfassungsgericht und Klimaschutzgesetz""",2022-01-17T11:34:53Z,UCqtdqQg-7pVKgJTcqI1NEfg,20,1,1,0,0
KFWm_q9tTBE,Jessi zeigt euch die Allradlenkung des Mercedes AMG EQS! ⚙️ #shorts | AMG Power | Electric Cars,2022-01-17T11:00:07Z,UCy9Y4en2y1eR1zwcmFkRMzg,5743,95,2,0,0
uI8ScfuCey8,Unser Jahresrückblick 2021,2022-01-17T09:45:28Z,UCuHuOR7jHHt5UWN_rnU8EoA,670,17,7,0,0
C8UiUsqjtvU,Das musst du über Roboter-Mensch-Interaktion wissen!,2022-01-17T17:53:02Z,UC0ySQ9t9qNFW3Pxizg6h2lg,77262,556,7,0,0
Z2fE6GURT3E,An Frage um Gender wird klar: Synodaler Weg strebt Pseudo-Nationalkirche an,2022-01-17T16:00:15Z,UCthYpKoujTMmDX75fGr5o8A,598,81,36,0,0
T8w_O_8mb9o,"BYD - Autonomes fahren, eigenes Lithium & mehr, Alibaba's nächster Fehltritt? Unilever unter Druck",2022-01-17T14:19:49Z,UCiSnqNN9sYLTDBjnIjGDE7g,2308,115,2,0,0
w_dXyVxtfHc,Erhöhung der Motorfahrzeugsteuer im Kanton Bern,2022-01-17T06:00:27Z,UC39JD8-DIemLQS1NPKZMjnA,462,11,2,0,0
0vlDyqLcgfs,BMW iX3: Zukunft oder Auslaufmodell? - Test/Review | auto motor und sport,2022-01-18T15:00:00Z,UCLINPbYQ9sy6qc-TqtBeVnw,63717,1170,480,0,0
7TwoPhcTfyQ,Hyundai Ioniq 5 (2022) Besser als Kia EV6 und Tesla Model Y?! 🧡 Fahrbericht | Review | Test | Laden,2022-01-18T16:56:59Z,UCy9Y4en2y1eR1zwcmFkRMzg,24482,576,202,0,0
wYcsxqcdugc,E-Auto E34: Peugeot e208 im Winter auf Kurzstrecke. Was schluckt er?,2022-01-18T17:16:32Z,UC9a6FuDmvlQaInPO-1357Sg,1023,41,18,0,0
hLdDB_BFxIM,Kann man den Akku manuell vorheizen? | Diese Funktionen sind neu beim KIA e-Niro Update,2022-01-18T17:00:09Z,UCLl58-a6yGI5V_jiYVWZm9g,7279,196,72,0,0
wSk0EajQfF8,Der erste Service meines Tesla Model 3 Performance 2022,2022-01-18T10:30:11Z,UCBSRm3J7N7zn3TQNHCrZMSw,7012,212,38,0,0
0qhQB75hWFc,IONIQ 5  - Hypermiling 400km auf der Autobahn im Winter - 6°/0°Außentemperatur,2022-01-18T15:14:35Z,UCKJaXPSA7xwcxQDgAy3mnLQ,3698,94,18,0,0
r0p8SyLNsUU,Fellner! LIVE: Sebastian Bohrn Mena vs. Gerald Grosz,2022-01-18T21:00:32Z,UCyQpfuhftLvrmjxgEzVH78Q,120609,2676,2425,0,0
AHHkUBqmaOg,Schon wieder eine Postkarte? #shorts,2022-01-18T16:27:38Z,UChjA0Vy8gClgOU9W1ttvt8w,3867,227,13,0,0
S9viruqAz-8,Beurteilung über denn Rock-e und wie die momentane lage ist,2022-01-18T22:38:16Z,UCiK8cm8vypvg-WyvTMHjl4Q,184,2,6,0,0
swiW69vpjqc,Von Å nach Bee: Der Porsche Taycan im Reichweitentest,2022-01-18T17:03:18Z,UCtD9X05CG3CF-ktaeRdb02w,759,29,1,0,0
bXljDuouVds,Innovation ohne Ende | BMW iX | KRAUTH präsentiert,2022-01-18T10:40:33Z,UCUi5D9e5tveG29PWFx7MqUg,518,12,1,0,0
JdoRbCwFpyQ,Twingo Urban Night ETECH 4K Review Deutsch Elektro,2022-01-18T23:01:10Z,UC-z-c0OwzZM4R-q9gYdurMw,806,17,2,0,0
h8eR6znR_sg,Opel Rocks-E (2022)🔋| Es ist kein Auto !😳| Günstiger als ÖPNV | Mit 15 Jahren fahrbar | Test | 4K,2022-01-18T20:25:20Z,UCJYHdi-7hYhEj_36aZ66Htg,6454,295,28,0,0
5Hks_Lai2-g,Ich verkaufe mein Model 3! Ausserdem: Tesla GigaBerlin Update! Wann kommt Model Y LR aus Berlin?,2022-01-18T22:20:46Z,UCSmH2fdr86LXpn_ZikVW8Wg,657,38,8,0,0
xFmR3KUOPaI,Der neue Opel Rocks-e | Live-Vorstellung | Hoppmann Autowelt in Siegen,2022-01-18T15:36:57Z,UCpoalFzCr5KoJphIfPs5-Cg,581,17,1,0,0
GgPsdrKEoDA,Pimpen wir unsere Photovoltaikanlage mit Ersatzstrom und Speichereffizienz? Neuer SMA STP SE,2022-01-18T19:15:12Z,UC-k-5F2j4CUzuwkx1QLRlpA,25120,727,186,0,0
BkQ-w80qdpc,"#138 - Wallbox Update, Steckerprobleme, Leistungsbegrenzung auf 11 kW, Corsa 3-L-Charger - Infos",2022-01-18T11:00:11Z,UCHrBjgyy51_c0s_CYh8iizg,16541,538,108,0,0
c9EgiXRD2Pg,"Deutschland, zweit höchste Strompreise der Welt",2022-01-18T18:10:57Z,UCbmnkk6JHMGsIqexxTl-68A,41,0,4,0,0
qKlPhy1fLvo,Mercedes-Benz Vision EQXX #shorts,2022-01-18T06:56:37Z,UCqboxXgo9yQ0oVO5anr_jtQ,678,25,2,0,0
MJDrNy0T4B0,#11 Blackout - Warum Erneuerbare Energie das Risiko dramatisch erhöhen!,2022-01-18T17:29:11Z,UCKC9gZw2CxA8y9sgBA58Wnw,2301,145,26,0,0
QlxdbF147Z4,Nord-Ostsee Automobile // TechCheck 💡,2022-01-18T08:50:30Z,UCNXx4nlhc1_GTMvyFs6N9Ug,38,1,1,0,0
gHMy09bLzak,"Enscape 3.2 - Multi Asset Platzierung, Green Assets, Panoramatours, ... [Tutorial Deutsch]",2022-01-18T17:00:23Z,UCt2Ryq2LHbV1gYpD2T9ggRA,546,20,5,0,0
3bfVO0Bg6Hk,Autobahn Ausfahrt Wülflingen - sehr speziell,2022-01-18T16:00:03Z,UCD48Y1bZHPlF4NixGceibog,1204,46,3,0,0
oAJfOfCuQeA,⚡ Brainchip Aktie ⚡+ 30%⚡ Wichtige News! ⚡ Was JETZT tun? ⚡,2022-01-18T11:00:26Z,UCOWd1vgm44072potBl0dOGQ,2197,113,40,0,0
66FXcB7r-DU,NIO OS Aspen3.1.0 mit englischer Sprache Teil 2,2022-01-18T04:53:43Z,UC4UtVUqLYn8K-z-G5-eWBhA,223,12,8,0,0
YKvd-t2EsDQ,TESLA: Supercharger vs. NIO Batteriewechsel was ist die Zukunft?,2022-01-18T15:52:22Z,UCl589xNEqGyZs2QkrDbBzDA,776,90,11,0,0
HWLs-2hqwlY,Lohnt sich unsere Solaranlage mit Speicher und Wärmepumpe im KfW 40+ Haus? (4 Jahres Bilanz),2022-01-18T14:30:08Z,UCGoI004ZXiUb1NmY3zXBWTw,14385,349,188,0,0
H6wDm6eal-g,Peugeot 208 Elektroauto Test Winterreichweite Ladezeit 10-80 % Verbrauch #elektroauto #peugeot,2022-01-19T16:19:09Z,UCVUBc0WF5X-w3T8s6Wyx-jw,8507,501,177,0,0
wyF5GXBPfKE,2022 MG5 Electric Leistung Reichweite Verbrauch Abmessungen Kofferaumvolumen | Electric Drive News,2022-01-19T17:30:09Z,UCxmohYAjhc2qD5pYIOwQ3bA,5361,223,42,0,0
MZNdLmQwGBo,Ford Mustang Mach-E: Wildpferd unter Strom - Auch ohne V8 noch ein echter Mustang? | AUTO ZEITUNG,2022-01-19T14:30:03Z,UCHwc6w57Q3S8CSHWergMJWg,1001,27,4,0,0
qz-B0FtdBMo,Brennen Elektroautos häufiger als Verbrenner? | Podcast,2022-01-19T14:00:20Z,UCx6OkrMyBqujuyQlwVpYfNw,961,40,12,0,0
ZzURzpNLJNs,Erste Cupra Born Alpha da Porsche Auto Top Angebot,2022-01-19T16:00:31Z,UCoWVIxHYxXrkiW780PfVvyA,131,11,1,0,0
Ema7mR85pn4,"Hyundai Kona 39 kWh rot Facelift Fahreigentschaften, Abschlussstatement Reise Review",2022-01-19T12:10:48Z,UCF4nwOGudhhvRHFpc_ICT-Q,864,28,3,0,0
MTDoVxtDJ-A,Automatisch Ladestromstärke je nach Ort einstellen,2022-01-19T15:36:02Z,UCe4imzlqB7w2LcgG3W_fpvg,1626,118,12,0,0
GLmUS_OJEi4,7 Tage hochdosiertes Vitamin D – macht mich das gesünder?,2022-01-19T14:01:12Z,UCBzai1GXVKDdVCrwlKZg_6Q,410620,8804,1542,0,0
G1loOlSFn0M,🔋 2022 Neuer Fiat 500 3+1 (87 kW): der BESTE Fiat Aller Zeiten!!! [4K] - Autophorie,2022-01-19T17:00:20Z,UCllHFziN2zWOQ2yvbejyH0A,8788,283,75,0,0
TrZPsONLYv4,Politik #71 - Coronavirus - Teil 16 - Impfstoff mit überschaubarem Nutzen -  Statistikauswertung,2022-01-19T05:30:10Z,UCUh8zvuZWNoIur4Cv-3fUzw,213,25,19,0,0
