video_id,title,published_at,channel_id,view_count,like_count,comment_count,job,id
LOSgVjTVpAs,"Bagger, Motorräder, Trucks: Elektromobilität auf der Technik-Messe in Las Vegas",2022-01-06T22:36:45Z,UCACdxU3VrJIJc7ujxtHWs1w,664,12,1,0,0
ofGhcrRErxo,Die WAHRHEIT über ELEKTROAUTOS im WINTER 🥶,2022-01-06T14:49:45Z,UC3rz4cx41jWj7shRBTetzkw,73232,3283,586,0,0
hDXhsH8gS4c,Breaking Elektro-News: eAutos eilen von Rekord zu Rekord! VW streicht ID-Varianten! Lithium aus GER!,2022-01-06T06:00:11Z,UCsNdsFTTBj5jcRJSWeJ8-Xg,12453,817,103,0,0
qPVsQ_8BNew,Wintertest - MG ZS EV Facelift 2022 - Autobahn-Reichweite und Verbrauch - Preis-Leistungssieger?,2022-01-06T15:00:35Z,UCd5Jpd5473VPhNjdWMUP6tw,26325,1074,194,0,0
h9ft3blCTPs,Hocheffizienter Antrieb für E-Nutzfahrzeuge – Felix Horch vom Fraunhofer IFAM – „electrive.net LIVE“,2022-01-06T14:00:18Z,UC_vO01sSD25a73DhoaxtZTw,1416,59,2,0,0
L96YoJqb2Ws,TESLA Model 3 LADEN - Supercharger V3 5-80% Ladegeschwindigkeit und Preis,2022-01-06T17:05:18Z,UCnEEC46gghhncsBjuxgxEvw,3229,113,42,0,0
i1daraC3fC4,"Drei Gründe, die dafür sprechen (Hättest du´s gewusst?!)",2022-01-06T16:30:06Z,UCBE4KHslSSQegsWJHU8-2yQ,1839,130,10,0,0
1epRHrZ9znQ,TESLA: Model Y mit neuen Farben aus Giga Berlin,2022-01-06T15:01:00Z,UCpPbcfwq0wOpWrC0gBs73tQ,22798,1090,87,0,0
ThRnh1vAqjE,"Winter-Roadtrip mit dem Skoda ENYAQ iV 80x ins Prättigau - Infos zu Reichweite, Laden und Genuss 4k",2022-01-06T17:00:18Z,UC0cCZpU5Ioj1FOuIzj7cSsQ,9740,333,79,0,0
k8Qqnv8A_08,4 NEW SCOOTERS AT CHEAP PRICES 2022 - MODERN AND ECO-FRIENDLY DESIGN.,2022-01-06T12:00:10Z,UCocryMxIfzSWVLnq8Kzec9g,181858,1338,78,0,0
pGGybo3J_Gc,Tesla Model 3 | LFP Akku | Full rated Range | Rated Range | SOC 101% | Zellen Kalibrieren | SuC |,2022-01-06T21:35:56Z,UCf6kkAGiOV_azeGaZ_gKVLQ,859,41,17,0,0
-MRzOjINRsQ,aa | Türkisches Automobil TOGG in Las Vegas enthüllt / 2022,2022-01-06T15:20:59Z,UCVDrSV445cjboM3mw-vLjFw,4603,98,26,0,0
-w1exIqiK3Q,TOGG Car from Turkey | Erster türkischer Auto | Car Rampage,2022-01-06T07:41:06Z,UC4ViMAkJk1VTf59KKx88fDw,439,24,5,0,0
NuN7wX3kNCk,"#xbus, 10.000 km gratis im Jahr?, Solardach durchgerechnet",2022-01-06T16:00:11Z,UCtjTTWEgZOqIQH4Zf8ltS2w,7822,233,45,0,0
-pZn5sGzOF8,Was ist NEU bei TESLA? | 12 Teslas im Lichtspektakel | Beste Ladekarte,2022-01-06T16:07:24Z,UC96MGGyxaZZQ6aFKSVMHIew,1565,124,14,0,0
3t2ABxN5bBA,Die Energiekrise ist da - jetzt wird es teuer (achte darauf),2022-01-06T17:00:03Z,UCY1ntSfj-BKiXD6A5j6S4Nw,553,22,4,0,0
6JtU5QHjpj8,2022 Kia EV6 - der beste in seinem Segment! Review und Fahrbericht,2022-01-06T17:54:46Z,UCBq-jldJjCMXt1Pk9o79CJg,4027,87,26,0,0
yC_H5wC4uQU,Hausbau 2022: Photovoltaik-Pflicht trotz Handwerker-Mangel? KfW Förderungen geschickt kombinieren!,2022-01-06T19:30:03Z,UCqQGYPEU7DiNA6bUUmehb8g,3425,300,75,0,0
1gUNNIrNkAU,AfD Politiker über unzuverlässige Schnelltests und Chaos in der Corona-Politik,2022-01-06T16:46:57Z,UCBoIJhUfNcn8G_odWECKVIA,55532,6298,738,0,0
EdhgjV6lhLU,Börseneinstieg Teil 2: Die erste Geldanlage,2022-01-06T18:08:47Z,UCbVKbf2Jq-IryEulLlGCuUw,228,16,4,0,0
XlaFqCCKzG4,Eine scheiternde Zivilisation,2022-01-06T16:15:13Z,UCA7qhn6AISRXjCjF4LSeukQ,1815,49,32,0,0
IqgUOKR0mb0,"Bringt Mir Wein, oder warum BMWs Kommunikation nur noch mit Alkohol zu ertragen ist.",2022-01-07T16:00:06Z,UCddkvrnYqGRfODPMUQqisiw,12390,897,364,0,0
sw_QNi9SEPk,Eine Woche Porsche Taycan 4S: Warum man Verbrenner nicht mehr braucht und das E-Auto funktioniert.,2022-01-07T16:31:48Z,UCuP3RJ8LCsMJpRpmGkUp13g,4122,109,50,0,0
KpqSn7EuRww,Notfalltermin im Tesla Service Center Straßburg - Es knarzt und knackt,2022-01-07T14:51:00Z,UCjuUo23G7j4gzl2sHGIjZCw,3772,261,42,0,0
9t_lG6RWeRE,"nextnews: Tesla Preise & Rückruf, Strompreise, Bafa Update, Mercedes EQXX, Chipmangel, Überfall,Giga",2022-01-07T17:00:05Z,UCgmB8S3f8-9dR8alVUZuZxQ,109137,5813,607,0,0
i1CLdjj-Fw4,Mit dem Elektroauto GELD VERDIENEN: THG-Quoten-Update,2022-01-07T06:00:22Z,UCsNdsFTTBj5jcRJSWeJ8-Xg,5015,439,80,0,0
NtypQwA7CFA,Skoda Enyaq Alltagstest - wieso er das beste E-SUV aus dem VW Konzern ist!,2022-01-07T16:00:16Z,UCaTyFx9Llt5nQRAFjZyowow,58620,492,108,0,0
cVwm_4XOZIk,STAT E-STICS #52 | Opel Insignia Elektro mit 800 km Reichweite und Festkörper-Akku,2022-01-07T16:34:32Z,UCDDj2GWklzZ09X7R9OtsX3Q,54891,804,60,0,0
4scyM_60gGk,Schnäppchen Elektroauto: Das sind die Kosten für unseren Renault Zoe in Verbindung mit Photovoltaik,2022-01-07T16:00:07Z,UC-k-5F2j4CUzuwkx1QLRlpA,8367,525,148,0,0
WJhZuyLsOQ0,THE iX ⚡ – Wir zeigen euch die optischen und technischen Details des neuen BMW iX,2022-01-07T12:30:15Z,UC411cas-bxHNhbeub7Shl4A,6317,14,3,0,0
GV4aGQcp_lI,⚡ Ladeparadies für E-Autos - Rundfahrt zu den Schnellladeparks am Weinsberger Kreuz und Heilbronn,2022-01-07T12:52:16Z,UCMZbix9CwEuL6l9SJIb2Zxw,719,70,26,0,0
EbbYghSgBB4,"PROJECT NEWS - KLEINE E-AUTOS: STARK GEFRAGT, KAUM GEBAUT!, BMW iX M60 PREISE, MERCEDES EQXX,...",2022-01-07T11:00:17Z,UCOmyWleEFm8SZti-YW26t7w,733,96,13,0,0
lkaI9Qk9VO4,"Interview mit Ladeanbieter GOFAST - Kosten, Ausbau, Ziele [Deutsch 4K] | Vision E Drive #141",2022-01-07T17:00:37Z,UCDMd4FzBxxKD5yAeeLStU6A,2122,271,42,0,0
d9a6hbZHFh8,TESLA: Reaktion auf Europa-Nachfrage ++ Expansion China,2022-01-07T15:00:48Z,UCpPbcfwq0wOpWrC0gBs73tQ,14722,839,63,0,0
Mma3-epbmGo,Photovoltaik Auswertung - Jahr 2021,2022-01-07T12:07:18Z,UCsFn3MVZBT1_GWFzgv4QF3A,491,19,5,0,0
QJ_YLQgJLMo,Schnell nachgerechnet: Daimler Aktie,2022-01-07T18:23:31Z,UCcjLJ9TsTIFldXXnmp23pRA,112,8,1,0,0
-AuxW-5Oq1A,Lynk & Co 01 Plug-in Hybrid (2022) Bitte NICHT kaufen! AutoAbo für 500€! Fahrbericht | Review | Test,2022-01-07T16:00:00Z,UCy9Y4en2y1eR1zwcmFkRMzg,28755,316,90,0,0
ZbXtfP1A250,Mazda MX 30 - Rightsizing oder Rückschritt ?,2022-01-07T12:28:55Z,UCbe4BpM5-Ta7MIlbKOofTDA,24314,639,229,0,0
NPnpzclO6gI,In 2 Minuten 430€ verdienen als Elektroautofahrer (KEIN CLICKBAIT),2022-01-07T13:02:25Z,UCON5Yw29gbeuLcsFygltr6Q,297,16,1,0,0
Znu9AvVZr6E,"Small Modular Reactors (SMR): Kleine modulare Reaktoren /Grundidee und Übersicht, Vor/Nachteile,",2022-01-07T23:11:10Z,UCT5nXIRHzhRxwCY-_LH1SQA,1669,109,71,0,0
tUdr5IFTS7o,Heidelberger Druckmaschinen Aktie: Wie nachhaltig ist die Verfünffachung? | Anleger Forum,2022-01-07T16:00:23Z,UCdpjjouypP9dZFkgO7lPEHg,922,36,15,0,0
yTZGShGk_wg,Winterliche Grüße aus Bad Marienberg,2022-01-07T17:14:07Z,UCt1tNnYzf8Y7ZpFSG2U2WYQ,1466,212,107,0,0
owLKlJLSidI,"Telegram ist UNSICHER! (Ernsthaft, sogar Whatsapp ist sicherer)",2022-01-07T16:00:05Z,UC1t9VFj-O6YUDPQxaVg-NkQ,21116,1076,223,0,0
JxriQfdHWsE,Zeig mir dein PV Angebot #16 - Rechnet sich Photovoltaik auf dem Norddach?,2022-01-07T18:30:11Z,UC4t0KuLYBiXqXF27UtjLxPw,2684,149,101,0,0
qqXMLP4Rhys,"WHO warnt vor Omikron-""Tsunami"": Welle schwappt bis nach Norwegen",2022-01-07T06:28:34Z,UCACdxU3VrJIJc7ujxtHWs1w,795,14,29,0,0
VfdVJ83efy0,"„Spaziergänge für die Freiheit“ – 7 Tage Deutschland, der AfD-Wochenendpodcast 01/22 vom 07.01.2022",2022-01-07T12:42:15Z,UCq2rogaxLtQFrYG3X3KYNww,37346,4747,623,0,0
jbtR7dD8PSg,"Djokovic und seine Medizindaten - Weltwoche Daily Deutschland, 07.01.2022",2022-01-07T05:30:07Z,UCq-b0dwW97YRZWgSCikWQRA,47047,2775,348,0,0
e49qAz4eOAw,Elektromobilität Elektro Auto sinnvoll? Unberechenbare Strompreise | Auswirkungen | lohnt sich das?,2022-01-11T15:41:16Z,UCoBbmYELrtLAdwq0vB4nwow,485,9,14,0,0
rnOF3Wo7vyQ,Elektromobilität ist schlecht!,2022-01-11T15:00:33Z,UC5GkgrVlPsiE6nDYHbIHGkw,189,11,11,0,0
a8hvOUcQdRY,Kostenloses ELEKTRO FLUGZEUG für PHOTOVOLTAIK | Solaranlage für Flughäfen | Flug Taxi,2022-01-11T16:30:00Z,UCaCaZ-vKtnMG2_FKmEePChQ,4473,365,45,0,0
_b24Ivn6nFc,TESLA Model 3 Performance  - Gerade verkauft! Bilanz und Fazit! Warten auf den Nachfolger!,2022-01-11T15:30:06Z,UCasePAQ_q7tbUGybICCj4NQ,9557,363,61,0,0
xRCCUaPFcxM,"eMobility update: Tesla erhält Vorab-Genehmigung, Mercedes baut E-Antrieb selbst, Chevrolet EV, Togg",2022-01-11T11:00:12Z,UC_vO01sSD25a73DhoaxtZTw,10307,603,23,0,0
1AbnQdFu_KE,370 € Prämie für JEDES Elektroauto in 2 Minuten? THG-Quote 2022 – Anbieterübersicht + Fairnergy,2022-01-11T17:45:01Z,UCc-JL79TndxMn8EYS-7Ic1Q,1440,39,7,0,0
S8y6pKiHKdI,Skoda Enyaq iV 80 Langstreckentest - wie weit kommt er im Winter bei 140 / 120 KMH?,2022-01-11T16:00:25Z,UCaTyFx9Llt5nQRAFjZyowow,59764,711,224,0,0
h4zh-Gr0-es,Nachgefragt bei Timo Sillober: Was bringt 2022 für die E-Mobilität bei EnBW? | EnBW,2022-01-11T09:17:50Z,UCvUn_GJ9ZqsFMvLWVuqOzbg,862,34,4,0,0
Iocus88MkXk,⚡ Wie teuer ist mein Elektro-Auto wirklich -  Meine Ladekosten und Kennzahlen für 2021,2022-01-11T15:00:08Z,UCMZbix9CwEuL6l9SJIb2Zxw,644,51,12,0,0
FPSvXt0oHPE,Elektroautos & Wasserstoff | Feuerwehr Berlin wird nachhaltig,2022-01-11T09:00:11Z,UCMlirlzQIUpfb3uC5LXB17Q,3976,229,26,0,0
cEhfFodigAg,"Ford Mustang Mach-E | Autobahn Winter-Test (Reichweite, Verbrauch, Navi, Assistenzsysteme)",2022-01-11T16:02:16Z,UCDDj2GWklzZ09X7R9OtsX3Q,8313,315,34,0,0
UZTA8aBf7FE,TESLA: Nächster Rohstoff-Deal & Model 3 Standard update!,2022-01-11T16:01:24Z,UCpPbcfwq0wOpWrC0gBs73tQ,13432,767,45,0,0
k0LvOzRYK7c,Habeck kündigt zwei Klimagesetzespakete für Energiewende an,2022-01-11T11:30:09Z,UCcPcua2PF7hzik2TeOBx3uw,12931,76,91,0,0
Ypcoqydyzzw,Aktienmarkt aktuell: So steht es wirklich um die Aktienmärkte,2022-01-11T12:49:16Z,UCN5FOXOJfpX-edVOhd2k1kQ,211,10,3,0,0
bNggLDIYFH4,Powell vor dem US-Kongress – US-Inflation im Fokus,2022-01-11T11:33:17Z,UCsekpwdMv9PBCOftuuKncfw,1630,49,15,0,0
cIBTvPm4rVI,Tesla Model3 Standard Range Winterreichweite Ladezeit 10-100%,2022-01-11T15:00:30Z,UCVUBc0WF5X-w3T8s6Wyx-jw,23779,1012,457,0,0
0QHOYABGhPw,Sichtbare Quanteneffekte in Nanopartikeln | #12 Nano Vorlesung Ganteför,2022-01-11T10:00:01Z,UCxXmS6BkfhCALrPyCJKmPyg,9354,231,34,0,0
-_v_1cVFhYY,MG ZS EV Facelift,2022-01-11T09:10:32Z,UCUiCcZueuzzxedtHg7Le5sA,17813,,2,0,0
_ZMzk3MqsaE,THG-QUOTE und UMWELTPRÄMIE für ELEKTROAUTOS in der Steuererklärung! Keine Steuerberatung 😊,2022-01-11T08:17:04Z,UCsNdsFTTBj5jcRJSWeJ8-Xg,6459,491,60,0,0
nT5z8GlWb8U,MoonBike Snowbike | elektrischer Fahrspaß für die Berge | CES 2022 Highlight | Electric Drive News,2022-01-11T06:00:10Z,UCxmohYAjhc2qD5pYIOwQ3bA,831,53,10,0,0
cSIWpIr5gM4,"Das JWST ist gestartet, was passiert jetzt? - Nora Lützgendorf bei #FasziAstroOnline",2022-01-11T19:10:56Z,UCrFWnqIRdCwv9F7uYW0L_Og,8120,310,40,0,0
P04AgFW0lYI,weissnich reagiert auf Pressekonferenz von Robert Habeck,2022-01-11T20:48:16Z,UC4t0KuLYBiXqXF27UtjLxPw,1648,112,67,0,0
MhXP5QM1pG8,Eröffnungsbilanz Klimaschutz,2022-01-11T23:20:20Z,UCQfBtMOs07bff6CYvSpbECw,1390,28,2,0,0
8jO7qjqHYdU,Energiebedarf: Gibt es genügend Strom für E-Autos? | Umschau | MDR,2022-01-13T14:54:04Z,UCvwE_EBBDWM552Vd9v8m9Gg,4625,47,29,0,0
n30dOYaUawY,Wie lange halten E-Auto-Akkus bei Frost? | Umschau | MDR,2022-01-13T14:48:03Z,UCvwE_EBBDWM552Vd9v8m9Gg,8216,69,81,0,0
uMRbmWGCLDI,Welche Lademöglichkeiten gibt es für E-Autos? | Umschau | MDR,2022-01-13T14:42:04Z,UCvwE_EBBDWM552Vd9v8m9Gg,2404,45,12,0,0
iP_Y7d7iIPg,Elektromobilität: Werden wir genug Batterien haben? Lieferschwierigkeiten erst der Anfang? #Podcast,2022-01-13T15:42:18Z,UCl589xNEqGyZs2QkrDbBzDA,889,85,7,0,0
cg2OiwjVV5E,E-Flugzeuge: Verkehrsmittel der Zukunft? | Umschau | MDR,2022-01-13T15:00:05Z,UCvwE_EBBDWM552Vd9v8m9Gg,1569,19,8,0,0
Uu1FEBBPTYQ,"Breaking Elektro-News: VW + BMW ELEKTROAUTO-REKORDABSATZ, Vinfast kommt nach Deutschland, E-Flieger",2022-01-13T06:00:06Z,UCsNdsFTTBj5jcRJSWeJ8-Xg,6453,565,140,0,0
k7bQPglUU9w,"Skoda ENYAQ iV 80 Laden inkl. Ladeplanung - Dauer, Leistung, Probleme - Appell an Skoda zum Update!",2022-01-13T17:00:36Z,UC0cCZpU5Ioj1FOuIzj7cSsQ,14396,587,179,0,0
FsHUcVDMq4g,Wie umweltfreundlich sind E-Autos wirklich?,2022-01-13T14:00:08Z,UCQz0thmRLbm2mVDJwmVjsOg,9773,64,23,0,0
HBm8MEXanZY,Es gibt 3 Varianten um im Winter mit einem Tesla S 3 X Y loszufahren! Ich benutze „Diese“! Und Du?,2022-01-13T20:33:07Z,UCf6kkAGiOV_azeGaZ_gKVLQ,1092,65,25,0,0
s_N_OtGkV_E,Alphatec Wallbox Mini - viel versteckte Technik in kleinem Gehäuse,2022-01-13T17:00:29Z,UCUYT5ThWuRNWAbV0nul7EGQ,1003,56,7,0,0
R_PGRir6yCM,2022: Produktion Hauskraftwerke - Made in Germany,2022-01-13T19:30:10Z,UCy82YSU9FxoYhknZ4PFmjrQ,40577,957,147,0,0
YAhXato-IHA,Technik die wir 2022 erwarten!,2022-01-13T15:30:05Z,UCM_0WMM6naQe7xgrWmmowEw,306,22,4,0,0
HQ67M93pNNk,TESLA Model 3 2022 BAFA 6.000€ nicht bekommen!? Durch diese 3 blöden FEHLER kein Geld bekommt!,2022-01-13T16:45:01Z,UCnEEC46gghhncsBjuxgxEvw,5209,137,68,0,0
90JvFKCyc68,Kanalvorstellung Schwunkvoll,2022-01-13T18:00:02Z,UCoJ9ql-WffntQ5Pa8SdkllA,3374,225,47,0,0
IRyaNg2WeFQ,"KIA EV6 👉 BESTSELLER-TEST mit ALLEN Infos zu Preis, Reichweite Kofferraum, V2L, Fahrtest, Verbrauch",2022-01-13T15:27:08Z,UC96MGGyxaZZQ6aFKSVMHIew,8378,325,63,0,0
m9ZwYIrRhl0,Hochsicherheitsspazieren mit Freiburgs OB Horn 🤡,2022-01-13T15:33:04Z,UCc2BsbPTOqYSDy_hZyM11HA,1253,217,27,0,0
b-lX6BwuDNw,Heute heißt es  mit meinen E-Bike schnell schnell und Gas Gas das macht ja  auch Spaß 🤣🤣🚴‍♂️💨💨,2022-01-13T22:59:08Z,UC5HqTIRukNP3r60HPxRldWA,179,18,40,0,0
DWvHlv5kBp4,Bin ich zu gutmütig? Oder einfach zu blöd? Abgezockt - na und?,2022-01-13T10:15:00Z,UCsLOtn32074H9Qxy7gjr2LQ,6866,529,132,0,0
G-s67MwIC-4,"#xbus, Das musst du bis jetzt wissen! Teil 1, INTERVIEW mit Elektro Camping",2022-01-13T16:00:16Z,UCtjTTWEgZOqIQH4Zf8ltS2w,2693,70,25,0,0
DCfWWillL_s,Schaffen wir die Energiewende? Buch Energierevolution jetzt I Prof. Volker Quaschning,2022-01-13T09:00:05Z,UCMlirlzQIUpfb3uC5LXB17Q,4533,335,82,0,0
AEevveEArBc,Ohne E-Fuels werden wir unsere CO2-Ziele nicht erreichen - Interview mit Walter Röhrl | eFUEL-TODAY,2022-01-13T22:40:01Z,UCfZ1HI8Nlk9OMKkjc2XQh7g,56783,1411,990,0,0
oLJe285F9qE,Tesla Model 3 auf Platz 1 in Deutschland!,2022-01-13T16:00:22Z,UCfcXVSmSaIluNJzDK4qofGw,3467,268,50,0,0
mXdYYntv1-w,"Die Pandemie ist zu Ende, dank Impfungen und Omikron - Weltwoche Daily Deutschland, 13.01.2022",2022-01-13T06:10:18Z,UCq-b0dwW97YRZWgSCikWQRA,18890,1354,235,0,0
I0VDWZuygH8,"Saschas Börsentag, Video-Börsen-Blog vom Mittwoch, dem 12. Januar 2022",2022-01-13T00:44:21Z,UCunA7W3BY589wGgtl_HTTjA,427,29,10,0,0
dhploBVIxSs,Strompreis explodiert! 😱 Was tun?,2022-01-13T16:54:23Z,UCmo-WOUylNv_zl1RB9yHfag,50,1,1,0,0
uSWoSxOunx4,Kanal vom Digitalen Chronisten gesperrt!,2022-01-13T15:28:27Z,UCT9tfh3q3PQPkD36StSv94g,18371,2199,174,0,0
btRW9VjQOu8,"nextnews: VW e-up zurück, Tesla Schrott, Skoda Enyaq, Kauf keinen Verbrenner,  Model X mit CCS",2022-01-14T17:00:32Z,UCgmB8S3f8-9dR8alVUZuZxQ,139862,6021,936,0,0
GQF9quw-JKE,Der Strom reicht nicht für die E-Gurken !!!                                     Stimmt das wirklich?,2022-01-14T16:00:14Z,UCddkvrnYqGRfODPMUQqisiw,12316,1080,475,0,0
6RpyUX9z_Xs,Mercedes EQS 450+ Alltagstest im Winter - besser geht es kaum!,2022-01-14T16:00:03Z,UCaTyFx9Llt5nQRAFjZyowow,8756,285,77,0,0
1aCDHpWica8,Die Zerstörung der THG Quote,2022-01-14T18:30:11Z,UCbe4BpM5-Ta7MIlbKOofTDA,18621,1140,320,0,0
w4-Zcx1GgI4,"Was kann das ""E"" Kennzeichen am Elektroauto? | Bedeutung, Vorteile und Voraussetzungen",2022-01-14T11:00:37Z,UCBTJnSirNI8kwOn5ROB_BGA,571,19,2,0,0
uyX7jzyZF24,Maximale Reichweite im Winter- Fiat 500e La Prima - Passfahrt [Deutsch 4K] | Vision E Drive #142,2022-01-14T17:00:53Z,UCDMd4FzBxxKD5yAeeLStU6A,28667,780,166,0,0
I8BZj6d8KwE,Car Maniac geht ins TV! Elektro-Format mit weiblicher Verstärkung,2022-01-14T15:00:11Z,UCiZnK4X73okItJqaCs2YDOQ,127920,7552,927,0,0
j_vKnl6fKSs,VW ID.3 Reale Winterreichweite Ladezeit 10-80 % 58 kWh Akku,2022-01-14T15:00:35Z,UCVUBc0WF5X-w3T8s6Wyx-jw,21725,702,254,0,0
xOL0yYob0fI,STAT E-STICS #53 | für jeden Elektroauto-Fahrer 300 € durch THG Quote und ZEEKR kommt 2023,2022-01-14T16:29:17Z,UCDDj2GWklzZ09X7R9OtsX3Q,8735,665,46,0,0
nPvkQZGKIRA,Habecks PLAN - Was heisst das für uns? - Auswirkungen auf UNSER LEBEN | Eröffnungsbilanz Klimaschutz,2022-01-14T14:21:00Z,UCaCaZ-vKtnMG2_FKmEePChQ,8455,833,178,0,0
a1bavhECdlg,"Günstiges öffentliches Laden und Ladekarte für 0,19 €/Kwh - Ohne Abo und Tarif in 2022 - Freshmile",2022-01-14T20:36:12Z,UCOFCBCbMfv_BILgiHRJV-4A,16417,539,149,0,0
rlu5Wpj0ID4,Vom TESLA zum E-ROLLSTUHL und zurück ⚡♿,2022-01-14T14:53:13Z,UC3rz4cx41jWj7shRBTetzkw,24222,1313,102,0,0
n8pI0nGK_p8,Nachgefragt bei Frederik Stiber: Wie wird ein Ladepark geplant? | EnBW,2022-01-14T09:53:05Z,UCvUn_GJ9ZqsFMvLWVuqOzbg,273,11,1,0,0
W0MQWEmrSB0,Anlagetrends 2022 💰 Das Große Mahlzeit Live Event,2022-01-14T19:40:01Z,UCHZa-ouaCwwNeBNIy0sADqQ,99580,1724,43,0,0
SdxiUewFbiw,"E-Auto Förderung, Reichweite und Kosten: Lohnt sich ein Elektroauto für mich?",2022-01-14T10:00:26Z,UCBfrdsaboI8y1HnRUxMDjcw,86,3,1,0,0
3z5Y73_78N0,13 Punkte die du unbedingt wissen musst BEVOR du einen TESLA kaufst!,2022-01-14T15:00:02Z,UCe4imzlqB7w2LcgG3W_fpvg,18251,670,256,0,0
IHfC_80OpFc,Darum habe ich TESLA Aktien gekauft! Wettbewerbsvorteile in der Zukunft #Tesla,2022-01-14T14:00:08Z,UCyoOWe-v-Hpb70ZTUCpPqJw,171,10,6,0,0
RQ4d-IYQey4,MODEL Y GIGA BERLIN: Neues Lieferdatum/Reichweite – und neue Version?,2022-01-14T15:59:40Z,UCpPbcfwq0wOpWrC0gBs73tQ,17267,938,135,0,0
oIMXI2_ej8o,Nachgefragt bei Cathrin Lind: Was möchten E-Mobilitäts-Kund*innen der EnBW? | EnBW,2022-01-14T09:54:39Z,UCvUn_GJ9ZqsFMvLWVuqOzbg,577,20,1,0,0
3HIHvfmItsE,Nachgefragt bei Volker Rimpler: Wo liegen Herausforderungen beim Ausbau des Ladenetzes? | EnBW,2022-01-14T09:55:18Z,UCvUn_GJ9ZqsFMvLWVuqOzbg,723,12,1,0,0
0oRhdaVttdA,Interview zum XBUS von ElectricBrands mit Experten X-Bus - Chris,2022-01-14T12:00:01Z,UCsFn3MVZBT1_GWFzgv4QF3A,2004,54,27,0,0
gAx_vsuH_WE,"Was, wenn wir die gesamte Sahara mit Solarpanels zudecken?",2022-01-14T17:15:02Z,UCK2Ok2Lwig7tLU1go7b3Hhg,170,10,2,0,0
U1Eq_cvjzvk,14. Januar 2022 - Regierungspressekonferenz | BPK,2022-01-14T15:22:58Z,UCv1WDP5EiipMQ__C4Cg6aow,9889,165,48,0,0
aWVqbWGRRFY,Kay Gottschalk zu Herrn Scholz/ Sitzen sie schon im Bunker? 😁,2022-01-14T19:39:49Z,UCFPtWYUuOBzcUM1bEAMZFXg,462,96,10,0,0
AYOXMMHoSfw,Nachgefragt bei Bernhard Richt: Wie baut man einen Schnellladepark? | EnBW,2022-01-14T09:54:19Z,UCvUn_GJ9ZqsFMvLWVuqOzbg,518,13,1,0,0
bPH427Nqedk,with Tesla Model Y Cinematic Across Switzerland RoadtripTesla Model Y Quer durch die Schweiz Teil5,2022-01-14T11:00:20Z,UCmKZToU0g3HGh-mamZszC3g,199,34,62,0,0
mGFrJ_3eSww,Standard Lithium🚨: 2022 Zukunftsaussichten,2022-01-14T14:00:18Z,UCGpuWj5fsiWPT2C0ybR2u5Q,907,14,17,0,0
Syareo3ecYU,Strommarkt außer Kontrolle - was die Politik tun muss | SWR Zur Sache! Rheinland-Pfalz,2022-01-14T14:00:24Z,UCy4_zQ59zmS7zO4Dc6vbT_w,15189,236,183,0,0
tIyub7UL5SI,Zum ersten mal Tesla gefahren...,2022-01-14T17:45:01Z,UCJ8K1tpFe0jtd3oRpcNlPbw,10285,722,157,0,0
0exikZFEyxs,Beste Schneeketten für E-Autos? Michelin Easy Grip Evo - Textil,2022-01-14T19:00:01Z,UCJW1S6BOOHD1dyzA2V8rxnw,11132,601,91,0,0
DPYXsZDoL6A,7 Fragen zur Elektromobilität | Autopark Böhler in Schopfheim,2022-01-17T14:02:30Z,UCz_zQSDBwAEKTQQGxXl-X_A,58,7,1,0,0
V5CEEwdWspE,Twitch Konserve: B.E.N sabbelt Elektromobilität - Lucid Air und Liegestütz,2022-01-17T11:53:53Z,UCu1ZXJ1NoD_a25ir0sJTtJQ,721,68,11,0,0
-QQF9PU2yiI,⚡ JUCR Flatrate - Erste Erfahrungen und App Update (Android),2022-01-17T15:07:19Z,UCMZbix9CwEuL6l9SJIb2Zxw,998,78,20,0,0
iqC67gAuJDE,„MEGATRENDS ZUM ANFASSEN“ – Neujahrsempfang 2022 in Rüsselsheim,2022-01-17T01:18:22Z,UCeEh6Lo2vBqMWg0_JOAyoxA,1325,14,1,0,0
3FDvRolpVlM,Der E-Wolf #813 - THG-Quote in Deutschland - Geld für's Elektroauto,2022-01-17T05:30:01Z,UCUh8zvuZWNoIur4Cv-3fUzw,205,42,17,0,0
--tJ9_ZB-ww,Renault TWINGO ELECTRIC URBAN NIGHT,2022-01-17T12:33:36Z,UCf_r1pZNnuJv13RRobqP4KA,442,5,10,0,0
rAqxYKn83Z8,E-Mobilität Sylt - Neue E-Auto Schnellladestation in Tinnum,2022-01-17T17:26:02Z,UC2aSvsMPotZkzT4At4KG2LA,629,12,1,0,0
_92Mw_0wgfI,"CATL: Batteriepreis-Revolution, Vorteil für Tesla?",2022-01-17T16:00:23Z,UCpPbcfwq0wOpWrC0gBs73tQ,18013,1044,108,0,0
I_ocoWGLqFQ,Autohaus - Brass Welche Lademöglichkeiten gibt es,2022-01-17T14:31:02Z,UC20JTVDmuF3XkvpxP1qFEXg,22,1,1,0,0
FL_N_1-nJ5g,eNordkapp-Challenge - Technikzusammenfassung,2022-01-17T17:00:12Z,UCgwu7LofR7ENUXWAqn2W5fg,281,38,4,0,0
Od4YC5VuSCg,Finstere Zukunft: Was passiert mit der Menschheit nach 2100?,2022-01-17T17:00:02Z,UCrt6X6pXNRl5rRxaKbzCrvw,69033,2045,487,0,0
nah4GWw2WRs,Die Energiewende geht nicht ohne Batteriespeicher: Erreichtes und neue Trends,2022-01-17T09:55:57Z,UCECfJLY1pDkQXHh5GlWm8OA,1322,23,8,0,0
Y0y0g7rLHmI,Tesla Model Y Performance aus Grünheide ? Update zur Bestellung,2022-01-17T12:30:04Z,UCdqPh0vY3icE24yLqz8zThw,560,13,3,0,0
yfaudxqVCmE,EIL: Großbritannien will GEZ abschaffen! - Rundfunk tobt!,2022-01-17T15:33:38Z,UCoA9xkGtbaBNElo2iiejArQ,12155,2011,176,0,0
Gsriv5p8PnU,29 Stunden ohne Pause im LKW | VIER PFOTEN,2022-01-17T12:35:51Z,UC6zujZuBo3HCXTYuSJ3sdTA,876,124,21,0,0
t8UHsZRbZqg,Achtung Grundversorger | Strompreise über 1 Euro/kWh | Verbraucherzentrale mahnt ab | Wahnsinn,2022-01-17T14:01:57Z,UCoBbmYELrtLAdwq0vB4nwow,1632,31,25,0,0
N3uWmrQADbY,T&Etalk: Ökostrom - Talk zum persönlichen Beitrag zur Energiewende,2022-01-17T14:55:46Z,UCSEJS2CZmTsXrpbKTdkJX5g,126,9,1,0,0
CiP40wuJuvU,Im VW California zum Nordkap und zurück | California Zentrum Bodensee,2022-01-17T13:02:54Z,UCsGStfCV-EP5a8QNJXJK9Ag,1711,27,1,0,0
VAdPqAxn2j0,"Saschas Börsentag, Video-Börsen-Blog vom Montag, dem 17. Januar 2022",2022-01-17T21:10:44Z,UCunA7W3BY589wGgtl_HTTjA,359,26,8,0,0
57cjynWUVuk,MONATS-REPORT JANUAR 2022 - Krieg mit Russland?,2022-01-17T19:30:09Z,UCOrM_L8GhXgQ4AsD-Xba6Ew,1716,81,18,0,0
NkYinnPA54c,Würzburger Diözesanempfang 2022,2022-01-17T20:01:00Z,UCirMLQuGuNclTBOkMmMIn0A,4064,49,2,0,0
lFi3Pc8zdu8,Die neuen E-Autos (2022) | Die 15 wichtigsten E-Autos 2022 | Ranking,2022-01-18T05:00:28Z,UCJrXOOtvmGn4CF7aYaJwuHA,169199,1487,446,0,0
qyF9F1PPVD0,Elektro-LKW von Volvo im Einsatz! Was taugt die Elektromobilität?,2022-01-18T09:30:17Z,UCMlirlzQIUpfb3uC5LXB17Q,5459,358,80,0,0
XF4_gEr1RA0,E-AUTO FAQ | Häufig gestellte Fragen zu Elektroautos - Julian nervt Steve,2022-01-18T12:00:14Z,UCaCaZ-vKtnMG2_FKmEePChQ,4704,885,123,0,0
tD1dhvr4F2s,LADETARIFE 2022: Der ultimative TARIFVERGLEICH/WEGWEISER für das öffentliche Laden von ELEKTROAUTOS,2022-01-18T05:53:44Z,UCsNdsFTTBj5jcRJSWeJ8-Xg,14995,959,218,0,0
pB4xycNvBDE,"eMobility update: VW e-Up Comeback, Peugeot e-308 als Kombi, VW baut Produktion in China aus, Subaru",2022-01-18T11:00:29Z,UC_vO01sSD25a73DhoaxtZTw,8760,562,26,0,0
IUnb2KemYrQ,Wie der Tesla einen in den Wahnsinn treibt 😳| 4K | Test |  Vorsicht❗ Nicht für jeden geeignet ❗🚗⚡,2022-01-18T19:11:42Z,UCTBCERL4sxJ_yWPyoJt0LDw,1121,273,10,0,0
MiPmUYsBu4s,TOP5 Tiefeinsteiger E-BIKES mit Top Preisleistung,2022-01-18T18:00:13Z,UCDF3JXA0XWFSoppDw-u_iTg,5431,133,23,0,0
p8jVUvNIZSE,TESLA: Die nächste Model-3-Welle ist auf dem Weg,2022-01-18T16:00:19Z,UCpPbcfwq0wOpWrC0gBs73tQ,22397,1076,77,0,0
FgNCYX1JRqY,"Versagt Teslas Wärmepumpe bei extremer Kälte? Model Y mehr Reichweite, Autopilot wird immer sicherer",2022-01-18T18:09:18Z,UCK0nQCNCloToqNKhbJ1QGfA,3782,226,13,0,0
oLtgsinxatw,⚡️Lexus LF-Z electrified Concept🔋400 kw Power plus 90 kWh Akku🤷‍♂️mit bis zu 600 km Reichweite❓,2022-01-18T16:30:15Z,UCuPH6ouleIo8IhmZy65m4pA,1410,82,29,0,0
t7n45vrVawE,"GERHARD SCHRÖDER: Über US-Wahl, Wagniskapital und Social Media (OMR Podcast #333)",2022-01-18T13:25:51Z,UCSZ6CHjd2o7KdHzugfvSxXw,1687,26,9,0,0
ScgnIcy0lHo,Ausbildung und Duales Studium in Wört bei TE Connectivity,2022-01-18T21:23:42Z,UCWAyuZuT-Qv4zkhricNa6IQ,1275,50,2,0,0
72vzdEpfhnA,GRIP-Elektro-Check | Mercedes EQS 450+ | GRIP Elektro,2022-01-18T14:00:02Z,UCwjxya3zbM2yadFag9WlbYg,61197,1600,315,0,0
oiQuPbHCSLA,Neuer Reaktor verbrennt 27.000t Atommüll zu Strom @Andreas Schmitz,2022-01-18T16:01:03Z,UCJUIsiPA0pSn2N4ZnTkGSRw,144379,3855,587,0,0
jlHNWR_E2aQ,"Dacia Spring zum ""Best Buy Car of Europe 2022""-Sieger Gewählt",2022-01-18T10:30:07Z,UCy_wfdc0rV7fi_YLhmKQ9gw,755,15,3,0,0
ESQYff5m4bU,ZUKUNFTSAKTIE! 🚀(Unbekannte Aktie mit gigantischem Potenzial! 💰),2022-01-18T10:18:55Z,UCVAGABnn-CHLNyfSCtDsRfQ,10476,412,92,0,0
7rriXjl48io,LKW Wechselbrücke - Fahrszenen und Aufbrücken aus der Fernfahrerwoche 2018,2022-01-18T08:40:25Z,UCVtVOddS0ms54kntAYXIVGg,16951,1154,76,0,0
wjLIAZL8K7E,Tesla Rost Probleme nach 300 km? Stimmt das? 🤔Tesla-Gutachter Wolfgang Müller packt aus!,2022-01-18T07:30:05Z,UCnO3VZ_KQpBcUq6h5oJ1b6A,4292,137,9,0,0
cj3V0IDPQrI,Mein jüngstes Projekt - Fast fertig,2022-01-18T16:00:31Z,UC5i6nCpwmDVKo98sZD2AAcQ,65273,5497,420,0,0
OpQ8vleoes8,1984 im Auto! Renault wollte Batterien FERNABSCHALTEN!,2022-01-18T08:00:16Z,UCXpvI8jeu166he5e_Emo2ig,25363,2482,322,0,0
4LobWxHLyEM,Ist nun doch alles ohne Dunkle Materie und Dunkle Energie erklärbar?,2022-01-18T18:22:47Z,UCUPzOCwIy9DyhTnLOkV6Esw,253,20,11,0,0
8s1BBqkdT7s,Franks Alptraum,2022-01-18T11:07:05Z,UCt1tNnYzf8Y7ZpFSG2U2WYQ,1400,143,18,0,0
2ZTyGTQSgLw,Keine Freiheit in Deutschland! Deswegen wandern alle aus!,2022-01-18T13:00:01Z,UCDcCth6YoUfBAZEL60MdNLw,1855,133,22,0,0
7pq5IXtMlZc,2022 VW e-UP STYLE PLUS | Er ist wieder da | Electric Drive News,2022-01-18T06:00:03Z,UCxmohYAjhc2qD5pYIOwQ3bA,14210,275,70,0,0
vKJ0-6oduxg,Gas- und Strompreise: Habeck fordert Transparenz bei Energie-Discountern,2022-01-18T14:47:59Z,UCcPcua2PF7hzik2TeOBx3uw,1335,9,20,0,0
aAfIbN9Zst4,"Wie ist der Stand bei TOGG, wann erste Fahrzeugen kommen Tagesthema Elektromobilität Nr.437",2022-01-19T16:00:00Z,UCHuXYLIv70fPKK9c60TwLQw,1568,77,18,0,0
tBHpbtyvEYc,So schlecht beraten die Händler beim Elektroauto-Kauf | WISOtrick (UNDERCOVER),2022-01-19T15:00:38Z,UCjCbe-qZ4SW10SkXdPm7hPQ,4367,107,41,0,0
CBSK03y4EmM,Autogaragen im Undercover Test | 2022 | SRF Kassensturz,2022-01-19T16:30:01Z,UCqdXpIZSamBceDmH8uOoTHA,3007,36,32,0,0
tPyM8uuwJuk,MG Marvel R Elektro: Diese Kompromisse erwarten Euch für kleines Geld,2022-01-19T17:00:42Z,UCiZnK4X73okItJqaCs2YDOQ,112986,4039,542,0,0
PuL-WwYYfgs,Die Alternative für Pendler? BMW CE 04 Elektroroller Test 2022,2022-01-19T14:26:52Z,UCAbWl7Gv6YD0_QKp-LUlF1g,63505,824,291,0,0
