,video_id,title,published_at,channel_id,view_count,like_count,comment_count,job,id,valid
822,bV2eiD_Pzqk,Darum ist Kiffen bei Jugendlichen gefährlicher als bei Erwachsenen #quarks #shorts,2022-02-13T11:00:12Z,UC1Y7onDsPyfP-lu--SXF-ew,18138,938,180,0,0,Topic
24,Bv8w47tval0,Die 5 Millionen Lücke | Elektroautos reichen nicht | Bundesregierung in der Kritik,2022-02-02T15:08:42Z,UCaCaZ-vKtnMG2_FKmEePChQ,6310,555,179,0,0,valid
1323,NWUPVdkz500,Verwaltung zieht den Stecker. Laden am Stellplatz nicht möglich. #elektroauto,2022-02-28T14:59:21Z,UCVUBc0WF5X-w3T8s6Wyx-jw,8996,571,179,0,0,valid
1369,eYajpQ0AaVg,BLOX FRUITS Script Pastebin 2022 UPDATE 17 AUTO FARM | MAGNET | FAST ATTACK (BEST),2022-02-09T01:00:06Z,UCL4b4MwCgm63dsTVJfFq4ag,16048,145,179,0,0,Language
1101,dvsIVQ5PkyE,NFTs EINFACH ERKLÄRT ... eine EINFÜHRUNG am Beispiel der CRYPTO PUNKS,2022-02-20T11:39:48Z,UCswWBF6ZkGnLG3sLRR65xRw,13836,831,178,0,0,Topic
1485,8XHcLkzTC0Y,TRETA DAS ESTALECAS DE LUCAS NO BBB,2022-02-15T19:45:01Z,UCc1RwDwEXEd2SKO3V6h45wA,343434,26848,175,0,0,Language
635,84lK-V4WErQ,"HYUNDAI ""rettet"" den IONIQ 5: verbessertes Batterie-Management, größerer AKKU und mehr!",2022-02-11T11:42:59Z,UCsNdsFTTBj5jcRJSWeJ8-Xg,13170,762,172,0,0,valid
664,AkVFvG1l7D0,"Psychologische Operationen, Inflation, & Neue Weltordnung | William Toel im Interview | Teil 2",2022-02-11T15:00:52Z,UCSDfFvhoQUD2MXqnVo0OUuQ,14598,758,172,0,0,Topic
1738,7VxTVrFm65o,"Lass mal schnacken #3: Parzellierung, Teslacharging & Co. | Holger Laudeley quatscht",2022-02-27T17:12:19Z,UC9bbdYLoAFJSd_5lk4lDhdQ,10172,1318,172,0,0,valid
1112,BkXZFkvcj1A,Die Energie fließt von AUßEN !,2022-02-20T08:00:04Z,UCaWbn671XbI1GLTgndyI7gQ,28960,2019,171,0,0,Topic
1540,UEAt71gMpoA,Neues RC Auto ZERSTÖRT MEINEN TEPPICH!,2022-02-19T17:15:02Z,UCPFhnt7T8iaBLp1wIfFRzFw,64475,4004,171,0,0,Topic
847,JQEny-2_X8E,Forscher haben etwas in Proxima Centauri entdeckt...,2022-02-14T17:00:09Z,UCTkYT9IjUuhmkXbwYEohIwQ,37452,2227,170,0,0,Topic
1434,xEs_u5E0ueQ,"SCRIPT Demonfall AUTO FARM, TELEPORTS PARA CELULAR e PC!! (Pastebin 2022)",2022-02-13T02:45:01Z,UCVKgVbdeCUU3yhCryzrO0EQ,9305,347,170,0,0,Topic
1222,E1ySTFa1a1M,ERKENNE das ZERSTÖRTE AUTO (extra schwer),2022-02-24T19:48:43Z,UCqO_lDZ1VRBUQkvcq_2RPaA,76998,4582,169,0,0,Topic
177,ENpDz0fzCEU,Entwicklung der E-Mobilität in Europa,2022-02-16T06:06:39Z,UCchH1esPCWvzigavq5JDwlQ,6533,657,168,0,0,valid
532,fL_YI_ASplM,Fellner! LIVE: Michael Häupl im Interview,2022-02-08T21:00:15Z,UCyQpfuhftLvrmjxgEzVH78Q,15804,135,168,0,0,Topic
1135,wGzbl8Wfr9Q,VW's Herbert Diess warnt vor Bankrott und beschleunigt ihn höchstpersönlich!?,2022-02-21T00:46:09Z,UC5N7y-3cPaM0JCknYV9bWJA,15357,575,168,0,0,Topic
355,2NdrTzL-fkw,"Dynamischer Regen, Tuning, Dragrennen & mehr! | Die große Gran Turismo 7 Preview",2022-02-03T11:15:01Z,UC5S0zPiz9-zZJ6WTV3YfE9w,69329,2316,167,0,0,Topic
739,XIVl3nZKuXM,Was habe ich mir da wieder angelacht… Der Autocheck des GRAUENS,2022-02-12T14:04:44Z,UC-j9aPqRItPnxA5ExXH7ETg,14112,1203,167,0,0,Topic
1234,VzkZZrKSvRY,Marburg Ausflug im Elektroauto Ford Mustang Mach E #elektroauto #mustangmache,2022-02-25T16:29:21Z,UCVUBc0WF5X-w3T8s6Wyx-jw,4789,450,167,0,0,valid
676,0RkdOWxTQvg,#27 Frieren für den Klimaschutz? | Das ist eine gute Frage PODCAST,2022-02-11T14:00:53Z,UCEPZNMjVXBALuPZNKNua5Hg,5464,426,166,0,0,Topic
270,NtKDT49Xa5c,Der BMW iX xDrive50  ✅ Review 🎬 Test  💣 Fahrbericht ❗️Ein völlig neues Kapitel für uns?,2022-02-19T17:15:12Z,UCVKe3-5kQRddaOHTdn-_Qbw,16837,645,165,0,0,valid
867,ogeWe70ZeY8,Stress am Supercharger? - Tesla hat jetzt für ALLE Marken geöffnet,2022-02-15T17:07:28Z,UCBc0Mghy-6jhMXs3T7DluMg,11311,601,164,0,0,valid
1341,E_krqx7fOcM,Wir VERLÄNGERN den ferngesteuerten BUGGY! - Fährt er dadurch SCHNELLER im GELÄNDE?,2022-02-28T17:15:01Z,UCPFhnt7T8iaBLp1wIfFRzFw,51607,4390,164,0,0,Topic
1741,V9TFANCiD0E,😍 LINHA DE FREIO FICOU NOVA! 🙏🏻 ACHAMOS PEÇAS E PARAFUSOS QUE FALTAVAM!,2022-02-28T20:00:17Z,UCxQ8RuPpPjc8SdPzO98VWCQ,24677,3834,164,0,0,Language
251,YsLDtS0Eefg,Der VW e-up! ist zurück für happige 26.895 EUR!!,2022-02-18T12:33:49Z,UCsNdsFTTBj5jcRJSWeJ8-Xg,7108,499,163,0,0,valid
1272,Cz3p7C61Nus,Aral Ultimate 102 vs. Super 95 | Lohnt sich das?! | Der ultimative  VERBRAUCHSTEST,2022-02-26T12:00:10Z,UCzyBlIm4NE2ch85fY3Y4cOA,24192,1137,163,0,0,valid
1346,wGxhHL3F1n0,"Söllners HSR: ""Zeitenwende!"" Putin, Solar, Hensoldt, Lynas, Rheinmetall, Nordex, Gold, Bitcoin, VW",2022-02-28T10:32:17Z,UC62IIFhchBWQxLPSyUatD-A,48108,761,163,0,0,Topic
1149,BrQrP5W-0sY,"Das Ende der LADEFLATRATES: ELVAH stellt die Tarife um und streicht ""Flatrates""",2022-02-22T17:06:12Z,UCsNdsFTTBj5jcRJSWeJ8-Xg,6232,533,161,0,0,valid
1522,tMloQwf--pw,Mercedes-Launch: Das sieht richtig innovativ aus! | F1-Präsentation 2022,2022-02-18T09:59:26Z,UCRPBekysfE3aQe8YkikbS0Q,48118,947,161,0,0,Topic
504,uXkm135YcRs,Opel Astra Ultimate (180 PS): Besser als Golf und Co.? Der Plug-in Hybrid im Test | Review | 2022,2022-02-07T19:32:07Z,UCUKYv9dpFAbuLNWIgxuQQBA,27117,609,160,0,0,valid
323,Ow344I6vdBg,Photovoltaikanlage mit Speicher im Januar 2022 - Ich bau PV 35: Es geht aufwärts....,2022-02-01T07:00:05Z,UC4t0KuLYBiXqXF27UtjLxPw,3475,140,159,0,0,Topic
1449,T2wdXfC7J9I,450SX Main Event Highlights - Anaheim 3 2022,2022-02-13T07:25:00Z,UCkaNo2FUEWips2z4BkOHl6Q,216540,2662,159,0,0,Topic
1504,S5Brmz2LNFc,ASÍ ES EL CHICAGO AUTO SHOW 2022 | PRESENTAN NUEVOS MODELOS 2023 | Dani Clos,2022-02-17T18:09:46Z,UCigXhxKUIQr9_xJPIHArPiw,179077,5782,159,0,0,Language
1628,kSmwGq4ptTw,10.000€ später und noch kein Ende in Sicht! Mercedes-Experte Rafael repariert meinen W124 500E!,2022-02-23T17:00:36Z,UC6YhnDEcgnh2EP6zF3jCMPA,101131,2578,158,0,0,Topic
4,rtdphs8P2U8,"SKODA ENYAQ iV - Platz, Kinderwagen, Kofferraum Vergleich & Alltag | Mit Kapitelsprungmarken",2022-02-01T16:11:17Z,UCaCaZ-vKtnMG2_FKmEePChQ,11192,564,157,0,0,valid
785,iI17Y3YK4x8,Post vom Anwalt zu Zeig mir dein PV Angebot #22 - Pfuscher Spezial: Was geht denn hier ab???,2022-02-13T07:00:09Z,UC4t0KuLYBiXqXF27UtjLxPw,6504,341,157,0,0,Topic
1460,NUhCM0A4FiQ,BRIGA DE PETS - Super Auto Pets,2022-02-14T21:28:12Z,UCH0-0_0XNqkg8dTLYtFaWRg,17864,2060,156,0,0,Language
1708,E1-mZ_8tB_M,Das härteste Rennen der Welt,2022-02-27T16:35:40Z,UChr1sKJ27Fr6WZxAlusbo_w,82864,6996,156,0,0,Topic
750,OddmPBCY_X0,Walter Röhrl und Alexander Bloch über eFuels ... Logisch: Verbrenner Neuwagen machen keinen SINN!,2022-02-13T20:44:33Z,UCasePAQ_q7tbUGybICCj4NQ,8722,540,155,0,0,Topic
1726,FGz9EgsPrOQ,GTA 5 ONLINE 🐷 MEGA RAMPA DI SPIDERMAN !!! 🐷 DAJE !!,2022-02-27T18:32:31Z,UCSn0_ckKBvHeZLokQjjVXww,38873,2138,155,0,0,Language
160,0HaIBIsgFTw,"Stadtwerke München erhöhen die PREISE für das Laden von ELEKTROAUTOS um bis zu 81,6 % je kWh",2022-02-14T16:45:03Z,UCsNdsFTTBj5jcRJSWeJ8-Xg,5816,485,154,0,0,valid
534,C5_WP7ZTjdY,Extremwetter setzt mein Haus unter Wasser - Opfer des Klimawandels? mimimi Video.. :-),2022-02-08T07:00:06Z,UC4t0KuLYBiXqXF27UtjLxPw,2053,166,154,0,0,Topic
1126,8-ok9zWBWEY,📚 Top 7 Importautos 2021 in Deutschland 🇩🇪 | #autowissen #ranking,2022-02-21T21:12:20Z,UCOlgITVVhJf_E8oMtMWW0Ow,151244,7706,154,0,0,Topic
521,obsggrtMQpc,Mit dem Elektroauto nach Malle: Muss man den Urlaub mit eAuto im Jahr 2022 noch planen?,2022-02-08T06:43:59Z,UCsNdsFTTBj5jcRJSWeJ8-Xg,6612,663,153,0,0,valid
656,LxwoNreoHho,Tesla Model Y - Zu den Nordlichtern Teil 2 - Sturmfahrt durch Deutschland,2022-02-11T16:00:09Z,UC5i6nCpwmDVKo98sZD2AAcQ,15595,804,153,0,0,valid
824,UfmerweBc5c,Polestar2 Standard Range Echte Reichweite und Ladezeit 10-80 % Elektroauto Test,2022-02-14T15:00:15Z,UCVUBc0WF5X-w3T8s6Wyx-jw,10242,642,153,0,0,valid
1065,iS4qWXp6QsY,Meine eigene Mipa Mischbank,2022-02-19T08:00:28Z,UCUldMZFMs3116vL4FZ1hpwA,26562,3015,153,0,0,Topic
231,T__8PO9UT-A,"Wird ELEKTROMOBILITÄT zum LUXUS? EWE Go Tarif um bis zu 11,4 % verteuert!",2022-02-18T18:15:28Z,UCsNdsFTTBj5jcRJSWeJ8-Xg,5671,495,152,0,0,valid
1077,vF3AHUP5h5U,Montage Anhängerkupplung am Tesla Model Y für 1.350€. Was taugt dieses Zubehör am Familien - Tesla?,2022-02-20T09:00:18Z,UCDJ45QyDA0gS3ZaX3p6skBQ,9297,483,152,0,0,valid
976,2T5VNars0YI,📚 Solide Familienautos bis 8.000€ 🚙🤩 | #autotipps #familienauto #gebrauchtwagen,2022-02-17T17:08:25Z,UCOlgITVVhJf_E8oMtMWW0Ow,123919,6769,151,0,0,Topic
142,Hd-JD5KNs54,Warum reagieren wir so langsam? | Energiepreise explodieren und wir schauen zu | Bis es zu spät ist,2022-02-11T13:09:49Z,UCaCaZ-vKtnMG2_FKmEePChQ,6206,824,150,0,0,Topic
249,kE4Unmdy4J8,Tesla ModelY Long Range Reale Reichweite und Ladezeit 10-90% Verbrauch Test,2022-02-18T15:00:32Z,UCVUBc0WF5X-w3T8s6Wyx-jw,14884,660,149,0,0,valid
1715,nEzMmhc5jrc,Welches Auto fährt MONTANABLACK? 🤔🤩 | #montanablack #monte #autowissen,2022-02-27T20:13:31Z,UCOlgITVVhJf_E8oMtMWW0Ow,232839,15136,149,0,0,Topic
1155,m7netGp5RBE,Stromausfall zerstört Photovoltaik Speicher - Alle Lampen aus bei unserem LG Chem Resu 10h,2022-02-22T17:30:05Z,UC-k-5F2j4CUzuwkx1QLRlpA,53158,857,147,0,0,Topic
1371,Dj8g1yhXxNU,POMADA MILAGROSA PARA DEIXAR PELE LISINHA DEPOIS DOS 30 ANOS,2022-02-10T17:00:06Z,UCDdUpOFP46mNC9lUNU01LGA,14305,2417,147,0,0,Language
1494,FfgrEllnHSA,SO baust DU selbst DEIN Auto auf GAS! I Benzin zu teuer?,2022-02-16T11:59:17Z,UCwez-kuL7Zs5mc8EU4MQHJQ,9184,772,147,0,0,Topic
547,ujQuIFjtHlg,Peugeot e-208: Elektro-Profi entdeckt überraschende Stärken und Schwächen,2022-02-09T15:56:10Z,UChjA0Vy8gClgOU9W1ttvt8w,16006,901,146,0,0,valid
849,4HNPlMsHQmw,"Konsens & Nonsens Folge 42: Junior Entwickler Hans Moog über sozialen Konsens, Fees, Specs und IOTA.",2022-02-14T19:21:44Z,UCHhVkftf5Pv7_nRYWTsuC-A,7252,,146,0,0,Topic
870,XrUwZcGBmv8,Mercedes-AMG EQE 53 4Matic+ (2022) | Erster Check im neuen AMG EQE 53 | mit Andreas Huber,2022-02-15T23:00:14Z,UCJrXOOtvmGn4CF7aYaJwuHA,28940,505,146,0,0,valid
1169,Lw5QF0TbQR0,Wer langsam fährt verbraucht weniger! | BMW iX | Matthias Malmedie #shorts,2022-02-22T14:00:09Z,UC8xqBQRIXKcnxU4yDu6X07A,27329,1085,146,0,0,valid
1566,sx03zO4ehbs,45 km/h E-Bike / S-Pedelec fahren - was gilt WIRKLICH?,2022-02-20T08:30:19Z,UCR_qtX-sLmIlf7EIn-62h6A,4257,238,146,0,0,Topic
47,jpaxmJzilU4,Eine Winternacht im Skoda ENYAQ - Bleibt es warm? Wie geht das? Verbrauch? Bequem? Der grosse Test!,2022-02-03T17:00:24Z,UC0cCZpU5Ioj1FOuIzj7cSsQ,13642,446,145,0,0,Language
1282,Lvp1qHbjYr8,5x Werkstatt in 5.000km! Wie gut ist Service + Werkstatt + Qualität von Tesla? Model Y nach Abholung,2022-02-26T07:59:13Z,UCqlV0Wt2OaPU9SVTigCuijQ,6871,378,144,0,0,valid
67,SOibMtEKKj8,Beschilderung an Ladestationen - Verwirrung für Elektroauto Fahrer,2022-02-04T16:28:57Z,UCaCaZ-vKtnMG2_FKmEePChQ,4434,429,143,0,0,valid
153,coOFdeYw6fQ,"Tesla Model Y Laderaum, ein großes Problem und der Vergleich zum Model X und Volvo XC90",2022-02-14T16:00:15Z,UCddkvrnYqGRfODPMUQqisiw,10604,479,143,0,0,valid
707,I-24AjTNZAs,Chile Lithium Wasser Elektroauto und was du noch nicht darüber wusstest,2022-02-12T08:00:11Z,UC7FoJVkvzBr5Rp0YCB5tvuA,6055,1118,143,0,0,valid
718,TkOxbJ39Jc0,102€ Mehrkosten pro Kilometer - REICHWEITE Vergleich iV60 & iV80 | Reicht der kleine SKODA ENYAQ ?,2022-02-12T14:52:58Z,UCaCaZ-vKtnMG2_FKmEePChQ,11109,619,143,0,0,valid
176,gC7ybvvGoIU,1.000 km Reichweite mit neuen Batterien für E-Autos? | Umschau | MDR,2022-02-16T12:24:04Z,UCvwE_EBBDWM552Vd9v8m9Gg,82208,526,140,0,0,valid
1076,A-BfGdeLlsA,Die härteste Etappe zum Nordkap | Roadtrip unter extremen Straßenbedingungen,2022-02-20T09:22:58Z,UC4kNQJvlbqzrAClbI6Qx0yA,106584,2011,140,0,0,valid
1536,vW3EXPe-EEY,NEW 2022 BRABUS ROCKET GT900! +SOUNDCHECK 900HP BRUTAL MONSTER! [1 OF ONLY 10],2022-02-19T15:00:28Z,UCMtcfSnNybg3uhiljDCYQrA,147210,3882,140,0,0,Topic
685,4i5chlUB7q4,Keine Garantie beim MOTORSCHADEN von  LPG NEUWAGEN?! | GM Service Nagel,2022-02-11T13:22:57Z,UCwez-kuL7Zs5mc8EU4MQHJQ,13647,1072,139,0,0,Topic
1663,kgBRzKzy0J8,"Mercedes E 500 Limited, 1994, 2. Deutsche Hand! V8 Klassiker der Zukunft",2022-02-25T17:20:34Z,UC7WXbzvG8HzgjExpS8NyyOw,17599,539,139,0,0,Topic
481,55XDvIB4YZM,Volvo's neue Basis.Reichweite & Ladezeit 10-80 % XC 40 Single Motor Elektroauto,2022-02-07T16:05:36Z,UCVUBc0WF5X-w3T8s6Wyx-jw,8125,517,138,0,0,valid
714,HAT47m8yG6U,Analyse Teil 2: Walter Röhrl über eAutos und Grundlagen zu dem eFuels ... das wird sehr gut! haha!,2022-02-12T19:16:48Z,UCasePAQ_q7tbUGybICCj4NQ,8624,633,138,0,0,valid
868,1cu2dZsmY3o,Reichweite und Verbrauch bei 130kmh und schneller - Model 3 Perf. [Deutsch 4K] | Vision E Drive #148,2022-02-15T17:00:01Z,UCDMd4FzBxxKD5yAeeLStU6A,7635,394,138,0,0,valid
171,1imBpV0Tfck,Markt - die ganze Sendung | 14.02.2022 | Markt | NDR,2022-02-14T20:18:42Z,UCAKB9wGGRccBDrvbbbmgetw,34157,424,137,0,0,Topic
1334,u6g5weP_cKU,"Energietalk mit @gewaltig nachhaltig  - Regenerative Technik nutzen, Gasverbauch vermeiden , Ukraine",2022-02-28T07:00:27Z,UC4t0KuLYBiXqXF27UtjLxPw,1964,139,136,0,0,Topic
256,gHEB6qFZJeo,Freedom Day - Mogelpackung? Joachim Aigner / Landesparteiobmann OÖ,2022-02-18T06:36:28Z,UCBP5nv_XcTp1WOeWGLWj12g,11548,1372,135,0,0,Topic
34,tiVZWjEK-GY,Leider geil: Der krasseste Plug-in-Hybrid der Welt?,2022-02-02T20:25:47Z,UCiZnK4X73okItJqaCs2YDOQ,91665,1800,134,0,0,valid
623,s21Ajl71IvE,Erste Meldungen aus dem Oster Paket: Freiflächen/Agri PV soll gefördert werden - 200GWP erwartet,2022-02-10T16:12:18Z,UC4t0KuLYBiXqXF27UtjLxPw,3137,129,132,0,0,Topic
1644,9Ha7UormxQU,ELDEN RING É UM DOS MELHORES DA HISTÓRIA e MAIS | Ping,2022-02-24T18:00:04Z,UCHCcdjkFeWndu5UixT1xswQ,16426,1551,132,0,0,Language
1706,EPaNlKKmuAI,"MAI PIÙ iCLOUD, DROPBOX E GOOGLE DRIVE!",2022-02-27T14:00:06Z,UC6NpRkanSBgQVdPZs_y3aKg,45717,1679,132,0,0,Language
18,V3MNFkMF83w,"""Elektromobilität ist Schwachsinn"" | Stark Varg – Verkauf gestartet | MOTORRAD NACHRICHTEN",2022-02-02T17:00:31Z,UCb75GFHvRRlejMehKQzTYjw,7870,547,131,0,0,valid
1367,7y9gZQLy3TY,ACHAMOS LUGARES SECRETOS NO GOOGLE EARTH - O AMOGUS APARECEU!,2022-02-08T21:00:16Z,UCLs0R47-6DgKbPUrOW4aZrg,199430,4297,129,0,0,Language
1645,mA-g8e_iGrE,SIMULADO DO DETRAN - QUESTÕES MAIS COBRADAS NAS PROVAS - 1ª HABILITAÇÃO E RECICLAGEM - AULA 17,2022-02-24T12:22:19Z,UCAIbNgz6EiwvFvria69B2HQ,6729,666,129,0,0,Language
581,oX03R3ZotRA,Der autarke Rentner,2022-02-10T19:30:11Z,UCy82YSU9FxoYhknZ4PFmjrQ,29319,644,128,0,0,valid
795,Jk0cJVfKAXA,E-Bike an Autoladseäule laden - ich zeige euch wie das geht 🚴‍♀️🔌👍,2022-02-13T13:35:54Z,UC6hfvmsRhuO5JcOJDnNJ4zw,43905,902,128,0,0,Topic
1584,69TLlNk4VqM,SISTEMA BIZARRO ONDE AS CRIANÇAS ESTÃO OBESAS E OS PAIS NÃO FAZEM NADA | Dr. Dayan Siebra,2022-02-21T15:26:27Z,UClN6OLbLp1YjTSwDOkEM2dA,11596,1893,128,0,0,Language
752,B7Quvj9B3Q8,Gigafactory Genehmigung weiter verschoben - Gegenwehr wird stärker - Aussichtsloser Kampf,2022-02-13T19:26:56Z,UCaCaZ-vKtnMG2_FKmEePChQ,8396,743,127,0,0,valid
1398,LjMdwRI-4r8,Mercedes-AMG GT Black Series: Neue Bestzeit für den Über-GT? - Fast Lap | auto motor und sport,2022-02-11T15:00:21Z,UCLINPbYQ9sy6qc-TqtBeVnw,63331,1463,127,0,0,Topic
738,LI64PymK800,"Ihr glaubt nicht, was wir in Mexiko gewonnen haben 😅",2022-02-12T08:00:06Z,UChr1sKJ27Fr6WZxAlusbo_w,95355,6225,126,0,0,Topic
1401,t3Oj7mlfVcc,ENCUENTRO VEHICULOS SECRETOS ENTERRADOS EN GTA 5 !! (MODS) - ElChurches,2022-02-11T20:00:25Z,UC3MkSLMRz4KzhsjPUtBtPdg,108511,6309,125,0,0,Language
1468,MoED4BowhZo,ANGRY PEOPLE VS BIKERS,2022-02-14T13:00:10Z,UCJAnd3hsm6mdG3QXMAeTO1g,62603,4381,125,0,0,Topic
1230,GXxepK6Jt4s,Vom Kuhstall zu Deutschlands bekanntester Elektroauto Werkstatt,2022-02-25T16:48:00Z,UChjA0Vy8gClgOU9W1ttvt8w,15998,1255,123,0,0,valid
1443,zQSYolMBNXo,"Kaffeepause - Erziehungstipps, Selbstbewusstsein, Auto fahren, Hochzeitskleid | OlesjasWelt",2022-02-13T08:00:14Z,UCqrZYOPbG60Hlw94t_yMmyg,22356,1155,123,0,0,Topic
1111,zvBJF4liLZ4,Fragen zu Balkonkraftwerken | Lisa & Lucas erklären wie!,2022-02-20T17:00:28Z,UC9bbdYLoAFJSd_5lk4lDhdQ,8540,751,122,0,0,Topic
1553,7sd7mu0cZ54,OHC 70mm VS 150 70mm MILLER VS NEGO BALA! CORRIDA DOS 70mm PIRATÃO,2022-02-20T15:15:28Z,UCvQX5fhtnRp9_oBldouqEdA,58679,7891,122,0,0,Topic
762,yzvC7USnNAQ,"Seitenleuchten, Kühlschrank, Trittstufe gehen nicht - Die Lösung DIY",2022-02-13T06:00:31Z,UCOnGACxo4jQ9zPxR9IL7ulg,10517,1273,121,0,0,Topic
942,401x17Qm-w4,FICA SEMPRE CANSADO? ENERGIA DE VOLTA EM 4 PASSOS | Peter Liu,2022-02-16T21:00:06Z,UC6ZrZAZgQxsq7OUNgKSlJ-Q,25720,4288,121,0,0,Topic
1206,9S24XMNu9nM,BMW iX40 - Der Mega-Elektroauto Verbrauchstest - Ist das die Zukunft von BMW?,2022-02-24T15:30:02Z,UCd5Jpd5473VPhNjdWMUP6tw,6662,547,121,0,0,valid
1345,ig_4_h1_MXg,"Grid Legends | REVIEW | Das könnt ihr doch besser, Codemasters?!",2022-02-28T18:00:15Z,UCWVmTAYeA--m-6MDNsxp4Ow,12149,346,121,0,0,Topic
1406,CD725zEEvJk,Renault Captur E-Tech PHEV,2022-02-12T08:02:31Z,UCHY44bG4laoc3TY3blBlgOg,11603,461,121,0,0,valid
1593,SQXH58rvd_I,COMO ACHAR E PEGAR TODOS OS SECRETOS DO ANIME PUNCHING SIMULATOR !!!,2022-02-22T15:00:28Z,UCueV3jpKmYkZLxNdL2YNbAA,61454,3055,121,0,0,Language
119,NaT16i7S_ZE,Mercedes EQE (2022) | Erste Mitfahrt in der Elektro E-Klasse | mit Andreas Huber,2022-02-09T12:55:45Z,UCJrXOOtvmGn4CF7aYaJwuHA,29772,468,120,0,0,valid
261,by5N6t3lsmo,"Es geht wieder los, News KW 07 2022",2022-02-19T14:11:25Z,UCua87-Wr29nGhVLzZrN2e_g,12377,401,120,0,0,Topic
554,2SBBLDqKuFY,Warum Tesla?  Dirk kauft ein Model S,2022-02-09T18:12:00Z,UCqtBzOjVW0aLVZHaRYu7dpQ,25805,1482,120,0,0,valid
629,JuSiJxPsIUk,💥 WER NICHT HÖREN WILL MUSS FÜHLEN! 💥,2022-02-10T15:15:01Z,UCJiRXf1Pb0ZkoPD7qcQIvlg,53749,1299,120,0,0,Topic
787,#NAME?,"Photovoltaik: Erträge steigen, politische Entwicklung, Wärmepumpe - 18:30 LIVE - Die Gesprächsrunde",2022-02-13T18:46:24Z,UC-k-5F2j4CUzuwkx1QLRlpA,9071,307,120,0,0,Topic
1031,v5czj6iIwCA,Renault Megane E-Tech Electric vs. Volkswagen ID.3 - AutoWeek Dubbeltest,2022-02-18T15:00:36Z,UCzToShYR6Sw_k1i6FsdEr6g,24007,232,120,0,0,valid
1131,TzL7M4xg4xs,"Top News - Kanadischer Banken-Run, Mobilmachung in der Ost-Ukraine, Au und Ag vor Riesen-Anstieg?!",2022-02-21T18:28:08Z,UCL0z5mZgOKKzyQc8iJkZp-g,9059,973,120,0,0,Topic
43,bROWdcMb4Vo,"Breaking Elektro-News: Tesla ""Rückruf"", Polestar lädt zum Laden, eAuto als Ladebooster, etc.",2022-02-03T06:00:21Z,UCsNdsFTTBj5jcRJSWeJ8-Xg,7703,638,119,0,0,valid
562,HRDFjUU9dho,"Einspeisevergütung in den Niederlanden.. Saldierung am ende.. +kleines update zur ""Überschwemmung""",2022-02-09T07:00:09Z,UC4t0KuLYBiXqXF27UtjLxPw,1431,152,119,0,0,Topic
1618,PMtxPfJAFPE,#3MinutenMittwoch | Wie lange braucht ein Windrad um ein Auto aufzuladen? Cooler Artikel von eFahrer,2022-02-23T14:00:09Z,UC7FoJVkvzBr5Rp0YCB5tvuA,4283,720,119,0,0,valid
317,8kQX04SB_P0,Das Geld wert? Unu Scooter Review nach 1.800 km!,2022-02-01T14:03:23Z,UCyHK70XuRaWjwBnz2jHWxeg,26265,489,118,0,0,valid
428,6WUgYAKCM8c,Wasserstoff-Stromspeicher Photovoltaik! Technische Daten Picea?,2022-02-05T09:00:07Z,UCMlirlzQIUpfb3uC5LXB17Q,6708,367,118,0,0,Topic
678,BwaXDMyfEfM,800km für diese Gurken? Operation OPELDEAL! & Auf ne Pizza bei Marco Degenhardt,2022-02-11T13:00:05Z,UC-j9aPqRItPnxA5ExXH7ETg,17387,1324,118,0,0,Topic
794,Z_cIPr9HRUE,NEW! Mercedes EQS 580 | Fast Autobahn Range⚡️🔋 | by Automann in 4K,2022-02-13T10:29:24Z,UCEsbHTupMY0Ul3nb9FFGF_g,31107,769,118,0,0,valid
908,FZBVeVT_Tqs,Neue Technik bringt 50x mehr Gold als jede Mine,2022-02-15T16:02:33Z,UCJUIsiPA0pSn2N4ZnTkGSRw,33794,1194,118,0,0,Topic
1016,2XybvBFvjus,So denkt Österreich über die Sprit-Preise,2022-02-18T11:35:13Z,UCyQpfuhftLvrmjxgEzVH78Q,3316,45,118,0,0,Topic
1047,YEtUglVdto0,"Aktien-Schnelltest inkl. NEL ASA, Mercedes-Benz, BYD, ThyssenKrupp usw.",2022-02-18T17:00:17Z,UCpizF02l8esfRRe6lv3qmig,16416,913,118,0,0,Topic
196,bk132PBJkhY,"TESLA: Model 3 & Y Welle in Deutschland, Matrixlicht-Update & Model Y & 3 Dominanz",2022-02-16T15:59:33Z,UCpPbcfwq0wOpWrC0gBs73tQ,20779,1102,117,0,0,valid
404,GdcDb2uFlB0,RÜCKRUF Ford Mustang Mach-E: Sind jetzt alle Probleme behoben?,2022-02-05T06:49:44Z,UCsNdsFTTBj5jcRJSWeJ8-Xg,8706,576,117,0,0,valid
799,IzAI7N_MQ5g,Microsofts große Lüge: Wann schlägt Windows ARM die M1 MacBooks?,2022-02-13T10:58:06Z,UCxzAgP3LiHKki4OAy0le9sw,19196,817,117,0,0,Topic
1437,-5jyZWx9Y9U,TOP 100 FUNNIEST GTA 5 FAILS! (Best GTA 5 Funny Moments),2022-02-13T13:00:00Z,UCC-uu-OqgYEx52KYQ-nJLRw,244471,5543,117,0,0,Language
299,j7MD6BUJ33o,Ist es verboten ein E-Bike an einer Ladesäule für E-Fahrzeuge zu laden ??? 😳,2022-02-20T09:03:59Z,UC6hfvmsRhuO5JcOJDnNJ4zw,32168,1016,116,0,0,Topic
347,7coQVO5ISb0,Prag ❤️ Tschechien ♥️ immer mehr Menschen treffen sich ❤️ für eine Weltweite gemeinsame Zukunft ♥️,2022-02-02T16:32:24Z,UCOlRPQmGfubIt6a6scXQz1Q,9544,1432,116,0,0,Topic
1411,RkAXJmY08BY,Autoindustrie am Ende!? Hunderttausende Stornierung in kurzer Zeit! Autos bald komplett verboten?,2022-02-12T16:34:11Z,UCY4IRKiV-jGyef351u9B7SA,23949,839,116,0,0,Topic
63,hqDtO92_gJI,Hyundai Kona Elektro - Reichweite und Verbrauch im Winter [Deutsch 4K] | Vision E Drive #145,2022-02-04T17:00:34Z,UCDMd4FzBxxKD5yAeeLStU6A,10412,526,115,0,0,valid
951,ni0r9ZB_kmA,Sie sind gelandet und haben ETWAS zurückgelassen! Mysteriöse Disk mit Alien Inschriften entdeckt ?,2022-02-16T18:00:20Z,UCOidlT_g7LMXlLkiGK6aTdw,19978,1043,115,0,0,Topic
1534,U1iHLmROjLQ,Superstoff Rattan - Vom Gartenmöbel ins E-Auto & das ist nur der Anfang! | Galileo | ProSieben,2022-02-19T11:30:06Z,UC1XrG1M_hw8103zO2x-oivg,56039,1062,115,0,0,valid
1541,xy-NfFGYxR0,HORIZON FORBIDDEN WEST #5 | PETRA A DOIDA DE MINERÁLIA (PS5/4K/PORTUGUÊS),2022-02-19T12:00:14Z,UC7I9vRncx1-vox41l1A0ACQ,23663,2408,115,0,0,Language
913,b6HaNwIEfQM,"MG 5: Der bezahlbare vollelektrische FAMILIENKOMBI? Alle Infos, die wir bisher kennen!",2022-02-16T15:19:39Z,UCsNdsFTTBj5jcRJSWeJ8-Xg,4816,444,114,0,0,valid
1408,wSMpCOJF5A4,"VERGEVEN, ZUSSENLIEFDE & VROUWEN REIZEN - BIJ KHADIJA IN DE AUTO MET @OULFAXOUL | KHADIJA BAIS",2022-02-12T19:00:14Z,UCq5wXqqyMTcMZ9j6at4cXpw,75751,1372,114,0,0,Language
1699,-6mi81TWl9s,LEVELLA | Mercedes W124 E60 AMG | Zeiten messen 100-200 km/h - Was bringt der V8 auf die Straße?,2022-02-27T09:00:00Z,UC7JjVypaHKgdCmFxJjZtwAw,24277,1340,113,0,0,Topic
1259,qoVZhNCgqj8,Tesla Akku hat nach 6 Monaten mehr Kapazität - wie gesund ist er? Hält 450.000 km!,2022-02-26T14:00:14Z,UCd5Jpd5473VPhNjdWMUP6tw,8336,1040,112,0,0,valid
238,HLxjh0jpLC0,Renault Megane E-Tech Ersteindruck - DIE Überraschung 2022?,2022-02-18T16:00:08Z,UCaTyFx9Llt5nQRAFjZyowow,13611,484,111,0,0,valid
400,IY4nYN3kVRo,Mercedes EQA 250 Elektroauto Winterreichweite & Ladezeit 10-80 %  Verbrauch #elektroauto #mercedes,2022-02-05T15:30:03Z,UCVUBc0WF5X-w3T8s6Wyx-jw,9570,545,111,0,0,valid
227,Rx0SNhMgOVY,"🚨😷 Spaziergängerin in Schopfheim: ""Das social distancing...!""",2022-02-17T20:42:27Z,UCaj9JoeeKRGh_MUFIjNy6dw,3988,523,110,0,0,Topic
1104,wxpRJ9LDd4I,VW Taigo im Test (2022) Wie gut ist das SUV-Coupé ab 19.865€?! Fahrbericht | Review | Preis | Style,2022-02-20T16:00:29Z,UCy9Y4en2y1eR1zwcmFkRMzg,32966,419,110,0,0,Topic
1348,lDs_ZFz9R5s,"Was der Krieg für Aktien, Inflation und alles andere bedeutet",2022-02-28T19:23:54Z,UC-muQylmRx61Mt6U1oDSEVA,64098,1393,110,0,0,Topic
1518,INlarS9-l1M,HAUL GIGANTE DA PRIMARK PER LA PRIMAVERA,2022-02-17T13:00:06Z,UCC_K-QAGsezuQahPFUMaEvA,54083,2401,110,0,0,Language
1319,lu24SwBlluc,Hoher Eigenverbrauch mit Wärmepumpe und Speicher - Autarkiequote mit SUSI berechnen,2022-02-27T07:00:19Z,UC-k-5F2j4CUzuwkx1QLRlpA,8193,361,109,0,0,Topic
5,GHLy573v94o,Lohnt sich unsere Photovoltaikanlage mit Speicher im Januar? Was machen die aktuellen Strompreise?,2022-02-01T15:00:16Z,UCGoI004ZXiUb1NmY3zXBWTw,7056,200,108,0,0,Topic
369,T8RvXhRxSow,EU erklärt Atomkraft und Gas zu grünen Energiequellen - Taxonomie und meine Meinung dazu.,2022-02-03T07:00:15Z,UC4t0KuLYBiXqXF27UtjLxPw,1200,144,108,0,0,Topic
596,d_2GbfXcvX0,Warum Tesla immer noch die EINZIGE Aktie in meinem Portfolio ist!,2022-02-10T17:29:59Z,UCNzTCruSgmp9oNtl1HE5dDQ,3545,217,108,0,0,valid
1451,kAdBpox1sIg,So habe ich 3 Tage bei -71°C überlebt,2022-02-13T17:32:21Z,UC5RKY3m-7ZhrCCgZC-q9mOg,9694,1338,108,0,0,Topic
147,1RxECD0JH_I,Geniales Interview - Putin war eine echte Chance für Europa.,2022-02-11T16:22:02Z,UCiyLwoWK3vZJfb0VyT0QJ5Q,15016,542,107,0,0,Topic
537,Kq5LHUU93BE,"Toyota Aygo X im Test (2022) Echt jetzt?! Kleinwagen, SUV und Cabrio in Einem?! Fahrbericht | Review",2022-02-08T07:00:04Z,UCy9Y4en2y1eR1zwcmFkRMzg,34883,501,107,0,0,Topic
671,5h7CCaZnApc,VHF#58: Darf man noch einen VW kaufen?,2022-02-11T14:00:03Z,UC0PJSqEcY5p3NtG9o9A4RWg,3923,330,107,0,0,Topic
819,zYAubE7K5wI,Rettung der Rentenkassen? Wirtschaftsweise stellt diese gewagte Forderung...,2022-02-13T15:00:34Z,UCu02GkFNrMRzwysT2SEmNrQ,10974,553,107,0,0,Topic
834,8AggZSu758E,Der Photovolatik Erklärbär: Lohnt sich das Norddach / Mitbelegung Zusatzflächen - Mein Rechenweg..,2022-02-14T07:00:05Z,UC4t0KuLYBiXqXF27UtjLxPw,2287,179,107,0,0,valid
1652,E-ZerOMEduE,OPPO Find X5 Series | Launch Event,2022-02-24T11:00:13Z,UC1ET-1gMajGNKzOvm2e_D7Q,10175092,1064,107,0,0,Topic
524,gDMIjuZPqIw,TESLA: Noch mehr 4680-Produktion & Batterie-Preisschock!,2022-02-08T16:00:04Z,UCpPbcfwq0wOpWrC0gBs73tQ,26879,1195,106,0,0,valid
1165,z7nMsKVLjRk,Kräfte messen ums Gas - Wie kommen wir da raus? - Auswege aus der Abhängigkeit,2022-02-22T19:45:59Z,UCaCaZ-vKtnMG2_FKmEePChQ,3841,367,106,0,0,Topic
1501,8ZaJI4aVfYo,GOYANGIN BARENG NABILA LAGU BUIH JADI PERMADANI,2022-02-16T11:00:05Z,UCUE-BF1Q5E6Sz1KidSnSRYw,192485,3410,106,0,0,Topic
1128,uiQfI36g44s,Tesla Model 3 oder Audi Q4 e-tron - 2 zum Preis von Einem?,2022-02-21T16:00:23Z,UCaTyFx9Llt5nQRAFjZyowow,18175,406,105,0,0,valid
743,eTlz0yUAVwE,Ausgaben in Bulgarien / Miete / Wasser / Strom / Heizung /u.s.w.,2022-02-12T15:18:24Z,UCwZBQH9q3vM9L1fI00B9Deg,3468,250,104,0,0,Topic
929,Tf8ZA86DSIQ,Grüne Energie für jedermann - Energiekonzepte aus dem Frankenwald | Frankenschau | BR,2022-02-16T13:03:47Z,UCZuFrqyZWfw_Zf0OnXWUXyQ,22624,452,103,0,0,Topic
