,video_id,title,published_at,channel_id,view_count,like_count,comment_count,job,id,valid
1358,qowsHwEBjoA,NATO vs. Russland: So wäre ein Krieg,2022-02-05T10:00:32Z,UCZHpIFMfoJJ_1QxNGLJTzyA,3986871,92547,17911,0,0,Topic
1429,W9cLFCzu15Q,I BUILT CAR WASHER ON MY GAS STATION,2022-02-13T03:30:11Z,UCX8pnu3DYUnx8qy8V_c6oHg,6829403,463558,16059,0,0,Topic
1671,Xi-nRpfFgDQ,Budi Doremi - TAK KAN HILANG (Ost. Vidio Originals DJS The Movie: Biarkan Aku Menari),2022-02-25T09:00:12Z,UCyDGS0Us_SgWzR2kzGc7RpA,1604589,181269,12264,0,0,Language
1454,iXOP_81L14s,BELLA AKHIRNYA MENG4NDUNG !!! SUPRISE ALIEFF MENANGIS DAPAT TAHU BERITA INI...,2022-02-13T12:30:19Z,UCKCK2lumiYpKfD1aEj4W5vg,2191603,157169,9898,0,0,Language
1636,m50hvh4yHkk,ÖRÜMCEK ARDA VE RÜZGAR GÜÇLERİNİ BİRLEŞTİRDİ! 😱 - Minecraft,2022-02-23T08:09:38Z,UC2XbMXD6jSrixkpgs7vHFUA,1378003,40692,9697,0,0,Language
1424,cUxfZtxcujk,Putin - Die Rückkehr des russischen Bären | Doku HD | ARTE,2022-02-12T17:00:21Z,UCLLibJTCy3sXjHLVaDimnpQ,3335946,31324,9619,0,0,Topic
1458,DTVMH_RUtnw,EL INFILTRADO #61  POR FIN ADIOS EMULADORES!!! SOLO VS SQUAD!!!  CLASIFICATORIA!!! NUNCA MAS!!!,2022-02-13T01:37:41Z,UC6Ij1c74Gm-TicYZsKL1FAw,2975644,323646,8873,0,0,Language
1400,SjISEmDQD7I,HARI PERTAMA SELEN MAEN KELUAR KANDANG ! SEMUA ORANG DIAJAK MAEN SAMA SELEN ! LARINYA KENCENG BANGET,2022-02-11T09:07:25Z,UC3vEIgE_o46HVa8QrPa8Svg,7072778,214117,6866,0,0,Language
1394,TmSmFDaahs0,MY SECRET HIDDEN BASE FOR WAR IN HEROBRINE SMP | RAWKNEE,2022-02-11T08:00:17Z,UCZaHw7tdjy3TNMH3ncsI4Bg,2109641,171300,6490,0,0,Topic
1729,TkfMYFPe98A,Ukraine: Anonymous erklärt Putin den Cyber-Krieg,2022-02-27T11:00:13Z,UC4zcMHyrT_xyWlgy5WGpFFQ,1037483,24749,6154,0,0,Topic
1640,ePgM4pRFeyU,TANGIS KANG DEDI SAAT ANTAR KEPERGIAN AYAHNYA | MENYESAL GAK BISA BELANJA BUAT BAPAK LAGI,2022-02-23T13:00:11Z,UCopjJE-RzBmv4MID-E1Oiyg,601742,31097,4509,0,0,Language
1233,kjwiFMxRotQ,Mein Elektro-Mercedes Werkstatt Termin: DESASTER. ABZOCKE. WUT.,2022-02-25T15:30:07Z,UCiZnK4X73okItJqaCs2YDOQ,214027,16048,4224,0,0,valid
1281,pIgLQJjNU_0,+++ STURM auf Kiew!+++ DER Ukrainekrieg - IHR Kampf gegen PUTIN!,2022-02-26T07:00:07Z,UCOQFfcGRc886dXP2Oyt5OEg,271244,27745,3909,0,0,Topic
1637,B8P2W0uExvQ,Winner Winner Mummy Dinner | Party | MCA | Middle Class Abbayi | Funmoji | Infinitum Media,2022-02-23T11:48:20Z,UCXp7t87iLdty_jKYZtLg_lA,1368773,100272,3688,0,0,Language
1464,zYqgGBlCy44,Ich hab Standart Skill MercedesBenz Geklaut !!! 😎,2022-02-14T19:36:37Z,UCk-ERvn9_tUjg7e8Bn921gA,359621,11376,3687,0,0,Topic
1461,yuKiBBhQ7Y0,CHI DISEGNA WILLY WUGGY FRATELLO CATTIVO DI HUGGY WUGGY PIÙ BELLO VINCE E SCAPPA DA POPPY PLAYTIME!,2022-02-14T13:29:53Z,UC0zUezMTgb3yqxwFz2djmYw,346746,11146,3583,0,0,Language
1513,WYueeB1XV9I,SIDEMEN BATTLESHIPS ON GTA 5,2022-02-17T19:00:08Z,UCh5mLn90vUaB1PbRRx_AiaA,2608390,137865,3192,0,0,Language
1402,NE4p_S9NeS0,"🚨José Eduardo Derbez, Vadhir Derbez y Chilz en Pinky Promise-T3. EP.19",2022-02-11T01:00:51Z,UC2nVOeuIeODyrZ2Mei_ocTQ,2121093,48187,2906,0,0,Language
1731,6IZ2yhUq6CY,CAUSAS DA MORTE DE PAULINHA ABELHA DA BANDA CALCINHA PRETA | Dr. Dayan Siebra,2022-02-27T15:01:57Z,UClN6OLbLp1YjTSwDOkEM2dA,468184,51675,2879,0,0,Language
1387,eG1eZ5IoxkQ,Rich Dad Vs Broke Dad,2022-02-10T20:33:15Z,UCvo9oZCTg_UaTQbhyXkXX3w,2926148,47144,2648,0,0,Topic
1598,yTFBCvAuk3Y,SIMULADOR de GASOLINERA?! 🔥🤣 | Plech,2022-02-22T21:20:38Z,UCKGLPbKJXJSlvGUtbU-1tpw,1102884,35619,2525,0,0,Language
1350,LwEHWsUp4qA,JOGAMOS MINECRAFT DENTRO DO CS GO!! QUEM GANHOU ? ROBIN HOOD VS HEYDAVI,2022-02-02T22:21:12Z,UCYtaoJSk9iIrFxx8eZB15ag,1967624,105174,2484,0,0,Topic
1388,MnJpG3kIEIU,Schule für immer! Das verdient ein verbeamteter Lehrer an der Realschule | Lohnt sich das | BR,2022-02-10T14:04:39Z,UCVF_W6X2BFOh6TPv1Efm9YQ,690571,11798,2295,0,0,Topic
1385,qW7P2BXv658,JURASSIC WORLD 3 Trailer German Deutsch (2022),2022-02-10T14:10:59Z,UCOL10n-as9dXO2qtjjFUQbQ,1213007,40392,2135,0,0,Topic
1606,xGnGfR0tD44,JP Performance - Das hat TÜV ? Porsche G-Model Safari,2022-02-22T10:30:11Z,UC1-VOKyTJrgLiBeiJqzeIUQ,417635,18229,2117,0,0,Topic
1446,BDmgrNU7yR8,EL ULTIMO EN SALIR DEL ATAUD GANA $1000 !!,2022-02-13T21:59:32Z,UCZs0WwC0Dn_noiQE2BHSTKg,3487410,75891,2091,0,0,Topic
1714,Oc_IwNtBOe0,Charkiw: Ukrainische Soldaten zerstören russische Konvois | Analyse,2022-02-27T10:00:10Z,UC4zcMHyrT_xyWlgy5WGpFFQ,377583,2916,2082,0,0,Topic
670,FCwxWOPNtrc,Wut-Brummi-Fahrer: Klima-Aktivisten die Meinung gegeigt | BILD Live,2022-02-11T13:30:04Z,UC4zcMHyrT_xyWlgy5WGpFFQ,506012,18056,2044,0,0,Topic
40,XZldwlfSMpU,"Amerikas Angst vor dem Abstieg – die Rivalen: China versus USA, Teil 2 I auslandsjournal",2022-02-02T10:00:29Z,UCeqKIgPQfNInOswGRWt48kQ,440016,4098,2032,0,0,Topic
1465,unnNv0WZlMw,ফাগুন থেকে ফাগুনে |  Short Film | Closeup Didhahin Kache Ashar Golpo 2022,2022-02-14T16:00:12Z,UCVO8HTTCupXu200gNsLsKCA,1222705,36970,1867,0,0,Language
1490,tRWpCMKaeWI,MİLYONER ARDA VS DİLENCİ RÜZGAR! 😱 - Minecraft,2022-02-16T08:00:19Z,UC2XbMXD6jSrixkpgs7vHFUA,2250960,47238,1844,0,0,Language
1363,zQiJMdR6Vpw,Mercedes - Benz C63 - 😥O SONHO ACABOU!?!?!? 😥,2022-02-07T21:00:21Z,UC08IZDh4NSFHl8KYpYNdoVg,111304,13396,1803,0,0,Topic
1613,doG6mPtR-UQ,Cara Main Hero Terbaru Melissa - Mobile Legends,2022-02-22T10:15:58Z,UCvh1at6xpV1ytYOAzxmqUsA,709528,27367,1781,0,0,Language
352,7r5i40Liiks,Eure Videos #218 - Eure Dashcamvideoeinsendungen #Dashcam @Horsepower Dashcam,2022-02-03T07:15:00Z,UC6sac4Q3AuQUGoUpnzd10bA,460986,22028,1765,0,0,Topic
1631,jnfaBa83iPo,HAPPY BIRTHDAY || Rachit Rojha,2022-02-23T10:00:04Z,UCwBlZvRTu3vasTWUE9U5wPw,1577241,40135,1738,0,0,Language
1567,PKIyvzjQxgY,Wir haben aus Fynn´s Volvo einen PANZER gebaut | Kliemannsland,2022-02-20T18:00:09Z,UCLKPfqBGqL4gaEvegb_If0Q,323632,15143,1681,0,0,Topic
1545,KNRa_Faw3Jo,FACETIME um 3 Uhr Nachts niemals mit MIRABEL Exe aus Encanto dem FILM (verfluchte NUMMER anrufen),2022-02-19T14:40:00Z,UCHKVTtxg9yRJ_5KDMZFCkCw,347154,15964,1653,0,0,Topic
248,9VFitH5-Pzo,Inflation: Preis-Schock nach der Pandemie – Wohlstand in Gefahr? | maybrit illner vom 17.02.2022,2022-02-18T06:30:04Z,UCeqKIgPQfNInOswGRWt48kQ,180129,1163,1630,0,0,Topic
1667,OVTh7WcJsh8,OS DONOS DA BOLA - 25/02/2022 - PROGRAMA COMPLETO,2022-02-25T17:04:33Z,UCjlcZ5YIXlBTaob0BkS_gDg,448635,16588,1629,0,0,Language
1692,xOZPCK2Qx3M,"Monte WEINT im Stream!😭 REALTALK über OMA, OPA und den Tod! | MontanaBlack Realtalk",2022-02-26T16:00:23Z,UCo6utge9KpJI61gXe7ngUJQ,766327,62240,1599,0,0,Topic
1577,j9XJ7F6DY14,LUCIANO EN MYLANA KOMEN GEZELLIG BIJ ONS LOGEREN!❤️ #3114,2022-02-20T18:30:44Z,UCh8bTHe4T8o7RIU7R5EPX-w,668463,18819,1594,0,0,Language
1597,LKRP6SdYayA,BIMBO MUSCIX DI 8 ANNI TROVA UN LEGGENDARIO E 9 BRAWLER SU BRAWL STARS!! BOX OPENING LEGGENDARIO!!,2022-02-22T13:45:00Z,UCROMPRvOQmw9lhs3ivu_iwQ,98034,8907,1503,0,0,Language
1074,tlJHjxy6ilc,Nicht so schnell wie gedacht!: Tesla Model S Plaid – Bloch erklärt #173 I auto motor und sport,2022-02-20T17:15:03Z,UCLINPbYQ9sy6qc-TqtBeVnw,186683,4631,1473,0,0,valid
38,0eTWGjm1qWk,Einstein macht Probleme | Harald Lesch,2022-02-02T14:00:01Z,UC5E9-r42JlymhLPnDv2wHuA,475514,14281,1459,0,0,Topic
1650,U-mku8PiC_g,MODEL X vs Turbo S * Porsche 992 Turbo S vs Tesla Model X Plaid 1/4 Mile DRAG RACE,2022-02-24T17:00:20Z,UCWeLPNowZvdzXwnCDxVyNEg,132317,3502,1448,0,0,Topic
1382,g7O8pCmcFrg,ESCAPAMOS DE LOS PERSONAJES DE ENCANTO EN ROBLOX,2022-02-10T21:56:12Z,UC-cnbLlplnXA4oc7rR21qzg,731403,23130,1408,0,0,Language
1510,qb5wOAZDtHk,JP Performance - Dieses Auto bekommt den V10 Motor Swap! | S85 V10,2022-02-17T10:30:18Z,UC1-VOKyTJrgLiBeiJqzeIUQ,733258,29291,1400,0,0,Topic
1656,0dBaNITZr4U,FACETIME um 3 Uhr Nachts niemals mit BRUNO exe aus ENCANTO dem Film (verfluchte NUMMER anrufen),2022-02-24T16:10:00Z,UCHKVTtxg9yRJ_5KDMZFCkCw,290687,12138,1338,0,0,Topic
1744,xcynq4AGECc,ALDOUS KU DI TEMANIN OLEH DUO DEDE GEMAS AUTO SEMAKIN MENGGANAS - Mobile legends,2022-02-28T11:42:35Z,UC_rsMKPp_iGAXtblQ-KEXNQ,355640,17709,1333,0,0,Language
1654,TogO8DwiO34,DURAMAX broke down! Big Money!  Sierra 6.6 Turbo Diesel Fuel System P0204 P0300,2022-02-24T11:00:14Z,UC7qMMY6UJHpNakTDMz6vVXQ,229222,10805,1323,0,0,Topic
1585,l4iUIW3SfXA,"EU LUTEI, BATALHEI E GUERREEI BIG JEF - STRONDA FICOU EMOCIONADO",2022-02-21T15:00:33Z,UCGfrC6R2PSMeXv4hdhONB6Q,88415,14028,1312,0,0,Language
1746,NPHMKNXAO6Y,LAMBORGHINI GALLARDO V10 PERFORMANTE GETS SOME UPGRADES,2022-02-28T17:00:13Z,UCiGcuVR9bhKkRbz-Jb7RxKw,75082,7063,1295,0,0,Language
117,TjG-pUlz8pE,Mordshunger – Wie schmeckt das Essen der Zukunft? – Leschs Kosmos [Ganze TV-Folge] | Harald Lesch,2022-02-09T14:00:22Z,UC5E9-r42JlymhLPnDv2wHuA,116787,3891,1288,0,0,Topic
132,mMKzFXyxcbM,Bin schockiert! Was ist eigentlich los mit E-Auto Fahrern?,2022-02-11T17:29:35Z,UCiZnK4X73okItJqaCs2YDOQ,137955,4813,1258,0,0,valid
1521,eTYn1g6TxcU,REVIEW FAMAS EVO GUN 2 JUTA! AUTO BORONG!!!,2022-02-18T22:30:03Z,UCg_GNu-J5_naq-k1kUfq1Rw,466893,23520,1215,0,0,Language
1678,bKaWG164ArU,DÜNYANIN EN GÜÇLÜ PRO HULKU OLDUM - GTA 5 MODS,2022-02-26T13:45:01Z,UCz8lelVfalizvMb2bHQjDvg,491010,30077,1213,0,0,Language
1480,PQYXPZFsW6I,"4 Jahre mit demselben Öl (60.000 km)! Opel Zafira komplett versifft | ""Billiger""  Kühlwasserschlauch",2022-02-15T12:44:16Z,UCcnmNzv0yEEYPM6Oa86unhQ,526705,14586,1212,0,0,Topic
1176,mHJVhW2h220,Das Raumschiff | BMW iX | First Touch | Matthias Malmedie,2022-02-23T14:00:11Z,UC8xqBQRIXKcnxU4yDu6X07A,219538,7077,1209,0,0,valid
859,awNdcsuudJs,"Komm, wir gucken mal den Kommentare-Spam-Ordner durch. Dauert auch nur 40 Minuten :p",2022-02-14T15:40:47Z,UC6sac4Q3AuQUGoUpnzd10bA,133096,6223,1202,0,0,Topic
1450,eJEsIRXB0MI,VAMOS RIR? (PARTE 2) MELHORES MEMES DE CHELSEA 2X1 PALMEIRAS! PALMEIRAS CONTINUA SEM MUNDIAL,2022-02-13T00:46:06Z,UCCj6Zag7JKm_Xjra-u7c91w,469346,20385,1190,0,0,Language
1423,Yis7nKK5xN8,SI ME RIO PIERDO CON VIDEOS DE SUBS !!,2022-02-12T01:17:12Z,UCa3jp09F9qG4SaHIeHEdcKA,529952,36778,1171,0,0,Language
1601,oNuLFw_Ewy8,FEHLER GEFUNDEN! - Michas 5Zylinder Audi Coupé - Viel Arbeit UMSONST!,2022-02-22T11:00:32Z,UCNhFsNZQfB2mdM1FoV6q1Kw,282903,16242,1134,0,0,Topic
39,sjvJ13totzY,Tesla mit 20.000€ Akku Schaden - wie geht es weiter?,2022-02-02T19:12:09Z,UCkeQaTKHKmRnWmXnl0uIuSA,223693,12336,1106,0,0,valid
1634,QGZtGJnJG_8,EKIPA WRACA DO SZKOŁY,2022-02-23T14:00:17Z,UCkbpEIF1GKSXBn8YqjN0vyQ,781170,61925,1103,0,0,Language
301,SUkzUapCscY,VW ID. Buzz: Next Level des Kombi aber wirklich DIE Revolution?,2022-02-20T23:00:18Z,UCiZnK4X73okItJqaCs2YDOQ,189736,7279,1097,0,0,valid
247,o6oDtScxt2I,Photovoltaik 2022 durchgerechnet: Das ändert alles!,2022-02-18T13:00:22Z,UC-muQylmRx61Mt6U1oDSEVA,249658,4849,1074,0,0,Topic
141,TMcXqXHJycs,Opel Astra Plug-in-Hybrid 2022: Tote Pseudo-Technologie für Steuersparer?,2022-02-11T15:00:28Z,UCiZnK4X73okItJqaCs2YDOQ,74417,4038,1059,0,0,valid
1576,j_W9nVdXDDw,PERTAMA KALI FANNY KELUAR DI MPL S9!!! FANNY FERXIC KANN MAENNN!!! MATCH 1 AURA VS EVOS!!,2022-02-20T11:43:00Z,UCirWugW5e03u3DUGA87s58A,1310580,23175,1053,0,0,Language
1040,NDT5ONoTZdM,UNBEGREIFLICH: Lauterbach will KEINE weiteren LOCKERUNGEN!,2022-02-18T16:55:01Z,UCqZSdUJqd2T0oqr6BEA3ONw,43287,4228,1037,0,0,Topic
1378,B9Zz-QLKo90,PRIMEIRO DIA DE AULA DA MHARESSA🥺||RECEBIDOS E COMPRINHAS FOFAS💕+MINHA CASA ESTÁ UMA BAGUNÇA🤯,2022-02-10T19:52:01Z,UCTStSaki2Gqaau-jtLsKy2g,116479,16840,1033,0,0,Language
200,zJm-B6ZpiKY,Die Erde: doch Mittelpunkt des Universums?,2022-02-16T14:00:24Z,UC5E9-r42JlymhLPnDv2wHuA,144864,5839,1031,0,0,Topic
1502,5xnmvXPKxnE,"Wie schwer ist es, ein Auto zu klauen? - Selbstexperiment",2022-02-17T15:01:00Z,UCNCktfoFAXtXnMlhjyc9SPA,515730,24346,1023,0,0,Topic
1587,IqZPlr5E3BA,Großbrand in Essener Wohnblock: Gebäude komplett zerstört| BILD Live,2022-02-21T11:00:09Z,UC4zcMHyrT_xyWlgy5WGpFFQ,223196,2086,1003,0,0,Topic
45,gTLp9cUy4mU,50% weniger Reichweite? Luxus Elektroauto schockt Besitzer,2022-02-03T15:00:32Z,UCiZnK4X73okItJqaCs2YDOQ,132506,5673,1000,0,0,valid
1379,eh5Etbb8OKE,MCDONALD'S DA 1€ VS MCDONALD'S DA 1.000.000€! - ROBLOX,2022-02-10T16:15:03Z,UCvDUogE-9kyjbKxxyBGj_4g,256233,14245,964,0,0,Language
1670,t6vgOs7m6PU,"ASUS 8z India Launch, Note 11 Pro Series Launch Date, Motorola Edge 30 Pro, OPPO Find X5-#TTN1284",2022-02-25T14:15:49Z,UCEPL07qzVsOcHd3sMUws65g,198825,16910,958,0,0,Language
1466,LnkyZj8pBKU,Lil' Kleine mishandelt vriendin; manager slaat deur dicht!,2022-02-14T17:35:18Z,UCHTtspK-G7Wt68awRpTSkiw,374815,3035,957,0,0,Language
1710,j42fJKd_QqA,LAGI SOLO VS SQUAD KETEMU NICK EKS JAGO BANGET!! AUTO CARI MAU GUA REKRUT MASUK GUILD EKAES..,2022-02-27T09:07:55Z,UCWFBxdRm8CqaKI8uGRD7E5w,419978,28396,955,0,0,Language
1433,#NAME?,Auto ZERLEGT SICH beim PRÜFSTANDSLAUF! - Prüfstandstag Halle77 - MARCO nimmt EURE Autos ran!,2022-02-13T11:00:01Z,UCNhFsNZQfB2mdM1FoV6q1Kw,274099,11802,951,0,0,Topic
1754,2usZAElr8_8,Warum geben wir Spieleentwicklern Geld für unfertige Games? | WALULIS STORY SWR3,2022-02-28T16:00:54Z,UChkVOG0PqkXIHHmkBGG15Ig,110595,5633,950,0,0,Topic
1694,#NAME?,🔴LIVE - DR DISRESPECT - ELDEN RING - SUPER EASY GAME,2022-02-26T01:44:11Z,UCcJL2ld6kxy_nuV1u7PVQ0g,1052242,24500,938,0,0,Language
1725,vWbL9marGN4,EL ULTIMO EN SALIR DEL TOBO GANA ! | Katie Angel,2022-02-27T23:00:12Z,UCgSMDG8aGE3YHfBCXHuPpYA,395765,22091,930,0,0,Language
334,bNxBPliHpiM,Deftige Preiserhöhungen an den Ladesäulen für E-Autos!,2022-02-02T08:00:13Z,UCXpvI8jeu166he5e_Emo2ig,52856,4069,921,0,0,valid
1416,#NAME?,"SEBULAN PAKAI HONDA BR-V, INI YANG SAYA RASAKAN",2022-02-12T08:00:00Z,UCyxFLIrNfV8B3cN4KgQL6sA,472901,8738,918,0,0,Topic
1748,olkEHgbRFrc,RED BULL (PRINCIPALMENTE) PODE SER FAVORECIDA POR PALHAÇADA / MAZEPIN PODE SER SUSPENSO,2022-02-28T21:15:03Z,UCQ96zMdk6go-b2JujnQY_SQ,200332,15066,916,0,0,Language
1426,XAuE--lv-MA,KOŁO FORTUNY DECYDUJE JAKI ROBIMY TATUAŻ!,2022-02-12T16:00:14Z,UCkIwvE28idLCTxgLZ3VdBDQ,578618,43842,902,0,0,Topic
1659,NJkUCTPpINg,Hanybal - ENTSPRECHEN NICHT DER NORM (prod. von Carter) [Offizielles Video],2022-02-24T23:00:11Z,UCp6JbAHLmPV4L3_P6MXAJ7w,115339,10292,895,0,0,Topic
1364,qmno7ncFHrw,"Notbremse gezogen, oder der 5. Werkstattaufenthalt meines Audi E-Tron ...",2022-02-07T16:00:33Z,UCddkvrnYqGRfODPMUQqisiw,54478,1811,893,0,0,valid
1397,OYa3F5rlnCY,ABANDONED 2018 PEUGEOT BOXER CRASHED WITH ONLY 5K MILES,2022-02-11T17:00:15Z,UCiGcuVR9bhKkRbz-Jb7RxKw,233233,11912,890,0,0,Language
1043,wEdw2Cmncnw,"Mir macht YOUTUBE keinen SPASS mehr! Rumgeheule, Rechtfertigung, Beleidigung! #PWInfo",2022-02-18T17:11:08Z,UCewU7vV-uVSVCO8Ai1vr6Kw,74791,5021,882,0,0,Topic
776,xkMALcGnUmc,Achtung Betrugsmasche !!! | Käufer täuscht Motorschaden vor | So wird der Preis heftig gedrückt ! |,2022-02-13T09:00:36Z,UCGZLruV9OMz7JnmXz86ELdg,65830,4036,848,0,0,Topic
1649,Tkfl8UWR_5E,RAFA UCCMAN & LUCAS GUEDEZ - PODCATS T2 - #10,2022-02-24T03:24:03Z,UCvErqQ6ZG1o2i0ZfDssuAwQ,1588079,79217,841,0,0,Language
1661,2jpQDm8AgAI,STUTTGART VLOG MIT SIDNEY & WILLY!🔥 ALLE Fragen zu VITAVATE wurden beantwortet🙌🏼🥤,2022-02-24T14:00:05Z,UCW6SLCuRXuUFWbQH563D0Hw,438243,48077,829,0,0,Topic
1607,xbtu6In566A,NOS CONVERTIMOS EN CHEFS PERSONALES DE NUESTRO HIJO,2022-02-22T18:00:14Z,UCx1ZMnPWAOU01T-bAwJo-QA,736005,25802,786,0,0,Language
1538,sHsvD28M-LI,ZIEH HALT WEG! Die Auto-Dröhner - Mannheims laute Söhne | Reaktion sponsored by SirSurli & Yannik,2022-02-19T17:00:26Z,UCGTRC_2I15euSzNi7VJy9og,88919,3319,785,0,0,Topic
1231,6y3gE0mNgxA,"nextnews: Elektro-Kombi, VW eUp ausverkauft & ID Lieferzeiten, Toyota bZ4X, Tesla, Ladetarife, MG5",2022-02-25T17:00:43Z,UCgmB8S3f8-9dR8alVUZuZxQ,82104,4604,772,0,0,valid
1418,Yu90DVEh3k4,PRANK GLOBAL BOT GOSONG DIHINA MISKIN BOCIL SONGONG SAMPE EMOSI GANTI BUNDLE EFDEWE DIA MINTA MAAP,2022-02-12T01:00:14Z,UCS1a9Q2__fjNt_8Wik0RFTg,357504,18892,754,0,0,Topic
1359,Y_URK07_YoI,GET FREE DIAMONDS❗FREE BUNDLES❗FREE EMOTES❗FREE GLOO WALL SKIN❗FREE GUN AND FIST SKIN❗IN FF TOOL APP,2022-02-06T07:09:25Z,UCPuoAQPlObpxqw5Oi6pXUfQ,499159,23030,751,0,0,Topic
622,_8GH1fOur3w,🔴  Viertel nach Acht – 10. Februar 2022 | u.a. mit Susanne Gaschke & Nena Schink |  | LIVE REPLAY,2022-02-10T20:20:19Z,UC4zcMHyrT_xyWlgy5WGpFFQ,144289,2791,735,0,0,Topic
1612,CZLmRomYgOI,ich REAGIERE auf den KOMPLETTEN KAMPF gegen LEON MACHERE!,2022-02-22T15:57:27Z,UCQ_hHJ0uTbzFLHrk1XHGXtw,252281,15984,730,0,0,Topic
1589,18vf7VSxoFo,E-Klasse mit schlimmen Geräuschen! 🙉 Motorlager? Getriebe?? | Zuziehhilfe im VW T5 kaputt!,2022-02-22T10:50:39Z,UCcnmNzv0yEEYPM6Oa86unhQ,272192,12899,723,0,0,Topic
1516,XM3sHp5MCes,KUMIS HYPER IS BACK AUTO BIKIN KETAR KETIR MUSUH!! ADA RUSTER DAN KAPTEN BARU??,2022-02-17T11:42:08Z,UCIWUnAI0GL4LDfCUeOOq7xg,227940,12504,713,0,0,Language
1143,#NAME?,Stress wegen Plastiktüte & Umwelt | Im Büro,2022-02-21T17:03:48Z,UC3zeNjvMawe1T2qXY-ttg4Q,61096,4019,698,0,0,Topic
286,am1RylcVklQ,TESLA TOTALVERSAGEN bei -17°,2022-02-20T09:00:01Z,UC3rz4cx41jWj7shRBTetzkw,147221,5649,694,0,0,valid
190,gefXuRB7mr0,Genesis GV60: Warum bei diesem Elektroauto alles besser ist!,2022-02-16T07:00:10Z,UCiZnK4X73okItJqaCs2YDOQ,114639,5602,690,0,0,valid
206,MGjL9tQa_40,Ressourcen für E-Autos reichen noch 11 Jahre. Was ist dran am Batterie-Problem?,2022-02-17T17:00:18Z,UCE2hJ9CYR57BYhk3TjGVG6w,99437,5104,686,0,0,valid
1573,EbK_d5phVDo,BÜYÜK 8 EL KEDI BAKIN NEREDE SAKLANIYORMUŞ - GTA 5 MODS,2022-02-20T12:00:05Z,UCz8lelVfalizvMb2bHQjDvg,288358,15420,681,0,0,Language
998,uyQ1wWlNPfM,Renault Megane-E: Kommen die Franzosen zu spät gegen den ID.3?,2022-02-18T15:59:12Z,UCiZnK4X73okItJqaCs2YDOQ,95449,4157,679,0,0,valid
14,EZ8Q3XbK1a8,E wie Ekelhaft? Tesla lässt Kunden im Regen stehen | Masse statt Klasse? Reaction auf @Maeximiliano,2022-02-01T17:49:24Z,UCGZLruV9OMz7JnmXz86ELdg,76005,3762,677,0,0,valid
129,NKpreE9gyjc,"nextnews: VW ID.Buzz Varianten, Jeder 10. Tesla fällt durch, Smart #1, Zulassungszahlen, Erlkönige",2022-02-11T17:00:14Z,UCgmB8S3f8-9dR8alVUZuZxQ,108186,4782,661,0,0,valid
1386,3qkWFMqhBlQ,JE TENTE LA COURSE LA PLUS DURE DE TOUS LES TEMPS SUR GTA 5,2022-02-10T17:00:02Z,UCcIuGZpsm6u6HWEdodskRIA,223702,14063,661,0,0,Topic
1519,YIERtmemCiA,MI POTENZIO PER DIVENTARE IL PIÙ VELOCE DEL MONDO SU GTA5!!,2022-02-18T15:30:09Z,UC1OGV4dczjRz8wNLRaezJ5Q,440210,19254,658,0,0,Language
1709,2qwVzRtn-QU,💥ATENÇÃO |  Uber MANDA AVISO SOBRE MÁSCARA...🙄,2022-02-27T18:31:48Z,UCIk8Z7iVqvf4H7rcyb9Ph3g,17491,1981,652,0,0,Language
1430,eSz1tD4MBiI,SHINCHAN AND FRANKLIN TRIED 3 DOOR CAR LAMBO LASER GIFTS PRIZE PARKOUR RACE CHALLENGE BY BIKES GTA 5,2022-02-13T04:15:00Z,UCXaFhaxwH3ASTgwwKL4Kt2Q,812700,22597,650,0,0,Language
1568,5WZttR5aRkw,Mutprobe mit dem Audi R8: Driften Matthias & Niki ins Meer? 😱 | GRIP,2022-02-20T19:00:04Z,UCak3selG2oi5vn7sbqdaULA,454412,16127,645,0,0,Topic
618,88vXkudstNQ,"Live-Interview mit Dirk Heidenblut, SPD",2022-02-10T15:11:27Z,UCNJxn7JS4saCHPsnD91yf9Q,36865,2586,642,0,0,Topic
1559,fx_mDSNQ17A,Mehr LEISTUNG ohne ENDSCHALLDÄMPFER? - Prüfstandstag Halle77 - MARCO nimmt EURE Autos ran!,2022-02-20T11:00:18Z,UCNhFsNZQfB2mdM1FoV6q1Kw,205627,9815,627,0,0,Topic
1743,34xRVHZH1Bc,RODAS NOVAS NO LADA SAMARA! LASANHOVISK,2022-02-28T22:00:11Z,UCw9XbJxYD920ZU9sIJ00WFA,103413,17213,627,0,0,Language
1032,t-FJcL1CKx4,Videoklau immer dreister - TikTok-Edition,2022-02-18T08:00:16Z,UCkQtzquQEQtE5wz4R-venIw,93261,5667,614,0,0,Topic
288,cs5eEdi8b38,VW ID. BUZZ: Alles was du zum Elektro Bulli wissen musst!,2022-02-20T23:00:10Z,UCgmB8S3f8-9dR8alVUZuZxQ,96102,3949,613,0,0,valid
1639,fJmyqSZTabo,Ukraine-Krise: „Energiepreis-Explosion muss verhindert werden“ | Nena Schink bei Viertel nach Acht,2022-02-23T12:00:31Z,UC4zcMHyrT_xyWlgy5WGpFFQ,41586,847,613,0,0,Topic
479,_fWwlharyWk,Neuer SPRUNG REKORD auf der XXL Skisprungschanze | BeamNG,2022-02-06T09:00:27Z,UCOzqhzAIw4JTJIMkDTfLnkg,312081,20047,608,0,0,Topic
1526,iVDDx4Ujg_Q,Opel-Zafira-Lenkung kaputt - Späne im Hydrauliksystem?! | Der Mercedes 123er wird abgeholt! 🥳,2022-02-18T11:15:18Z,UCcnmNzv0yEEYPM6Oa86unhQ,234872,11365,601,0,0,Topic
410,3IalVfKaNMk,E-Fuel | Zahlen Daten Fakten | Walter Röhrl hat Unrecht und das beweise ich hiermit!,2022-02-05T08:00:01Z,UC7FoJVkvzBr5Rp0YCB5tvuA,10223,1653,596,0,0,Topic
866,6N0maeDoGq0,Lucid Air: das bessere Tesla Model S? Review & Ausfahrt in der Elektro Limousine,2022-02-15T17:00:06Z,UCgmB8S3f8-9dR8alVUZuZxQ,69813,2624,590,0,0,valid
606,gfQDWkJzUw0,So KRASS rastet Justizminister Buschmann aus!,2022-02-10T16:55:01Z,UCqZSdUJqd2T0oqr6BEA3ONw,47052,5290,589,0,0,Topic
1583,#NAME?,ich GEHE zum BOXKAMPF von Standart Skill VS. Leon Machere! (VLOG),2022-02-21T17:02:33Z,UCqk9a9CE8ieYoLUDQdC1fgA,270749,20665,579,0,0,Language
1527,HNz1zs2HpLo,REPAIRING AN ACCIDENT DAMAGED 2017 FIESTA ST RED EDITION,2022-02-18T17:00:10Z,UCiGcuVR9bhKkRbz-Jb7RxKw,93689,8555,572,0,0,Topic
1492,r20H-L7PDzQ,DESTROYED 2016 AUDI A1 HAS MAJOR CHASSIS DAMAGE,2022-02-16T17:00:41Z,UCiGcuVR9bhKkRbz-Jb7RxKw,94625,8712,570,0,0,Topic
1554,Gip-c72D9-M,Nächste Gängelung: Wann kommt die FLEISCHSTEUER?,2022-02-20T16:55:00Z,UCqZSdUJqd2T0oqr6BEA3ONw,20989,2649,569,0,0,Topic
1734,Cok1w0_2tJ4,LUDI DEDA DOSAO U GRANNY 1,2022-02-27T19:12:08Z,UCHop-Cqasg87BhKZ3MeRa6w,80451,4948,565,0,0,Language
1239,539dVTELJjM,"Tesla Model S Plaid Test: „Der Powerhammer!""",2022-02-25T18:14:11Z,UCqtBzOjVW0aLVZHaRYu7dpQ,69506,2796,560,0,0,valid
1574,jWcYhOZUPD0,ESME GOLDLANDE SUPER IMBA??? PINTER BGT DRAFTNY EVOS GOKILL!! EVOS VS AURA MATCH 3,2022-02-20T13:01:03Z,UCirWugW5e03u3DUGA87s58A,1155353,18288,558,0,0,Language
1687,1nQV2UpBJ9c,JE DECOUVRE MA FUTURE VOITURE DE DRIFT ! - Projet Drift #1,2022-02-26T10:04:03Z,UCUl7mwOyySfZzUkq4H29nug,531220,42488,558,0,0,Language
276,BD1AgNpvkrc,7 verschwundene Automarken - kennt ihr die noch? I auto motor und sport,2022-02-19T08:00:04Z,UCLINPbYQ9sy6qc-TqtBeVnw,107283,2293,556,0,0,Topic
1707,4ZZwdyqSjm0,GÄNSEHAUT bei 7800 RPM! - Prüfstandstag Halle77 - MARCO nimmt EURE Autos ran!,2022-02-27T11:00:02Z,UCNhFsNZQfB2mdM1FoV6q1Kw,208749,9943,554,0,0,Topic
1604,dFiYKigr0wU,Ach du Sche****e!,2022-02-22T17:00:20Z,UCs1s3x2Ne_GB-2SWaPSmGeA,80630,5604,548,0,0,Topic
403,LpAorxlcWis,Katastrophen Roadtrip: Kälteschock im Tesla Model Y,2022-02-05T11:00:08Z,UC3rz4cx41jWj7shRBTetzkw,142356,4874,546,0,0,valid
1440,rFxuHe13oOs,Cadillac Coupe DeVille - DOWNSIZING like a BOSS! Hier ist weniger immer noch MEHR,2022-02-13T08:00:15Z,UCdF4z_2Q02q81AK-Xq2_5Rg,88120,2736,542,0,0,Topic
1489,L_7MWlQYmCo,Welches AUTO ist STÄRKER in GTA 5?,2022-02-16T13:03:28Z,UCaR5mgH9aZkswPQtjZ4DktA,433351,18650,537,0,0,Topic
945,xoJtNAyktsE,Katze im Interview.,2022-02-16T18:00:22Z,UCw81xLtFkpks4D8_hYUP9VA,293659,27221,535,0,0,Topic
1252,YLyCAFt_ZOg,Wutrede 😡 Geschäftsführer packt aus: Model S Fahrer zieht miese Nummer ab,2022-02-25T18:00:12Z,UCBCT7EV5YrNLPvrhXYTHJuw,78479,3836,535,0,0,valid
1557,Py7q_o_Pm-U,LASER DA 1€ VS LASER DA 1.000.000€! - MINECRAFT,2022-02-20T12:30:06Z,UCvDUogE-9kyjbKxxyBGj_4g,411524,20429,534,0,0,Language
1190,M1M5cj0O8Ak,Verzichten und Verbote wegen Klimaschutz? | Harald Lesch im Gespräch mit Dr. Björn Sörgel,2022-02-23T14:00:08Z,UC5E9-r42JlymhLPnDv2wHuA,63419,2748,533,0,0,Topic
1447,DQgB6MeMybg,BMW E46 M3 DOKU Folge 10 - Das FINALE!,2022-02-13T17:00:07Z,UCH2qEpwlSWYK7fou3UZ4RjA,159074,9250,528,0,0,Topic
1279,WDGP-0kZL2A,GLÜCKSRAD entscheidet ALLES in GTA 5 RP!,2022-02-26T09:07:29Z,UCaR5mgH9aZkswPQtjZ4DktA,337447,15839,527,0,0,Topic
1721,lS-FTsJuu6U,"gestörte Überholmanöver, Close Calls, Geisterfahrer & Brake Checks | #GERMANDASHCAM 037",2022-02-27T11:18:11Z,UCD_02Fo2YBzXRvIgTKUyxwA,84536,3925,518,0,0,Topic
1356,NjHj6Hf2APA,CREO L'ANIMALE MUTANTE HACKER DA 1.000.000€! - Merge Animals,2022-02-05T13:15:00Z,UCpyDd4YbikHZE-DtNGfpdjQ,261014,14944,517,0,0,Language
1674,kpeE0dJ3XjU,EVIL GHOST TRAIN ATTACKED SHINCHAN AND FRANKLIN in GTA 5,2022-02-26T06:30:15Z,UC7ym_TycBuUsCZVhguovu7w,405823,19987,516,0,0,Language
711,CUhwakSNMG0,Das sind die 7 saubersten Autos Deutschlands - welcher Antrieb ist der beste? I auto motor und sport,2022-02-12T08:00:08Z,UCLINPbYQ9sy6qc-TqtBeVnw,39886,964,511,0,0,valid
1381,hU3qhyuqtAw,FOMOS ASSALTADOS🤬 (1 HORA),2022-02-10T21:00:15Z,UC08IZDh4NSFHl8KYpYNdoVg,97272,8418,499,0,0,Language
1549,rZwA06o3DQk,GTA 5 : PRESIDENT GIFTED MILLION DOLLAR MANSION & SUPER CARS #17 || BB GAMING,2022-02-20T06:30:09Z,UCMuXGzMQX65XcPs-zC5P39g,227940,18298,493,0,0,Topic
1383,MTVybcnSb7E,Welches AUTO schafft die EIS RAMPE in GTA 5?,2022-02-10T13:06:49Z,UCaR5mgH9aZkswPQtjZ4DktA,528300,20725,490,0,0,Topic
1495,06FPbAkrbUY,DNK EMISIJA // NAJNOVIJA EPIZODA // ZAJECAR // (16. 02. 2022.),2022-02-16T23:15:00Z,UCmIhdS5iCL1Gdb6GVy4HKKA,195237,1065,488,0,0,Topic
1626,nnjroruPVDk,die *NEUEN* AUTO MODS KOMMEN! in Fortnite,2022-02-23T13:15:54Z,UCQ_hHJ0uTbzFLHrk1XHGXtw,273836,13135,488,0,0,Topic
1647,bEG1os2D4Bk,Breitbau Benz fährt nicht mehr an (500km nach Kauf) was fehlt dem Getriebe?,2022-02-24T10:01:09Z,UCkeQaTKHKmRnWmXnl0uIuSA,160677,10178,483,0,0,Topic
179,MHGcbYSt3Wc,Tesla Supercharger für alle? Wir haben es ausprobiert mit dem Mustang MachE #elektroauto,2022-02-16T13:30:44Z,UCVUBc0WF5X-w3T8s6Wyx-jw,14938,1111,482,0,0,valid
348,nGum6B1rC78,Was sind Bitcoin's größte Herausforderungen? Interview mit Entwickler René Pickhardt 1/2,2022-02-02T16:00:33Z,UCeARcCUiZg79SQQ-2_XNlXQ,107445,4371,480,0,0,Topic
1578,ulJkk7gdvYo,How KR Challengers Use Renata Glasc,2022-02-20T21:13:19Z,UCqdMVHk4aR6MWlaJOullI_Q,317834,5892,479,0,0,Language
1412,pDspR2jWux4,Turbo-Gockel - kundenstories des todes Teil 1,2022-02-12T21:23:34Z,UCF-V1abRHGUTbm3RZq6S7uw,59088,3171,476,0,0,Topic
1338,xcnDXHDfBpI,Putins Krieg und unser Öl und Gas,2022-02-28T14:30:17Z,UCEPZNMjVXBALuPZNKNua5Hg,28664,2876,471,0,0,Topic
260,IorgUhxs7kY,Das Elektroauto ist nicht nachhaltig! Kriege und Ölkatastrophen sind besser! Es lebe die Zapfsäule￼,2022-02-19T08:00:05Z,UC7FoJVkvzBr5Rp0YCB5tvuA,8286,1585,470,0,0,valid
1697,xaTxsSIhCzU,Nur DACIA ist schlechter! Jeder zehnte Tesla fällt beim TÜV durch,2022-02-27T08:00:16Z,UCXpvI8jeu166he5e_Emo2ig,18852,1902,469,0,0,Topic
