video_id,title,published_at,channel_id,view_count,like_count,comment_count,job,id
z8xb61CQLGM,Tesla öffnet Supercharger Ladenetzwerk für Elektroautos anderer Marken - Spinnt Elon Musk ?,2021-07-21T14:00:11Z,UC0ft_Y8ijB7zGNxfz-VS88A,2233,203,36,0,0
7-VJsjVuof0,Auktionsmodell steuert Strom Engpass | BEE gegen Abschalten |,2021-07-21T12:14:46Z,UCaCaZ-vKtnMG2_FKmEePChQ,3259,277,110,0,0
BunlHTeNkzA,"IONIQ 5, KIA EV6 und Nissan Ariya Vergleich | Was der Ariya besser kann!",2021-07-21T15:00:05Z,UCDDj2GWklzZ09X7R9OtsX3Q,25907,648,91,0,0
8oVrkJMkWZU,Cybertruck & Roadster in PUBG / FSD jetzt als Abo / Freies Supercharging Hochwasser / Gerüchteküche,2021-07-21T12:27:15Z,UCP1ZmU7-oVi8dMhbCEbAD3Q,3575,448,47,0,0
mL5sKzfApTE,9 Tipps zur Wallbox in Österreich 🔌⚡️🔋,2021-07-21T11:49:07Z,UCEBVLmbktG5c5_FK3BSJrkg,1377,68,26,0,0
LkKxdNCVRKo,DAS musst du über WALLBOX-UPDATES wissen!,2021-07-21T18:44:02Z,UCUYT5ThWuRNWAbV0nul7EGQ,2158,62,4,0,0
8Y1i2J9zfHw,Nachhaltige Versicherungen finden: Was bringt das?,2021-07-21T15:00:09Z,UCO5j2t3tvsPtef3iq9k5yTQ,742,69,5,0,0
EWugJWRGflQ,Analyse: Tesla öffnet Supercharger für ALLE. 3 wichtige Vor- + Nachteile für Tesla- + E-Auto-Fahrer,2021-07-21T17:00:18Z,UCSwRhu8CeHVXZlG1ExdjuTQ,22606,1131,471,0,0
64QhrvUtKrk,Audi Q4 e-tron | Was kann der Innenraum? – präsentiert von Yello #SHORTS,2021-07-21T15:01:00Z,UCWDzQTt1RWZD1AtkV76CIBA,10298,206,23,0,0
iOiGpGT5ijg,"eMobility update: Lucid kommt 2022 nach Deutschland, Tesla Supercharger, E-Auto Bilanz, S-Klasse.",2021-07-22T10:00:12Z,UC_vO01sSD25a73DhoaxtZTw,7792,443,42,0,0
hs3XDOzB4xE,Hochwasser und Klima: Wie kann die Politik Katastrophen verhindern? | Markus Lanz vom 21. Juli 2021,2021-07-22T06:34:24Z,UCeqKIgPQfNInOswGRWt48kQ,348378,5271,6609,0,0
HttiY4ggZKs,2022 Mercedes VISION EQXX | 1000 Kilometer Reichweite | Verbrauch von unter 10 kWh auf 100 km?,2021-07-22T13:54:04Z,UCxmohYAjhc2qD5pYIOwQ3bA,6589,162,22,0,0
VjL0xpTTrFM,"Einen Monat lang nur öffentlich laden, 1Tag und schon ein Desaster!",2021-07-22T16:00:16Z,UCua87-Wr29nGhVLzZrN2e_g,7142,430,80,0,0
CVicC4VhG68,"Breaking Elektro-News: VW feiert Absatzrekord, SHELL baut weiter aus, ICCT räumt mit Mythen auf, etc",2021-07-22T05:00:07Z,UCsNdsFTTBj5jcRJSWeJ8-Xg,7256,661,151,0,0
YL4RNIMG-mY,Citroën Ami IMPORT aus FRANKREICH | Eric kauft ein Mikro E-Fahrzeug,2021-07-22T12:22:49Z,UCaCaZ-vKtnMG2_FKmEePChQ,9508,645,329,0,0
UkjXl18-Gqc,"MostActives: Daimler, Volkswagen und CureVac - die meistgehandelten Aktien des Tages.",2021-07-22T14:23:06Z,UC62IIFhchBWQxLPSyUatD-A,5422,125,6,0,0
VOy6fVfStYs,Tesla SuC LadeNetzwerk | Elon Musk sagt | Freigabe für Andere bis Ende des Jahres Tweet v. 21.7.21,2021-07-22T10:32:27Z,UCf6kkAGiOV_azeGaZ_gKVLQ,471,61,32,0,0
HHE3VbrNsYY,Autonomer Laderoboter für E-Fahrzeuge,2021-07-22T06:00:06Z,UCpPLUyImrCqB7WtMLovhaVw,2008,18,3,0,0
F6Pr3hWuZe4,"nextnews: Supercharger für Alle, Mercedes EQG, KIA EV6, Lucid Air, IONIQ 5, Tesla & VW Fantreffen",2021-07-23T16:00:17Z,UCgmB8S3f8-9dR8alVUZuZxQ,86218,4161,729,0,0
zzzRLcmS7Yw,Warum FÜR MICH der Hyundai Ioniq 5 keine echte Alternative zu Tesla ist!,2021-07-23T16:00:40Z,UCua87-Wr29nGhVLzZrN2e_g,12996,278,427,0,0
UWFmL2NC5eo,Tesla Model Y oder Model 3 - EXKLUSIVER Vergleich: wie anders ist der große Bruder wirklich?,2021-07-23T15:00:30Z,UCaTyFx9Llt5nQRAFjZyowow,48709,1193,91,0,0
B0WxRBoHD4g,"STAT E-STICS #28 | IONIQ 5 N, VW ID.8 und Supercharger Öffnung für alle Elektroautos",2021-07-23T15:30:02Z,UCDDj2GWklzZ09X7R9OtsX3Q,9646,523,52,0,0
OdeqDF6AO1E,Tesla Model 3 im Service - Warum schon jetzt? Termine via App... [Deutsch 4K] | Vision E Drive #117,2021-07-23T16:00:16Z,UCDMd4FzBxxKD5yAeeLStU6A,2011,143,11,0,0
mJRsR7R9PKE,"eMobility update: Daimler ab 2025 nur Elektro-Plattformen, Kia EV6 Reichweite, Fisker, Laderoboter.",2021-07-23T10:00:12Z,UC_vO01sSD25a73DhoaxtZTw,9242,642,32,0,0
ycqOdYslC68,Mercedes baut nur noch Elektroautos,2021-07-23T11:24:14Z,UCjI-AAeydw_6l2YWK_5hMPg,1267,158,52,0,0
gyPf6NDNbzs,So geht China SUV - Der MG ZS EV im Test,2021-07-23T16:30:04Z,UCoJ9ql-WffntQ5Pa8SdkllA,4999,293,69,0,0
eDH7NxygS3o,Die RÜCKLEUCHTEN die ein TESLA MODEL 3/Y unbedingt braucht! | EFIEBER,2021-07-23T16:00:23Z,UC7yTmxTaRki-3qVGF14Tchw,12461,502,127,0,0
2Lhshg-pIfk,"Darum sind PS5 und Co. immer ausverkauft - Kein Chip, kein Gaming! | Galileo | ProSieben",2021-07-23T10:30:01Z,UC1XrG1M_hw8103zO2x-oivg,714737,12978,1202,0,0
R8fnRXckAF0,Tesla ModelY und Model3 steigen im Preis wegen großer Nachfrage Tagesthema Elektromobilität Nr.404,2021-07-24T08:00:06Z,UCHuXYLIv70fPKK9c60TwLQw,458,32,5,0,0
0pOycctZIas,Ich habe ein Elektroauto gekauft,2021-07-24T07:00:10Z,UCM1jNA8DM90LE4ywxBe8RmA,196932,10044,1238,0,0
pkj3eV97bUM,"Elektromobilität der Zukunft, ist das Original der E-SCOOTER von RENAULT SPORT R.S. 🇨🇵 💯%🔌🔋.",2021-07-25T14:38:20Z,UCC3n8LdLYWVMordmvhuKunw,1266,14,3,0,0
6JLAF4XFO2c,Große Tesla Model Y Probefahrt! Kaufe Ich Es?,2021-07-25T14:21:14Z,UC3rz4cx41jWj7shRBTetzkw,99474,2838,494,0,0
_DMmVkulXb8,Die ENERGIEWENDE wird auf dem Land GEWONNEN | Nur wie? | Elektroautos auf dem Land,2021-07-25T18:28:24Z,UCaCaZ-vKtnMG2_FKmEePChQ,5411,435,140,0,0
x4PidbP-MfM,800 KM Roadtrip im Ford Mustang Mach E. Navigation gegen Realität! Elektroauto auf Langstrecke.,2021-07-25T07:00:15Z,UCVUBc0WF5X-w3T8s6Wyx-jw,24694,1021,319,0,0
lzbHOuHED98,Der neue Audi Q4 e-tron (2021) - Premium Elektromobilität für den Otto-Normalverbraucher?!,2021-07-26T16:00:21Z,UCMi3DqL0ewpQU4dMOIsNSmw,10412,142,45,0,0
MhZ0xBLSSPY,Fiat 500 e Probefahrt by Cardu #elektroauto #elektromobilität #autotest,2021-07-26T11:54:33Z,UCYJok3-jduG8OWvJE05c5mA,2575,59,10,0,0
Rw64xatqVGA,Auf der Überholspur - Teil 2 | Gesundheit unter vier Augen (mit Marvin Wildhage),2021-07-26T15:02:50Z,UC9omlD6tmpOu3dBIvmQGsIw,10727,59,23,0,0
QhCLb8vu-CY,2022 BMW CE 04 Elektroroller Leistung Reichweite Preis Electric Drive News,2021-07-26T12:14:39Z,UCxmohYAjhc2qD5pYIOwQ3bA,15215,138,52,0,0
YRY3H6e2P_E,514.000 km Batterie (SOH) Test | Wie lange hält ein Elektroauto?,2021-07-27T15:54:07Z,UCDDj2GWklzZ09X7R9OtsX3Q,57280,1250,177,0,0
SQq89Q56gZY,"Polestar 2 billiger: neue Varianten, mehr Förderung, Fahren, Laden, Reichweite, Kaufberatung",2021-07-27T15:53:14Z,UCgmB8S3f8-9dR8alVUZuZxQ,88855,2854,455,0,0
kSnTJGQRxtw,Die erste Wallbox von BMW! PV-Überschuss für i3 und i8 :),2021-07-27T16:00:20Z,UCMlirlzQIUpfb3uC5LXB17Q,1183,68,6,0,0
Swx80BH8iSo,Elektrische Paketlieferung der Zukunft - DIE Lösung für Großstädte,2021-07-27T16:00:14Z,UCBc0Mghy-6jhMXs3T7DluMg,5303,408,28,0,0
n6_gmtvN440,"BWM, Daimler, VW: Wer macht das Rennen an der Börse? Corona, E-Mobilität & Halbleitermangel im Fokus",2021-07-27T12:21:52Z,UC62IIFhchBWQxLPSyUatD-A,3780,75,7,0,0
84H1ZsHRNto,Wie geht’s nach fast 2 Jahren Tesla Model 3 jetzt weiter mit mir?Wechsle ich wieder zum Verbrenner?,2021-07-27T21:19:26Z,UCf6kkAGiOV_azeGaZ_gKVLQ,1164,80,17,0,0
ocRbZ9poyWs,Volkswagen:  Kursziel 542 Euro?,2021-07-27T16:00:31Z,UCh2gY-BOw1DBxBoojRiqZjQ,21392,961,143,0,0
71gaSV-cSPc,Die klimaneutrale Bio-Mühle - Klima-Klartext mit Jan-Peter Bauck,2021-07-27T11:31:08Z,UCn2SJYKWGfZpwu7VM94vljA,40822,12,1,0,0
Qs9HdppsGDc,News - Volkswagen ID. Buzz - Erscheinungsdatum und Varianten,2021-07-27T12:00:25Z,UCsFn3MVZBT1_GWFzgv4QF3A,16832,238,80,0,0
p00RrSCoVbo,"TSB - eine hochmoderne Magnetschwebebahn ""Transport Systems Bögl"" für Personennahverkehr",2021-07-27T07:27:51Z,UCHYMHoub67-inj2PvGclBqQ,12121,213,43,0,0
kmqvQqPMMMo,VW ID Buzz soll im 3 Quartal 2022 ausgeliefert werden Tagesthema Elektromobilität Nr.405,2021-07-28T15:00:25Z,UCHuXYLIv70fPKK9c60TwLQw,509,19,2,0,0
7K_tLGWfl6o,E-Außenborder - AQUASPIRIT 290,2021-07-28T17:00:08Z,UCZ_eZbKmHWaJHhH_rba7PwQ,5663,108,29,0,0
OwHj_b5W9LQ,VW - ID3 Urlaubsfahrt - Langstrecke mit 3 Kindern,2021-07-28T15:25:04Z,UC8iUkbpq4PsqwMIWN-A-p7A,8866,259,62,0,0
sDkaV6O7AAE,Audi Q4 e-tron vs VW ID.4 - welcher passt zu dir? Vergleich der vollelektrischen SUV's,2021-07-28T15:00:27Z,UCfJVwZuVVxVMYxv04JQumyg,32197,227,38,0,0
5vgc8M6uElk,Fiat 500 Elektro | Elektroauto Ladestationen & Langstreckentest – präsentiert von Yello,2021-07-28T15:00:18Z,UCWDzQTt1RWZD1AtkV76CIBA,2206,111,18,0,0
3AS8hpafThQ,Geladen-Podcast: E-Lkws mit Batterien oder Wasserstoff?,2021-07-28T10:48:30Z,UCjlQUYxw7yjLuq5wTcJE-yA,12341,328,68,0,0
pYf8pRQGqEo,Audi RS e-tron GT im Alltagstest (2021) So GUT ist er wirklich! Fahrbericht | Review | Sound | Preis,2021-07-28T16:42:28Z,UCy9Y4en2y1eR1zwcmFkRMzg,34219,568,114,0,0
4ROHLmwhvdQ,Bremsenkühlung Tesla Model 3 Performance,2021-07-28T12:20:47Z,UC06b2SP4qTRaMXsql19sDkA,312,9,4,0,0
iszTb6GnF1g,Innenraum Check vom VW ID.4,2021-07-28T23:47:24Z,UC4jlxSJSd4Sha7AkroyE_CA,4833,27,21,0,0
apEiUaaK4HI,Herbert Diess Zu Wasserstoff in PKWs,2021-07-29T11:19:28Z,UCAaaKsm32m2vaoaGWXXGszw,11128,233,41,0,0
MIQCqaRvtS0,Wie bekommt man einen schwarzen Innenraum eines Tesla Model 3 weiß?,2021-07-29T18:43:34Z,UCf6kkAGiOV_azeGaZ_gKVLQ,522,31,16,0,0
cKgXLcHPh2M,Breaking Elektro-News: Tesla schwimmt im Geld! Deutschland Elektroauto-Pionier? SUC wir kommen!!,2021-07-29T05:00:11Z,UCsNdsFTTBj5jcRJSWeJ8-Xg,6809,597,129,0,0
1T7P-4-fQXw,Markus Söder: Impffreiheiten und Unionswahlkampf | Markus Lanz vom 28. Juli 2021,2021-07-29T06:26:30Z,UCeqKIgPQfNInOswGRWt48kQ,322659,2019,5765,0,0
LCGclfITkQ0,250.000 Kilometer mit dem Elektroauto: HYUNDAI-Fahrer rechnet schonungslos mit Elektromobilität ab!,2021-07-30T18:58:04Z,UCsNdsFTTBj5jcRJSWeJ8-Xg,83574,2014,500,0,0
9LnvcpjeQiE,Die Autolobby wollte mein Buch über Tesla verhindern! - Mein wichtigstes Video des Jahres!,2021-07-30T18:20:29Z,UCrt6X6pXNRl5rRxaKbzCrvw,59655,3283,741,0,0
L41xoCEfk14,Synthetische Kraftstoffe – Haben Verbrenner eine Zukunft?,2021-07-30T16:30:05Z,UCZOM0CqaJ5njZB_O-RyQSsw,19702,445,310,0,0
ZXfWVKA3YCY,"nextnews: Stau an Ladestationen, E-Wohnwagen, Supercharger Öffnung, Tesla Rekord, Mercedes EQ, Audi",2021-07-30T16:00:30Z,UCgmB8S3f8-9dR8alVUZuZxQ,101419,4229,710,0,0
gO31zfl-BTM,Warum ich mich gerade schäme Audi zu fahren und meine erste Flutopferspende,2021-07-30T15:00:32Z,UCddkvrnYqGRfODPMUQqisiw,22410,1372,345,0,0
VF8y57ZtwoQ,"STAT E-STICS #29 | Neue Elektroautos an der Börse, Tesla App, Toyotas und Alfa Romeos E-Auto Pläne",2021-07-30T15:30:05Z,UCDDj2GWklzZ09X7R9OtsX3Q,4828,360,20,0,0
k4TmqZHr4So,Photovoltaik & Wärmepumpe sinnvoll? | Gesamtlösung Eigenheim elektrifizieren | Wort zum Freitag,2021-07-30T13:00:23Z,UCaCaZ-vKtnMG2_FKmEePChQ,3300,408,172,0,0
I0SWmQ6jatM,Lohnt sich Schnelles Fahren mit dem Tesla Model 3? - Testfahrt [Deutsch 4K] | Vision E Drive #118,2021-07-30T18:41:40Z,UCDMd4FzBxxKD5yAeeLStU6A,4442,214,98,0,0
ORLH2wMl6Cg,DARUM MIC TESLA MODEL Y BESTELLT! ALBATROS VERKAUFT! KEINE 4680 ZELLEN! | EFIEBER,2021-07-30T16:00:14Z,UC7yTmxTaRki-3qVGF14Tchw,4815,245,104,0,0
Rs9Ngt90YFc,"Neues Tesla-Patent, Vorteil durch Batterie-Revolution bei CATL?",2021-07-30T15:02:16Z,UCpPbcfwq0wOpWrC0gBs73tQ,11232,615,59,0,0
TI8QFxJU7sE,"Fazit: 16.000KM im Elektro Porsche Taycan. Reichweite, Verbrauch, etc...",2021-07-30T16:18:32Z,UCqtBzOjVW0aLVZHaRYu7dpQ,53462,3034,389,0,0
eB5Z6cZaZhA,Mercedes EQA 250 im Test - Die Alternative zum ID.4 / Enyaq / Q4 - mit Stern,2021-07-30T11:30:15Z,UCbe4BpM5-Ta7MIlbKOofTDA,25080,714,118,0,0
AtGomMXL6kY,Daimler Aktie -  Es wird KNALLEN die nächsten Monate!,2021-07-30T15:27:32Z,UC3AdN1bEmEonuSwXNS8LixQ,22802,1893,151,0,0
AM4iilTgxeE,"Öffentlich laden Tag 3, Überraschende Probleme",2021-07-31T08:00:02Z,UCua87-Wr29nGhVLzZrN2e_g,6304,328,102,0,0
oxnB_NwWGxw,Audi Umbau zum Elektroauto! Alternative zum E-Fuel? Audi A2,2021-07-31T15:49:10Z,UCWU0WKigqlBZmBcrkcHQlog,8283,203,74,0,0
691jH6sn2Bk,Das erste Mal im Elektroauto - Drei wesentliche Unterschiede zum Verbrenner,2021-07-01T15:26:37Z,UC0cCZpU5Ioj1FOuIzj7cSsQ,1432,40,2,0,0
AOX27MLho2Y,"Vier Elektrofahrzeuge im Vergleich: Tesla, VW, Hyundai, Peugeot",2021-07-01T16:17:37Z,UCQb7WApzFlBztHZkYmy2UTA,13749,130,21,0,0
O8P8HojX4SE,Hyundai IONIQ 5 - Elektroauto Reichweiten-Härtetest bei 130 kmh - inkl. einer Hammer Ladekurve,2021-07-01T14:00:10Z,UCd5Jpd5473VPhNjdWMUP6tw,144085,3412,619,0,0
YHflhAVkLlM,Das erste Solar Car - Antrieb durch die Kraft der Sonne | Galileo | ProSieben,2021-07-01T10:30:11Z,UC1XrG1M_hw8103zO2x-oivg,160047,4872,966,0,0
2EvbVSgGpmU,Laden ist das neue Bremsen - Elektroautos und die Magie der Rekuperation erklärt,2021-07-01T15:26:48Z,UC0cCZpU5Ioj1FOuIzj7cSsQ,721,40,5,0,0
Qz9MNBXb7lg,Hyundai Ioniq 5: Die Alternative zu Tesla Model Y und VW ID.4 im Test | Review | 2021,2021-07-01T16:00:24Z,UCUKYv9dpFAbuLNWIgxuQQBA,28141,565,89,0,0
XARGpjfc86c,Bestellen aus China jetzt sinnlos?! EU streicht Steuerfreigrenze: DAS musst du wissen!,2021-07-01T13:02:38Z,UCHbcbgxdWJittda3pg0QK5g,50462,1605,520,0,0
QDRVRsJ8Mb0,Smart Home & Energiemanagement im Gebäude! Besuch Schneider Electric Teil 4!,2021-07-01T16:00:18Z,UCMlirlzQIUpfb3uC5LXB17Q,1116,70,15,0,0
vTf5p38_olo,TOP 4: Die Besten Elektroautos für Kinder 2021,2021-07-02T16:15:01Z,UCWrDr5bR_0ztjRZqsFRH5Lw,17379,74,8,0,0
B8_uo-6feiQ,Das beste Elektroauto der Welt?! der Hyundai Ioniq 5 2021 | Kurzvorstellung des Ioniq 5,2021-07-02T13:37:38Z,UCBTJnSirNI8kwOn5ROB_BGA,4636,115,33,0,0
CJeMsME4P5k,Ein Tesla war nach 10 Jahren Elektroauto unausweichlich - T&Emagazin Innovator Interview,2021-07-02T15:00:04Z,UCqQGYPEU7DiNA6bUUmehb8g,4425,366,57,0,0
YI0X8tPE4Nk,E-CANNONBALL 2021 - wir sind mit unserem Elektroauto Renault Zoe Z.E. 50 R110 dabei,2021-07-02T17:30:25Z,UC-k-5F2j4CUzuwkx1QLRlpA,1347,128,56,0,0
tOsP1-ROpfc,Es gibt Neuigkeiten: Mein neuer Rimac Nevera! | Nico Rosberg,2021-07-02T16:12:04Z,UCQLR0alN3qKWm_7zPDoqOZA,77350,2507,273,0,0
XGxAefLkiqI,Geht gut: Camping E-Dreirad oder E Quad 20 km/h. Krankenfahrstühle 2021 für Camping oder den Alltag,2021-07-02T23:45:00Z,UCX1oID0GF9NKfDvB4j0l2-Q,5737,78,5,0,0
xsKWZ7WQ9pc,Wie gut ist dieser ferngesteuerte LAMBORGHINI?,2021-07-02T16:15:01Z,UCPFhnt7T8iaBLp1wIfFRzFw,101139,5071,256,0,0
BngeH4cwyYI,Zum 50. Geburtstag modernisiert – der Opel Manta | hessenschau,2021-07-02T18:26:52Z,UCPhsnKyNcH3huafz_wNG_5A,6866,40,7,0,0
Z7W-gu3c_GI,"Opening Bell: Alphabet, Tesla, Microsoft, CureVac, Didi, Alibaba, Pinduoduo, Virgin, Krispy Kreme",2021-07-02T13:23:35Z,UC62IIFhchBWQxLPSyUatD-A,23769,546,46,0,0
8CON135GDr0,"5 Dinge, die Du niemals mit einem Elektroauto tun solltest",2021-07-03T06:00:02Z,UCwHAKOZnvsOoUPH3BRYD74A,1851,90,9,0,0
IAHSObdcuI4,Nachhaltig Elektroautos laden bei den Turmöl-Tankstellen,2021-07-03T16:41:53Z,UC2xJQ4GUV9zVrAaYinVmpdQ,330,17,1,0,0
zTMFhOYu_7Q,Tesla S-Kurven Wachstum hat begonnen!,2021-07-03T17:12:08Z,UCpPbcfwq0wOpWrC0gBs73tQ,5744,416,21,0,0
eQbOQkVxiKQ,Der neue VW Caddy *90kW* TDI - Würde ich ihn kaufen ?! | Test - Review - Alltag - Familie,2021-07-03T07:00:08Z,UCETmLeBpDeXIFyNbRV_Kblg,26173,251,86,0,0
8q7GnRfYsTY,DIY Fahrrad Wohnwagen - Etappe Kinzinger See bis Raunheim,2021-07-03T15:15:41Z,UCZ7TsNtEyawJ-5gIkBiNItg,2491,122,30,0,0
Tw7xVhrj4s0,Elektroauto mit Handschalter! | BLECH REDEN,2021-07-04T15:00:11Z,UCutQkZpAs9xG0KaooZlnuTw,4148,108,13,0,0
nAOgDnDtgFA,Dacia Spring Elektro erster Rundgang günstigstes Elektroauto?,2021-07-04T18:33:03Z,UCogPyel5zmcX7dRP88vY9lA,777,21,5,0,0
Y6uFMgwzKoA,5500km Italien Elektroauto Roadtrip TEIL 2: Amalfi nach Sizilien 2021 Kia eSoul 64kWh Urlaub Familie,2021-07-04T18:54:57Z,UClLNojsTUBXWG6-drvyLzlw,7910,416,66,0,0
wQJeFCLfURs,Der LADEKAMPF für Elektroauto-Besitzer!,2021-07-04T14:58:34Z,UCpPbcfwq0wOpWrC0gBs73tQ,9553,455,62,0,0
jcDqpC1gbKE,Längste E-Rally der Welt / Schweiz Roadtrip - Teil 1,2021-07-04T16:00:30Z,UC7TNpcHppLhhnCUEi02zRaw,497,12,5,0,0
jsyyQGsdG0Q,"Drachenlord Stream 03.07.2021 (ZUSAMMENFASSUNG) / Mag Eis, aber nicht Elektroautos (Gegen Mobbing)",2021-07-04T14:03:32Z,UCeJvrXLRua3_OFGNO92Mi_g,19688,638,362,0,0
JI9LIGas_gk,"Ioniq 5, Q4 eTron, iX3, MachE und Enyaq im kompakten Vergleich",2021-07-04T16:00:19Z,UCoJ9ql-WffntQ5Pa8SdkllA,57146,1109,209,0,0
wY4j6I20Gf0,Vollhybride im Vergleich: Renault Clio E-Tech 140 vs. Suzuki Swace - Renault zu kompliziert?,2021-07-04T09:15:01Z,UCzJRFZ6bPilw1W5_l9DKetw,8548,67,33,0,0
CBhY6OSKf58,⚡ Tagebucheintag #160. Roadtrip zu den Festspielen in Bad Hersfeld.,2021-07-04T14:00:08Z,UCMZbix9CwEuL6l9SJIb2Zxw,1003,71,13,0,0
AGQgrQoriA0,Veli leiht uns sein Elektroauto bis unser Ford MachE endlich da ist! Was für ein toller Kerl 👍,2021-07-05T15:34:59Z,UCVUBc0WF5X-w3T8s6Wyx-jw,3203,359,113,0,0
T13iyGUeOxo,Gibt es Elektrosmog bei Elektroautos? - #endlichmontag [Deutsch 4K] | Vision E Drive #113,2021-07-05T16:00:12Z,UCDMd4FzBxxKD5yAeeLStU6A,784,94,14,0,0
7c2QOquqVt0,Maxus eDeliver 3: Elektro-Kastenwagen aus China im Test | Review | 2021,2021-07-05T16:00:03Z,UCUKYv9dpFAbuLNWIgxuQQBA,6966,199,20,0,0
IVO_qJKtLiM,Erster vollelektrischer Volvo: Wie gut ist der XC40 P8 Recharge? | Motorvision Deutschland,2021-07-05T14:00:11Z,UCrPoTKfvNvJhG1Ngf6jHB1w,4932,39,6,0,0
oc6v85qqnyE,Großes VW ID Software Update 2.3 - Exklusive Einblicke,2021-07-05T06:00:07Z,UCBc0Mghy-6jhMXs3T7DluMg,35327,1046,263,0,0
-hzt4R4FECo,"Energiespeicher LUNA2000: Kompakt, modular und schlank",2021-07-05T21:36:51Z,UCY_wZURqdlLBPc5YuXTMnmg,13121,111,26,0,0
VgV8ODB3TnY,ROUTENPLANUNG mit LADESTOPPS: Grosser Navitest im VW ID.3 mit ID.2.1,2021-07-05T09:30:07Z,UCHeWtVw_wNCUZkzc5wif2FQ,6017,157,43,0,0
6bxRT6U13mk,DAS BESTE Lieferfahrzeug unter 6.000€ fürs Restaurant Asado! 🚗🍗😋  | Gebrauchtwagen-Kauf mit FoxWagen,2021-07-06T18:00:01Z,UC7YfBseBcW3MtFP1VJLy-6w,250,17,5,0,0
pqv1eFTFH7k,"[Verkauft] Tesla Model S 100D, Tesla-Garantie, FSD, MCU2, AP3, CCS, Pano, Slipstream, MwSt.",2021-07-06T15:24:15Z,UC5i6nCpwmDVKo98sZD2AAcQ,25645,672,389,0,0
cCNXLIOk5hg,Alster: Wahnsinn auf dem Wasser | Die Nordreportage | NDR Doku,2021-07-06T22:04:29Z,UCTPAHk1b-h-WGQn9cfGlw2Q,1330640,10584,2936,0,0
UY8HzCPMvcg,Unser erstes Vlog auf Deutsch | Koblenz Vlog,2021-07-06T09:21:32Z,UCKvcdXHMGE0xv6PIuIzzjKQ,2525,78,32,0,0
z1WROHrqI3Q,Mieten vs. Kaufen,2021-07-06T09:57:30Z,UCAtVq8dtR0OIQ30D9YGeXsA,127903,536,42,0,0
T2gIbVu_YKs,Tesla-Elektroauto für 25.000 Dollar – schon 2023 aus China?,2021-07-07T15:51:51Z,UCpPbcfwq0wOpWrC0gBs73tQ,11729,587,60,0,0
6-kh27ix-sY,"Hyundai IONIQ 5 2021 Auto-Test. Rundgang, Probefahrt, Erklärung, Verbrauch, Beschleunigung, Technik.",2021-07-07T00:45:00Z,UCX1oID0GF9NKfDvB4j0l2-Q,17020,251,37,0,0
EzvtN1DqtyI,Mein Fehlkauf des Tesla Model 3 SR+ PreModel 2020,2021-07-07T13:00:06Z,UCwHAKOZnvsOoUPH3BRYD74A,2584,60,40,0,0
RzdoaKZFcKM,Fußball Car Quiz in Rom - Das Finale!,2021-07-07T07:59:17Z,UChVx0GBQ7fE3P6jK05lEmUA,35805,2776,72,0,0
Ataj6LVcCFw,"Der NEUE 2021 VW Caddy: Was kann er? - Review, Fahrbericht, Test",2021-07-07T07:17:44Z,UCJZhnAf6ICDRGv2eEKzXBGA,46940,404,81,0,0
-TVFEqOT8DE,ich BETRÜGE bei einem YOUTUBER RENNEN!,2021-07-07T11:30:01Z,UCQ_hHJ0uTbzFLHrk1XHGXtw,392668,16609,285,0,0
YwaOVWcaqNI,E-Auto Elektroauto Peugeot ion Reparatur Scheinwerferschaden,2021-07-08T06:18:34Z,UChz9wRaaSzAC4PtRSBWJvpw,442,17,1,0,0
Rxkegg_8rBY,1.100€ RC Auto hebt ab bei 200 Km/h auf dem FLUGPLATZ! - Arrma Limitless Speedtest EXTREM!,2021-07-08T16:15:01Z,UCPFhnt7T8iaBLp1wIfFRzFw,388099,11457,465,0,0
3laDPbAE-yA,Big News bei Sono Motors zum Sion - Solar Elektroauto Probefahrt,2021-07-08T06:45:01Z,UCwQmqAG_8YlgakD8Dj0DZ4w,28837,984,404,0,0
sfo3-Cs7VZE,Der Praktikant 😱 fährt zum ersten mal Tesla Model 3 Performance ✌ und stellt Fragen | Q&A,2021-07-08T09:59:08Z,UC7yqj2im3lMTCEgAfLlu2XQ,901,54,7,0,0
KMQaRkQ20sA,Hyundai IONIQ 5 (2021) - Design Interview mit Chefdesigner Thomas Bürkle,2021-07-08T14:42:00Z,UCcftUjNsimynCrKGFolLRKQ,9371,306,50,0,0
baYyA9zXxks,Genesis G70 Shooting Brake (2021) So viel Luxus steckt im koreanischen Kombi! Review | Test | Preis,2021-07-08T09:00:27Z,UCy9Y4en2y1eR1zwcmFkRMzg,16900,325,72,0,0
--HUne_2-eo,STROMSPEICHER für BALKONKRAFTWERKE | Autarke Insel PV | Sonnenstrom überall nutzen,2021-07-08T11:59:37Z,UCaCaZ-vKtnMG2_FKmEePChQ,27010,799,52,0,0
LNB1rMvxPAI,Genesis G70 Shooting Brake - Erster exklusiver Kontakt,2021-07-08T06:56:06Z,UCVKe3-5kQRddaOHTdn-_Qbw,34441,475,134,0,0
l8C_fYu_LnM,Christof Johann testet den LEXUS UX 300e - das allererste Elektroauto aus dem Hause Toyota,2021-07-09T12:22:36Z,UCwxGKn-DRzrcZ29Oads6w9w,86,0,3,0,0
4Q3y0dXtFCE,XBUS Weltpremiere,2021-07-09T14:51:08Z,UCvFuuaEqHzZsowB0ctGwolg,172119,828,1,0,0
EyC3--JrTBc,2021 Mercedes-AMG G63 (585 HP),2021-07-09T18:12:09Z,UCyTHPMMaGFcc0tGFTEAaZ9w,598483,7597,169,0,0
MH3CbFu_ByU,"B.E.N-Challenge: Knapp 1.100 Kilometer, zwei Elektroautos, zwei Männer, e-tron vs. Mustang Mach-e",2021-07-09T12:30:31Z,UCsNdsFTTBj5jcRJSWeJ8-Xg,3215,255,31,0,0
ZANG_s2-3es,Lexus LC 500 Cabriolet: Luxusklasse mit V8 und 464 PS im Test | Review | 2021,2021-07-09T14:00:25Z,UCUKYv9dpFAbuLNWIgxuQQBA,5151,212,54,0,0
t6lRQlYlXg0,Polestar Precept - Dieser Design-Hammer kommt 2023 als Polestar 4 | 163 Grad,2021-07-09T16:58:32Z,UCbe4BpM5-Ta7MIlbKOofTDA,10876,620,47,0,0
t74vHC5-pDY,DS 4 im Test (2021) Das kann der schönste Kompakte der Welt! Review | Plug-in Hybrid | Preis | Motor,2021-07-09T18:07:42Z,UCy9Y4en2y1eR1zwcmFkRMzg,23521,299,57,0,0
fKBb7GSA4Og,Geht der heutige Tag in die Geschichte der Künstlichen Intelligenz ein? FSD beta 9 von Tesla ist da!,2021-07-09T17:13:02Z,UCrt6X6pXNRl5rRxaKbzCrvw,54864,2093,241,0,0
gN9d2E4Pn7M,Darum wollt ihr ihn haben! Porsche 911 GT3 (992) | UNTERWEGS mit Daniel Hohmeyer,2021-07-09T15:00:20Z,UCutQkZpAs9xG0KaooZlnuTw,85046,1889,162,0,0
XH6wxZOpEBs,"Walter Röhrl gegen Elektroauto, Tesla etc. Hat er Recht?",2021-07-10T21:29:54Z,UCMaxrt4JgqgOD-JSYE3Zwbg,417,17,36,0,0
n6AdlGDrgdY,"Das Beste aller Elektro-Welten mit Car Maniac | IONIQ 5, ENYAQ, ID.4, MACH-E, Q4 e-tron, iX3",2021-07-10T17:00:12Z,UCDDj2GWklzZ09X7R9OtsX3Q,85400,1855,304,0,0
2IKyX-ImABw,ELECTRIC vs PETROL - 2021 RS E-TRON GT vs R8 V10 GREEN HELL - FUTURE VS PRESENT - AUDIS FASTEST CARS,2021-07-10T17:00:13Z,UCs1V2QoEHzL-isndn6ngFhA,46569,1149,141,0,0
36nn42abR-w,"Eure Fragen beantwortet zu Elektroautos, Smarthome, Privatem und meinem Job als Youtuber",2021-07-10T07:00:12Z,UCM1jNA8DM90LE4ywxBe8RmA,185076,6357,388,0,0
l_T003rtIYk,Skoda ENYAQ iV - Meine 5 Highlights an diesem Elektroauto,2021-07-11T06:00:18Z,UCqQGYPEU7DiNA6bUUmehb8g,5296,256,89,0,0
gW0Ut7CP9_o,Volvo Concept Recharge (2022) | So sehen Volvos E-Autos von morgen aus | Neuvorstellung,2021-07-11T16:00:13Z,UCJrXOOtvmGn4CF7aYaJwuHA,12338,156,25,0,0
4wFrfDyYjz4,Mit dem Elektroauto nach Italien [Geht das?] [Reisebericht] #3 4K,2021-07-11T16:00:04Z,UCsEqyjImG72bzknyl8675Ag,411,11,2,0,0
zrgyuRw_TpQ,TOP 5 BEST RC CARS | Ferngesteuerte Autos,2021-07-11T16:00:34Z,UCfDnKCru5wbXj15LgQ5RY_w,95680,681,69,0,0
YyRGhsPZvqw,Depotupdate Juli - Diese Rendite hätte ich nicht erwartet - Traum vom Elektroauto,2021-07-11T08:52:38Z,UCKC9gZw2CxA8y9sgBA58Wnw,1803,53,27,0,0
HKV0atn7DSo,ID3 Langzeitverbrauch !,2021-07-11T13:00:03Z,UCRXTKScMyhaaQ6pvy4WdICQ,1615,55,39,0,0
UemLFC8no84,Cybertruck mit Allrad-Lenkung | Rekordzulassungen (Juni 2021) | Beste Batterie im Vergleich,2021-07-11T16:12:38Z,UCfcXVSmSaIluNJzDK4qofGw,2128,202,31,0,0
p7-tn-f5YCg,[NEU] Unser FACELIFT Tesla Model S (Perfekte Anpassung?),2021-07-11T07:00:11Z,UCBCT7EV5YrNLPvrhXYTHJuw,2152,304,25,0,0
Dg4r_9nZULk,ELEKTROAUTO fahren wird schon wieder TEURER: EWE kündigt Tariferhöhung an!,2021-07-12T16:52:09Z,UCsNdsFTTBj5jcRJSWeJ8-Xg,7424,692,342,0,0
E_jEciLZM_A,Warum ELEKTROAUTOS gut sind!,2021-07-12T17:49:36Z,UC5KTTotUrQRc2Br8WAoRpTQ,78,14,8,0,0
cJ8J13g0TmI,Elektroautos sind schmutziger als Verbrenner - Der Rechenfehler: Brandbrief an die EU schlägt Wellen,2021-07-12T06:00:08Z,UC4t0KuLYBiXqXF27UtjLxPw,555,84,61,0,0
aDd18m7neHE,Weltkleinste Wohnwagen: Nur 540kg. Carpento 310 Caravan. Holzbau-Handarbeit #shorts,2021-07-12T13:05:23Z,UCX1oID0GF9NKfDvB4j0l2-Q,4026,65,1,0,0
J3rg4gPdu3A,Opa bewertet meinen C63 AMG,2021-07-12T16:45:01Z,UCF6zuY4sOb88ewkIbzWgPrQ,106904,3589,236,0,0
eMri1soZ43w,"Wie sportlich ist der ID.4 GTX? VW ID.4 GTX Fahr-Test, Review I Motorvision Deutschland",2021-07-12T14:00:11Z,UCrPoTKfvNvJhG1Ngf6jHB1w,10492,80,14,0,0
vVL_ZXguT5o,"Ladeinfrastruktur, Assange, Kybernetik, Super Mario | Kurz informiert vom 12.07.2021 by heise online",2021-07-12T15:00:25Z,UCAszOEwa5CS4WFwYpkjdaUQ,2257,155,12,0,0
NSYbjlrTay0,Renault Captur Plug In Hybrid 2021 - 4.500€ Förderung,2021-07-12T23:00:11Z,UCX1oID0GF9NKfDvB4j0l2-Q,8794,85,12,0,0
QRqiuYg3N5k,"BREAKING LAB: Über Tesla, KI, Klima und das Arbeiten für Günther Jauch",2021-07-12T16:00:11Z,UCzsfkUFa1_4F4cZeSLv5dFQ,18092,749,93,0,0
k_rvEYzVpAU,⚡ Tagebucheintrag #162 EWE Go Preiserhöhung für Partner-Ladestationen,2021-07-12T12:05:08Z,UCMZbix9CwEuL6l9SJIb2Zxw,1017,58,56,0,0
DBSOCM3m2-A,Bentele hakt nach ... bei Grünen-Spitzenkandidatin Annalena Baerbock,2021-07-12T07:36:23Z,UCKxlSicaeUUgTm7kE7aMirg,10860,80,205,0,0
fMlbiPQr9QI,Mit dem Hyundai Ioniq 5 auf der Elektroauto-Rallye i-mobility 2021. Werden wir gewinnen?,2021-07-13T15:00:30Z,UCUKYv9dpFAbuLNWIgxuQQBA,21074,197,24,0,0
RAcEC9WFoHU,Der neue XBUS ist da! Impressionen der ersten Testfahrt,2021-07-13T09:52:07Z,UCvFuuaEqHzZsowB0ctGwolg,1453309,4901,8,0,0
ouAZsRXdll8,EINREISE-VERBOT an der Bosnischen Grenze,2021-07-13T10:01:22Z,UCC5rrO8jY__SeTXQjtbW1Jg,150706,7061,663,0,0
PXX0PCTu4NQ,YOUTUBER HÄUSER ZERSTÖREN als MONSTER in GTA 5 RP!,2021-07-13T15:22:44Z,UCQ_hHJ0uTbzFLHrk1XHGXtw,504088,19901,580,0,0
oTcBOFYpmKg,"Gerresheimer, RWE und VW - die meistgehandelten Aktien des Tages",2021-07-13T13:59:17Z,UC62IIFhchBWQxLPSyUatD-A,2429,70,3,0,0
9UGPFqMVaV0,"DIY Schweißgerät zum Elektroden schweißen! | Selbstgebaut, Eigenbau, Privat",2021-07-13T16:31:54Z,UC19tEGPtxdnSMZnoqYUVvzA,28442,353,49,0,0
qCYAnn25CSs,Die Wahrheit über Batterie Degradation   Haltbarkeit von Elektroauto Akkus vs  Smartphones,2021-07-14T22:05:22Z,UCw3hxTuZiV3sx2JWWg272yA,297,15,2,0,0
_rsWkLhdGfA,Hyundai IONIQ 5   Elektroauto Reichweiten Härtetest bei 130 kmh   inkl  einer Hammer Ladekurve,2021-07-14T23:29:34Z,UCw3hxTuZiV3sx2JWWg272yA,265,11,1,0,0
sjViki7ULek,2021 Volkswagen ID.4 First Look: : Die Elektroauto-Zukunft von VW ist da,2021-07-14T17:45:04Z,UCb0TzDxSishCfPBaxrfLPMA,33,1,1,0,0
